cate2,paragraph
규제샌드박스란 ?,"규제샌드박스란?
“규제샌드박스”란 기업들이 창의적인 아이디어를 펼쳐 새로운 제품·서비스 시도가 가능하도록 일정한 조건 하(시간·장소·규모)에서 기존규제의 일부 면제·유예를 통해 테스트를 허용하는 제도를 말합니다(규제정보포털, 『규제샌드박스 홈페이지』 참조).
도입방식
「행정규제기본법」 및 4개 분야별 법률(「정보통신 진흥 및 융합 활성화 등에 관한 특별법」, 「산업융합 촉진법」, 「규제자유특구 및 지역특화발전특구에 관한 규제특례법」, 「금융혁신지원 특별법」) 체계로 도입하여, 「행정규제기본법」에서는 포괄적 네거티브 규제 전환의 기본방향과 원칙을 규정하고, 4개 분야별 법률에서는 각 분야별 규제 특례 부여 방식과 사후책임 확보 방안 등에 대해 규정하고 있습니다(규제정보포털, 『규제샌드박스 홈페이지』 참조).
규제샌드박스 및 ICT 규제샌드박스의 주요 내용
신기술·신산업의 육성과 국민의 생명·안전·환경 등 공익적 가치 보호를 균형 있게 추구하고 새로운 융합 제품·서비스가 기존 규제에 막혀 지체되는 일이 없도록 다음의 규제혁신 3종 세트를 새롭게 도입하였습니다(규제정보포털, 『규제샌드박스 홈페이지』 참조).
정보통신 진흥 및 융합 활성화를 위하여 「정보통신 진흥 및 융합 활성화 등에 관한 특별법」에는 다음과 같은 4종류의 규제혁신 절차를 규정하고 있습니다.
종류 제 도 소 개
① 신속처리 정보통신융합 등 신기술·서비스에 대한 법령 적용 여부 또는 허가 등의 필요 여부를 신속하게 확인해 주는 서비스  ☞ 새롭게 시작하려는 사업에 허가가 필요한지, 규제가 있는 건 아닌지 확인이 필요한 경우 이용하는 제도
② 임시허가 정보통신융합 등 신기술·서비스에 대한 근거법령이 없거나 명확하지 않은 경우 신속한 사업화가 가능하도록 임시로 허가해주는 서비스 ☞ 새롭게 시작하려는 사업에 대한 법령이 없거나 명확하지 않아 사업 시작 자체가 어려울 경우 임시허가 부여를 위해 이용하는 제도
③ 실증을 위한 규제특례 규제로 인해 정보통신융합 등 신기술·서비스 사업의 시행이 불가능한 경우, 규제를 적용하지 않고 시험·검증을 임시로 허용해주는 서비스 ☞ 새롭게 시작하려는 사업에 대한 규제로 실험 등이 불가능한 경우 이용하는 제도
소비자 등 일반 국민을 두텁게 보호하기 위해 다음의 안전장치 3종 세트를 구비하였습니다(규제정보포털, 『규제샌드박스 홈페이지』 참조).
구분 내용
① 생명·안전·환경 분야 저해 여부 고려 ▪ 국민의 생명·안전·환경 등에 끼치는 영향에 대한 우려가 있는 경우 규제 특례 제한
② 문제 예상 및 발생 시 규제 특례 취소 ▪ 실증테스트 진행 과정 지속적 점검, 문제가 예상되거나 발생할 경우 규제 특례 취소
③ 손해배상 감독 강화 ▪ 책임보험 가입 의무화, 고의나 과실 없음을 사업자가 입증토록 하는 등 손해배상 책임 수준 강화
기대효과
규제샌드박스는 기업, 소비자, 규제당국 모두에게 이로운(win-win) 제도로써, 다음의 기대효과가 예상됩니다(규제정보포털, 『규제샌드박스 홈페이지』 참조).
구분 내용
① 기업 글로벌 혁신경쟁에서 우위 선점에 유리한 환경 조성 ▪ 스타트업의 아이디어 + 대기업의 인프라 “상생 모델” ▪ 규제 관련 불확실성 완화 → 유·무형의 비용절감 효과
② 소비자 혁신 제품·서비스에 대한 선택권 확대 및 편리성 향상 ▪ 소비자 선택권 확대, 편리성 향상 ▪ 신기술·신산업 분야 일자리 창출
③ 규제당국 시범사업 결과를 바탕으로 정교한 규제체계 설계 가능 ▪ 실증 테스트를 바탕으로 한 스마트한 규제체계 ▪ 신기술·산업 분야 최적의 규제방안 마련
※ 이 콘텐츠에서는 「정보통신 진흥 및 융합 활성화 등에 관한 특별법」에 따른 에 대한 정보를 제공하며 금융규제, 산업융합, 규제자유특구에 대한 내용은 다음의 콘텐츠에서 확인할 수 있습니다.▪ 금융규제 샌드박스(「금융혁신지원 특별법」)▪ 산업융합 규제샌드박스(「산업융합 촉진법」)▪ 규제자유특구(지역단위 규제샌드박스)[「규제자유특구 및 지역특화발전특구에 관한 규제특례법」]"
ICT 규제샌드박스란?,"ICT란?
“ICT”란 정보통신기술(Information and Communication Technology)의 약자로서 정보 기술(Information Technology, IT)과 통신 기술(Communication Technology, CT)의 합성어로서, 전기통신설비 또는 컴퓨터 등을 이용하거나 활용한 정보의 수집·가공·저장·처리·검색·송신·수신 및 서비스 제공 등과 관련되는 기술을 말합니다(「정보통신 진흥 및 융합 활성화 등에 관한 특별법」 제2조제1항제1호 참조).
ICT 규제 샌드박스란 규제 샌드박스 중에서 ICT기술이 결합된 서비스를 대상으로 하는 제도입니다.
우선허용, 사후규제 원칙
누구든지 신규 정보통신 및 정보통신융합(이하 “정보통신융합 등”이라 함) 기술·서비스를 활용하여 사업을 할 수 있으나, 신규 정보통신융합 등의 기술·서비스를 활용하는 과정에서 국민의 생명과 안전을 저해하는 경우가 발생하면 국가와 지방자치단체에 의해 제한을 받을 수 있습니다(「정보통신 진흥 및 융합 활성화 등에 관한 특별법」 제3조의2제1항).
정보통신 진흥 및 융합 활성화를 위한 국가의 의무
과학기술정보통신부장관은 정보통신 진흥 및 융합 활성화를 위하여 3년 단위의 기본계획을 3년마다 수립하여 시행하되, 필요한 경우 수립주기를 단축하거나 기본계획을 변경할 수 있습니다(「정보통신 진흥 및 융합 활성화 등에 관한 특별법」 제5조제1항).
관계 중앙행정기관의 장은 기본계획을 구체화하기 위하여 정보통신 진흥 및 융합 활성화 실행계획을 매년 수립하여 시행해야 합니다(「정보통신 진흥 및 융합 활성화 등에 관한 특별법」 제6조제1항)."
신속처리 신청 등,"신속처리제도란?
“신속처리제도”란 정보통신 및 정보통신융합(이하 “정보통신융합 등”이라 함) 신기술·서비스에 대한 법령 적용 여부 또는 허가 등의 필요 여부를 신속하게 확인해 주는 서비스를 말합니다(「정보통신 진흥 및 융합 활성화 등에 관한 특별법」 제36조 참조).
신속처리의 신청
신규 정보통신융합 등 기술·서비스를 활용하여 사업을 하려는 자는 과학기술정보통신부장관에게 해당 사업에 대한 신규 정보통신융합 등의 기술·서비스와 관련된 법령에 따른 허가·승인·등록·인가·검증 등(이하 “허가 등”이라 함)의 필요 여부 등을 확인해 줄 것을 신청할 수 있습니다(「정보통신 진흥 및 융합 활성화 등에 관한 특별법」 제36조제1항).
신청서 및 첨부서류
신속처리를 신청하려는 자는 다음의 서류를 과학기술정보통신부장관에게 제출해야 합니다(「정보통신 진흥 및 융합 활성화 등에 관한 특별법 시행령」 제39조제1항 및 「정보통신 진흥 및 융합 활성화 등에 관한 특별법 시행규칙」 제7조제1항).
신속처리신청서(「정보통신 진흥 및 융합 활성화 등에 관한 특별법 시행규칙」 별지 제9호서식)
신규 정보통신융합 등 기술·서비스에 대한 설명서
관계기관에의 통보
과학기술정보통신부장관은 신속처리 신청을 받은 경우 신청사실 및 신청내용을 관계 중앙행정기관 및 지방자치단체(이하 ""관계기관""이라 함)의 장에게 통보해야 합니다(「정보통신 진흥 및 융합 활성화 등에 관한 특별법」 제36조제2항).
보완요청
과학기술정보통신부장관 및 관계기관의 장은 신청 내용에 보완이 필요하다고 판단되는 경우에는 보완에 필요한 상당한 기간을 정하여 보완을 요구할 수 있습니다(「정보통신 진흥 및 융합 활성화 등에 관한 특별법 시행령」 제39조제2항 전단).
회신
관계기관의 장은 신속처리 신청사실을 통보받은 날부터 30일 이내에 신규 정보통신융합 등 기술·서비스의 소관 업무 여부 및 허가 등의 필요 여부를 과학기술정보통신부장관에게 회신해야 합니다(「정보통신 진흥 및 융합 활성화 등에 관한 특별법」 제36조제3항 전단).
관계기관의 장은 신속처리 신청이 관계 법령에 따른 허가 등이 필요하다고 판단할 경우에는 허가 등에 필요한 조건 및 절차 등을 함께 회신해야 합니다(「정보통신 진흥 및 융합 활성화 등에 관한 특별법」 제36조제6항).
관계기관의 장이 30일 이내에 회신하지 않을 경우에는 소관 업무에 해당하지 않거나 해당 관계기관의 장의 허가 등이 필요하지 않은 것으로 봅니다(「정보통신 진흥 및 융합 활성화 등에 관한 특별법」 제36조제3항 후단).
과학기술정보통신부장관 및 관계기관의 장이 신청인에게 보완요청을 한 경우 그 보완에 소요되는 기간은 30일에 포함되지 않습니다(「정보통신 진흥 및 융합 활성화 등에 관한 특별법 시행령」 제39조제2항 후단).
결과통지
과학기술정보통신부장관은 회신(과학기술정보통신부 소관 법령에 따른 허가 등의 필요 여부 포함) 결과 또는 임시허가 필요 여부 등을 신청인에게 즉시 통지해야 합니다(「정보통신 진흥 및 융합 활성화 등에 관한 특별법」 제36조제4항).
신청인에 대한 통지는 신속처리 결과통지서를 작성해 보내면 됩니다(「정보통신 진흥 및 융합 활성화 등에 관한 특별법 시행령」 제39조제3항, 「정보통신 진흥 및 융합 활성화 등에 관한 특별법 시행규칙」 제7조제2항 및 별지 제9호의2서식).
절차도
<ICT 규제샌드박스 홈페이지 – 신속처리>
관계 법령에 따른 허가 신청
신청인은 허가 등이 필요한 경우에는 해당 조건 및 절차 등에 따라 허가 등을 신청해야 하고, 관계기관의 장은 관계 법령에 따라 이를 신속하게 처리해야 합니다(「정보통신 진흥 및 융합 활성화 등에 관한 특별법」 제36조제6항 참조).
신청인의 기술·서비스 출시
해당 신청인은 과학기술정보통신부장관으로부터 받은 통지가 과학기술정보통신부장관 또는 관계기관의 장의 허가 등이 필요하거나 임시허가가 필요하다는 내용인 경우를 제외하고는 자유로이 신규 정보통신융합 등 기술·서비스를 출시할 수 있습니다(「정보통신 진흥 및 융합 활성화 등에 관한 특별법」 제36조제5항)."
임시허가 신청,"임시허가제도란?
“임시허가제도”란 정보통신 및 정보통신융합(이하 “정보통신융합 등”이라 함) 신기술·서비스에 대한 근거법령이 없거나 명확하지 않은 경우 신속한 사업화가 가능하도록 임시로 허가해주는 서비스를 말합니다(「정보통신 진흥 및 융합 활성화 등에 관한 특별법」 제37조 참조).
임시허가의 신청
신규 정보통신융합 등 기술·서비스를 활용하여 사업을 하려는 자는 다음 각 호의 어느 하나에 해당하는 경우(이하 “임시허가 신청사유”라 함) 해당 기술·서비스의 시장출시 등 사업화를 위해 과학기술정보통신부장관에게 임시로 허가·승인·등록·인가·검증 등(이하 “허가 등”이라 함)을 신청할 수 있습니다(「정보통신 진흥 및 융합 활성화 등에 관한 특별법」 제37조제1항).
허가 등의 근거가 되는 법령에 해당 신규 정보통신융합 등의 기술·서비스에 맞는 기준·규격·요건 등이 없는 경우
허가 등의 근거가 되는 법령에 따른 기준·규격·요건 등을 적용하는 것이 불명확하거나 불합리한 경우
관계기관의 임시허가 요청
관계 중앙행정기관 및 지방자치단체(이하 “관계기관”이라 함)의 장은 신규 정보통신융합 등의 기술·서비스에 대하여 위의 임시허가 신청사유를 이유로 허가 등을 하지 못하는 경우에는 신청인의 의견을 들어 과학기술정보통신부장관에게 임시허가를 요청해야 합니다(「정보통신 진흥 및 융합 활성화 등에 관한 특별법」 제37조제2항).
신청서 및 첨부서류
임시허가를 신청하려는 자 및 임시허가를 요청하려는 관계기관의 장은 다음의 서류를 과학기술정보통신부장관에게 제출해야 합니다(「정보통신 진흥 및 융합 활성화 등에 관한 특별법 시행령」 제40조제1항 및 「정보통신 진흥 및 융합 활성화 등에 관한 특별법 시행규칙」 제8조제1항).
임시허가신청서(「정보통신 진흥 및 융합 활성화 등에 관한 특별법 시행규칙」 별지 제11호서식)
다음 내용을 담은 사업계획서
√ 신규 정보통신융합 등 기술·서비스의 명칭 및 내용
√ 신규 정보통신융합 등 기술·서비스의 사업범위·추진방법·추진일정
신규 정보통신융합 등 기술·서비스가 임시허가 신청사유에 해당함을 설명하는 자료
신규 정보통신융합 등 기술·서비스의 안전성 검증 자료 및 이용자 보호방안
그 밖에 임시허가에 필요하다고 인정되는 것으로서 과학기술정보통신부장관이 요구하는 자료
절차도
<ICT 규제샌드박스 홈페이지 – 임시허가>"
임시허가 신청에 대한 심사 및 유효기간,"관계기관과의 협의
과학기술정보통신부장관은 임시허가 신청이나 관계 중앙행정기관 및 지방자치단체(이하 “관계기관”이라 한다)의 장의 임시허가 요청을 받은 경우 신청내용을 관계기관의 장에게 통보해야 합니다(「정보통신 진흥 및 융합 활성화 등에 관한 특별법 시행령」 제40조제4항 본문).
관계기관의 결과회신
관계기관의 장은 통보를 받은 해당 신청내용을 검토하여 그 결과를 30일 이내에 과학기술정보통신부장관에게 문서로 회신해야 합니다(「정보통신 진흥 및 융합 활성화 등에 관한 특별법 시행령」 제40조제4항 본문).
다만, 관계기관의 장이 신청내용을 검토하기 위하여 임시허가 신청자에게 보완을 요구한 경우 보완에 걸린 기간은 해당 기간에 산입하지 않되, 이 경우에도 90일 이내에는 검토 결과를 회신해야 합니다(「정보통신 진흥 및 융합 활성화 등에 관한 특별법 시행령」 제40조제4항 단서).
임시허가와 관련이 있는 관계기관의 장은 소속 공무원에게 임시허가의 심사절차에 참여하게 해야 하며, 과학기술정보통신부장관에게 임시허가에 관한 의견을 제출할 수 있습니다(「정보통신 진흥 및 융합 활성화 등에 관한 특별법」 제37조제11항).
임시허가 신청의 반려
과학기술정보통신부장관은 다음 중 어느 하나에 해당하는 경우에는 임시허가 신청을 반려할 수 있습니다(「정보통신 진흥 및 융합 활성화 등에 관한 특별법 시행령」 제40조제3항).
신청내용이 임시허가 신청사유(「정보통신 진흥 및 융합 활성화 등에 관한 특별법」 제37조제1항)에 해당하지 않음이 명백한 경우
임시허가 신청 서류를 제출하지 않거나 보완요구에 응하지 않은 경우
시험 및 검사의 실시
과학기술정보통신부장관은 임시허가를 위하여 시험 및 검사를 실시하거나 해당 전문 인력과 기술을 갖춘 기관 또는 단체를 시험·검사기관으로 지정할 수 있습니다(「정보통신 진흥 및 융합 활성화 등에 관한 특별법」 제37조제4항).
신청인은 시험 및 검사에 필요한 비용을 부담해야 합니다(「정보통신 진흥 및 융합 활성화 등에 관한 특별법 시행령」 제40조제7항).
신기술·서비스심의위원회의 상정
과학기술정보통신부장관은 임시허가 신청이나 관계기관의 임시허가 요청이 있는 경우에는 관계기관과 협의한 후 그 결과를 포함하여 신기술·서비스심의위원회(이하 “심의위원회”라 함)에 임시허가 신청을 상정해야 합니다(「정보통신 진흥 및 융합 활성화 등에 관한 특별법」 제37조제3항 전단).
※ 심의위원회의 구성☞ 과학기술정보통신부장관은 임시허가와 실증을 위한 규제특례에 관한 사항을 전문적으로 심의·의결하기 위하여 심의위원회를 구성·운영합니다(「정보통신 진흥 및 융합 활성화 등에 관한 특별법」 제10조의2제1항).☞ 심의위원회의 위원장은 과학기술정보통신부장관이 되고, 위원은 20명의 범위에서 과학기술정보통신부장관이 다음 중 어느 하나에 해당하는 사람으로 위촉(민간위원의 수는 위원장을 포함한 위원 수의 2분의 1 이상)합니다(「정보통신 진흥 및 융합 활성화 등에 관한 특별법」 제10조의2제2항).√ 다음에 해당하는 사람 중에서 심의 대상이 되는 신규 정보통신 및 정보통신융합(이하 “정보통신융합 등”이라 함) 기술·서비스 관계기관의 장이 추천하는 사람(「정보통신 진흥 및 융합 활성화 등에 관한 특별법 시행령」 제8조의2제1항)1. 정보통신융합 등 기술·서비스 관련 연구소 또는 기업에서 5년 이상 근무하고 있는 사람2. 정보통신융합등 기술·서비스 관련 분야의 기술사로서 경력이 5년 이상인 사람3. 변호사·변리사의 자격이 있는 사람으로서 경력이 5년 이상인 사람4. 대학에서 부교수 이상의 직에 있는 사람√ 다음에 해당하는 중앙행정기관의 차관 또는 차관급 공무원(지방자치단체의 경우에는 해당 지방자치단체의 장이 지정하는 공무원)[「정보통신 진흥 및 융합 활성화 등에 관한 특별법 시행령」 제8조의2제2항]1. 산업통상자원부2. 보건복지부3. 국토교통부4. 금융위원회√ 그 밖에 과학기술정보통신부장관이 필요하다고 인정하는 사람☞ 심의위원회 위원은 성별을 고려하여 구성하되, 민간위원의 임기는 2년으로 하며, 한 번만 연임할 수 있습니다(「정보통신 진흥 및 융합 활성화 등에 관한 특별법 시행령」 제8조의2제3항).☞ 심의위원회 업무의 원활한 운영을 위하여 정보통신산업진흥원, 대한상공회의소 및 과학기술정보통신부장관이 지정하는 정보통신융합등 관련 전문기관·단체가 그 사무를 보조합니다(「정보통신 진흥 및 융합 활성화 등에 관한 특별법 시행령」 제42조의7제1항제1호).
심의위원회의 심의기준
심의위원회는 다음의 사항을 고려하여 임시허가 여부를 심의·의결해야 합니다(「정보통신 진흥 및 융합 활성화 등에 관한 특별법 시행령」 제40조제5항).
√ 해당 기술·서비스의 혁신성
√ 관련 시장 및 이용자 편익에 미치는 영향 및 효과
√ 해당 기술·서비스의 안전성 및 이용자 보호방안의 타당성
√ 해당 기술·서비스 제공을 위한 재정적·기술적 능력
√ 임시허가를 위해 실시한 시험 및 검사 결과
√ 그 밖에 심의위원회 위원장이 해당 기술·서비스의 특성에 따라 필요하다고 인정한 사항
임시허가의 결정
과학기술정보통신부장관은 심의위원회의 심의·의결을 거쳐 임시허가를 할 수 있습니다. 이 경우 과학기술정보통신부장관은 신규 정보통신융합 등 기술·서비스의 안정성 확보 및 이용자 보호 등을 위해 필요한 조건을 붙일 수 있습니다(「정보통신 진흥 및 융합 활성화 등에 관한 특별법」 제37조제3항).
과학기술정보통신부장관은 임시허가를 하는 경우 다음의 사항을 적은 임시허가증을 발급하고, 그 사실을 관보 또는 인터넷 홈페이지에 공고해야 합니다(「정보통신 진흥 및 융합 활성화 등에 관한 특별법 시행령」 제40조제6항).
허가번호 및 허가 연월일
상호 또는 명칭 및 대표자 성명
주된 사무소의 소재지
허가 대상 기술·서비스의 명칭
허가 대상 기술·서비스의 주요내용
유효기간
허가 조건
임시허가의 유효기간은 2년이나, 과학기술정보통신부장관이 필요하다고 인정하는 경우에는 유효기간을 단축할 수 있습니다(「정보통신 진흥 및 융합 활성화 등에 관한 특별법」 제37조제5항 본문 및 「정보통신 진흥 및 융합 활성화 등에 관한 특별법 시행령」 제41조제1항).
임시허가 유효기간의 연장
유효기간의 만료 전에 임시허가의 대상이 되는 신규 정보통신융합 등 기술·서비스에 대한 허가 등의 근거가 되는 법령이 정비되지 않은 경우 과학기술정보통신부장관은 유효기간을 1회 연장할 수 있습니다(「정보통신 진흥 및 융합 활성화 등에 관한 특별법」 제37조제5항 단서).
유효기간을 연장받으려는 자는 유효기간 만료 2개월 전에 다음 서류를 과학기술정보통신부장관에게 제출해야 합니다(「정보통신 진흥 및 융합 활성화 등에 관한 특별법」 제37조제5항 단서 및 「정보통신 진흥 및 융합 활성화 등에 관한 특별법 시행령」 제41조제2항).
임시허가 유효기간 연장 신청서
해당 신규 정보통신융합 등 기술·서비스의 이용현황 및 실적에 관한 자료
임시허가증 사본
위반 시 제재
거짓이나 그 밖의 부정한 방법으로 임시허가를 받은 자는 3년 이하의 징역 또는 3천만원 이하의 벌금에 처해 집니다(「정보통신 진흥 및 융합 활성화 등에 관한 특별법」 제44조제1항제2호).
법인·단체의 대표자나 법인·단체 또는 개인의 대리인, 사용인, 그 밖의 종업원이 거짓이나 그 밖의 부정한 방법으로 임시허가를 받은 경우에는 그 행위자를 벌하는 외에 그 법인·단체 또는 개인에게도 해당 조문의 벌금형이 부과됩니다(「정보통신 진흥 및 융합 활성화 등에 관한 특별법」 제45조 본문).
다만, 법인·단체 또는 개인이 그 위반행위를 방지하기 위해 해당 업무에 관하여 상당한 주의와 감독을 게을리 하지 않은 경우는 제외됩니다(「정보통신 진흥 및 융합 활성화 등에 관한 특별법」 제45조 단서)."
