cate2,paragraph
임시허가 후 후속처리,"관계기관의 법령 정비 및 통지
관계기관의 장은 임시허가 유효기간의 만료 전에 해당 신규 정보통신 및 정보통신융합(이하 “정보통신융합 등”이라 함) 기술·서비스에 대한 허가·승인·등록·인가·검증 등(이하 “허가 등”이라 함)의 근거가 되는 법령이 정비되도록 노력해야 합니다(「정보통신 진흥 및 융합 활성화 등에 관한 특별법」 제37조제6항).
관계기관의 장은 법령정비가 완료된 경우 지체 없이 과학기술정보통신부장관에게 통지를 해야 합니다(「정보통신 진흥 및 융합 활성화 등에 관한 특별법 시행령」 제41조제3항).
과학기술정보통신부장관은 법령정비 완료 통지를 받으면 임시허가를 받은 자에게 법령정비 사실을 통지해야 합니다(「정보통신 진흥 및 융합 활성화 등에 관한 특별법 시행령」 제41조제4항).
허가 등의 신청
임시허가를 받은 자는 해당 신규 정보통신융합 등 기술·서비스에 대한 허가 등의 근거가 되는 법령이 정비된 경우 지체 없이 그 법령에 따라 허가 등을 받아야 합니다(「정보통신 진흥 및 융합 활성화 등에 관한 특별법」 제37조제7항).
책임보험 등의 가입
임시허가를 받아 해당 신규 정보통신융합 등 기술·서비스를 제공하려는 자는 그 기술·서비스로 인해 이용자에게 인적·물적 손해를 발생하게 할 경우 고의 또는 과실이 없음을 증명하지 않는 한 이를 배상할 책임을 부담합니다(「정보통신 진흥 및 융합 활성화 등에 관한 특별법」 제37조제8항).
임시허가를 받은 자는 이용자에 대한 손해배상책임을 이행하기 위해 책임보험 등에 가입한 후 가입사실을 증명하는 자료를 신규 정보통신융합 등 기술·서비스 개시 전까지 과학기술정보통신부장관에게 제출해야 합니다(「정보통신 진흥 및 융합 활성화 등에 관한 특별법」 제37조제9항 본문 및 「정보통신 진흥 및 융합 활성화 등에 관한 특별법 시행령」 제42조제1항).
과학기술정보통신부장관은 중소기업 또는 중견기업에게 책임보험 등의 보험료 일부를 지원할 수 있습니다(「정보통신 진흥 및 융합 활성화 등에 관한 특별법 시행령」 제42조제5항).
이를 위반하여 책임보험 등에 가입하지 않은 자(별도의 배상방안을 마련한 경우 제외)에게는 1천만원 이하의 과태료가 부과됩니다(「정보통신 진흥 및 융합 활성화 등에 관한 특별법」 제46조제1항제1호).
임시허가를 받은 자가 책임보험 등에 가입할 수 없는 경우에는 다음 자료를 과학기술정보통신부장관에게 제출하고 신규 정보통신융합 등 기술·서비스 개시 전까지 과학기술정보통신부장관과 협의를 통해 배상방안을 마련해야 합니다(「정보통신 진흥 및 융합 활성화 등에 관한 특별법 시행령」 제42조의2).
책임보험 등에 가입이 불가능한 사유서
이용자에게 손해가 발생할 경우 배상기준·방법 및 절차를 포함한 이용자 손해배상계획서(손해배상금액은 아래의 해당 금액에 준하는 수준이어야 함)
※ 책임보험의 손해배상 기준☞ 임시허가를 받은 자가 가입해야 하는 책임보험 등의 보험금액은 다음의 기준을 충족해야 합니다(「정보통신 진흥 및 융합 활성화 등에 관한 특별법 시행령」 제42조제3항).1. 사망한 경우에는 1인당 1억5천만원(실손해액을 초과할 수 없음, 다만, 실손해액이 2천만원 미만인 경우에는 2천만원임)2. 부상을 당한 경우에는 1인당 3천만원(실손해액을 초과할 수 없음)3. 부상에 대한 치료를 마친 후 더 이상의 치료효과를 기대할 수 없고 그 증상이 고정된 상태에서 그 부상이 원인이 되어 신체의 장애(이하 “후유장애”라 함)가 생긴 경우에는 1인당 1억 5천만원(실손해액을 초과할 수 없음)4. 재물이 멸실되거나 훼손된 경우에는 사고당 10억원(실손해액을 초과할 수 없음)☞ 하나의 사건으로 위의 1.부터 3.까지 중 둘 이상에 해당하게 된 경우에는 실손해액을 초과하지 않는 범위에서 다음 구분에 따라 보험금을 지급받게 됩니다(「정보통신 진흥 및 융합 활성화 등에 관한 특별법 시행령」 제42조제4항).가. 부상자가 치료 중에 그 부상이 원인이 되어 사망한 경우에는 위의 (1.+ 2.)에 해당하는 금액나. 부상자에게 그 부상이 원인이 되어 후유장애가 생긴 경우에는 위의 (2.+ 3.) 에 해당하는 금액다. 3.의 금액을 지급한 후 그 부상이 원인이 되어 사망한 경우에는 (1. 3. 지급액 중 사망한 날 이후에 해당하는 손해액)에 해당하는 금액
책임보험 등의 보험기간 만료일은 임시허가의 만료일 이후여야 하며, 유효기간을 연장하는 경우에는 책임보험 등을 갱신해야 합니다(「정보통신 진흥 및 융합 활성화 등에 관한 특별법 시행령」 제42조제2항 전단).
임시허가를 받은 자는 갱신한 날부터 30일 이내에 갱신한 책임보험 등 증서 사본을 과학기술정보통신부장관에게 제출해야 합니다(「정보통신 진흥 및 융합 활성화 등에 관한 특별법 시행령」 제42조제2항 후단).
이용자에 대한 통지
임시허가를 받은 자는 해당 신규 정보통신융합 등 기술·서비스의 이용자에게 임시허가를 받은 사실과 유효기간을 통지해야 합니다(「정보통신 진흥 및 융합 활성화 등에 관한 특별법」 제37조제10항).
임시허가의 취소
과학기술정보통신부장관은 임시허가를 받은 자가 다음 중 어느 하나에 해당하는 경우에는 시정을 명하거나(1회에 한정), 신기술·서비스심의위원회(이하 “심의위원회”라 함)의 심의·의결을 거쳐 임시허가를 취소할 수 있습니다(「정보통신 진흥 및 융합 활성화 등에 관한 특별법」 제38조제1항 및 제2항).
거짓이나 그 밖의 부정한 방법으로 임시허가를 받은 경우(임시허가를 취소해야만 함)
과학기술정보통신부장관이 신규 정보통신융합 등 기술·서비스의 안정성 확보 및 이용자 보호 등을 위하여 붙인 필요조건(「정보통신 진흥 및 융합 활성화 등에 관한 특별법」 제37조제3항 후단)을 충족하지 못한 경우
해당 신규 정보통신융합 등 기술·서비스에 대한 허가 등의 근거가 되는 법령이 정비되었음에도 허가 등을 받지 않은 경우(「정보통신 진흥 및 융합 활성화 등에 관한 특별법」 제37조제7항)
심의위원회의 심사기준을 충족하지 못하게 된 경우
과학기술정보통신부장관이 임시허가를 취소하려는 경우에는 청문절차를 거쳐야 합니다(「정보통신 진흥 및 융합 활성화 등에 관한 특별법」 제40조제2호).
임시허가가 취소된 자는 해당 기술·서비스를 판매·이용 또는 제공 등을 해서는 안 됩니다(「정보통신 진흥 및 융합 활성화 등에 관한 특별법」 제38조제3항).
임시허가가 취소된 후 해당 기술·서비스를 판매·이용 또는 제공 등을 한 경우에는 1천만원 이하의 과태료가 부과됩니다(「정보통신 진흥 및 융합 활성화 등에 관한 특별법」 제46조제1항제2호)."
규제특례 신청,"실증을 위한 규제특례란?
“실증을 위한 규제특례”란 규제로 인해 정보통신 및 정보통신융합(이하 “정보통신융합 등”이라 함) 신기술·서비스 사업의 시행이 불가능한 경우, 규제를 적용하지 않고 시험·검증을 임시로 허용해주는 서비스를 말합니다(「정보통신 진흥 및 융합 활성화 등에 관한 특별법」 제38조의2 참조).
신청사유
신규 정보통신융합 등 기술·서비스를 활용하여 사업을 하려는 자는 다음 중 어느 하나(이하 “실증규제특례 신청사유”라 함)에 해당하여 사업 시행이 어려울 경우에는 해당 기술·서비스에 대한 제한적 시험·기술적 검증(이하 “실증”이라 함)을 위해 과학기술정보통신부장관에게 관련 규제의 전부 또는 일부를 적용하지 않는 실증을 위한 규제특례를 신청할 수 있습니다(「정보통신 진흥 및 융합 활성화 등에 관한 특별법」 제38조의2제1항).
신규 정보통신융합 등 기술·서비스가 다른 법령의 규정으로 허가·승인·등록·인가·검증 등(이하 “허가 등”이라 함)을 신청하는 것이 불가능한 경우
허가 등의 근거가 되는 법령에 따른 기준·규격·요건 등을 적용하는 것이 불명확하거나 불합리한 경우
신청서 및 첨부서류
실증을 위한 규제특례를 신청하려는 자는 다음의 서류를 과학기술정보통신부장관에게 제출해야 합니다(「정보통신 진흥 및 융합 활성화 등에 관한 특별법 시행령」 제42조의4제1항 및 「정보통신 진흥 및 융합 활성화 등에 관한 특별법 시행규칙」 제10조제1항).
실증을 위한 규제특례신청서(「정보통신 진흥 및 융합 활성화 등에 관한 특별법 시행규칙」 별지 제13호서식)
다음 내용을 담은 규제특례 계획서
√ 신규 정보통신융합 등 기술·서비스의 명칭 및 내용
√ 신규 정보통신융합 등 기술·서비스의 사업범위·추진방법·추진일정
√ 신규 정보통신융합 등 기술·서비스에 대한 실증과 관련한 신청자의 재정적·기술적 능력
√ 신규 정보통신융합 등 기술·서비스의 실증을 위해 필요한 규제특례의 내용·기간 및 관련 법령
신규 정보통신융합 등 기술·서비스가 실증규제특례 신청사유에 해당함을 설명하는 자료
신규 정보통신융합 등 기술·서비스의 이용자 보호방안
그 밖에 실증을 위한 규제특례에 필요하다고 인정하는 것으로서 과학기술정보통신부장관이 요구하는 자료
절차도
<ICT 규제샌드박스 홈페이지 – 실증규제특례>"
규제특례 신청에 대한 심사 및 유효기간,"관계기관에의 통보
과학기술정보통신부장관은 신규 정보통신 및 정보통신융합(이하 “정보통신융합 등”이라 함) 기술·서비스에 대한 제한적 시험·기술적 검증(이하 “실증”이라 함)을 위한 규제특례 신청을 받은 경우 신청내용을 관계기관의 장에게 통보해야 합니다(「정보통신 진흥 및 융합 활성화 등에 관한 특별법」 제38조의2제2항).
관계기관의 결과회신
관계기관의 장은 통보를 받은 해당 신청내용을 검토하여 그 결과를 30일 이내에 과학기술정보통신부장관에게 문서로 회신해야 합니다(「정보통신 진흥 및 융합 활성화 등에 관한 특별법」 제38조의2제5항 본문).
다만, 관계기관의 장이 실증을 위한 규제특례의 지정 여부를 검토하기 위해 신청자에게 자료 보완을 요구한 경우 보완에 걸린 기간은 해당 기간에 산입하지 않되, 이 경우에도 90일 이내에는 검토결과를 회신해야 합니다(「정보통신 진흥 및 융합 활성화 등에 관한 특별법」 제38조의2제5항 단서).
실증을 위한 규제특례 신청의 반려
과학기술정보통신부장관은 다음 중 어느 하나에 해당하는 경우에는 실증을 위한 규제특례의 신청을 반려할 수 있습니다(「정보통신 진흥 및 융합 활성화 등에 관한 특별법 시행령」 제42조의4제3항).
신청내용이 실증을 위한 규제특례 신청사유(「정보통신 진흥 및 융합 활성화 등에 관한 특별법」 제38조의2제1항)에 해당하지 않음이 명백한 경우
실증을 위한 규제특례 신청 서류를 제출하지 않거나 보완요구에 응하지 않은 경우
신기술·서비스심의위원회의 상정
과학기술정보통신부장관은 실증을 위한 규제특례에 관한 관계기관의 장의 검토 결과를 붙여 실증을 위한 규제특례의 지정 여부를 신기술·서비스심의위원회(이하 “심의위원회”라 함)에 상정해야 합니다(「정보통신 진흥 및 융합 활성화 등에 관한 특별법」 제38조의2제6항 전단).
심의위원회의 심사기준
심의위원회는 다음의 사항을 고려하여 실증을 위한 규제특례의 지정 여부를 심의·의결해야 합니다(「정보통신 진흥 및 융합 활성화 등에 관한 특별법」 제38조의2제6항 후단).
√ 해당 기술·서비스의 혁신성
√ 관련 시장 및 이용자 편익에 미치는 영향 및 효과
√ 국민의 생명·안전의 저해 여부 및 개인정보의 안전한 보호·처리
√ 실증을 위한 규제특례의 적정성
√ 그 밖에 실증을 위한 규제특례의 지정에 필요한 사항
심의위원회의 세부 심사기준
실증을 위한 규제특례의 세부 심사기준은 다음과 같습니다(「정보통신 진흥 및 융합 활성화 등에 관한 특별법 시행령」 제42조의4제4항).
√ 신규 정보통신융합 등 기술·서비스의 실증 범위(지역적 범위, 이용자의 규모 등) 및 실증 방법의 구체성
√ 신규 정보통신융합 등 기술·서비스를 실증하기 위한 재정적·기술적 능력
√ 그 밖에 심의위원장이 해당 기술·서비스에 대한 실증의 특성에 따라 필요하다고 인정한 사항
실증을 위한 규제특례 지정
과학기술정보통신부장관은 실증을 위한 규제특례 신청에 대한 관계기관의 장의 검토와 심의위원회의 심의·의결을 거쳐 실증을 위한 규제특례를 지정할 수 있으며, 이 경우 과학기술정보통신부장관은 실증을 위한 규제특례에 조건을 붙일 수 있습니다(「정보통신 진흥 및 융합 활성화 등에 관한 특별법」 제38조의2제3항).
관계기관의 장은 실증을 위한 규제특례 지정을 위해 필요한 지원을 할 수 있습니다(「정보통신 진흥 및 융합 활성화 등에 관한 특별법」 제38조의2제7항).
과학기술정보통신부장관은 실증을 위한 규제특례를 지정하는 경우 다음의 사항을 적은 지정서를 발급하고, 그 사실을 관보 또는 인터넷 홈페이지에 공고해야 합니다(「정보통신 진흥 및 융합 활성화 등에 관한 특별법 시행령」 제42조의4제5항).
지정번호 및 지정 연월일
상호 또는 명칭 및 대표자 성명
주된 사무소의 소재지
지정 대상 기술·서비스의 명칭
지정 대상 기술·서비스의 주요내용
유효기간
지정 조건
실증을 위한 규제특례의 유효기간은 신청인의 신청기간 및 신청내용을 고려해 2년 이내의 기간으로 합니다(「정보통신 진흥 및 융합 활성화 등에 관한 특별법」 제38조의2제4항 전단 및 「정보통신 진흥 및 융합 활성화 등에 관한 특별법 시행령」 제42조의5제1항).
실증을 위한 규제특례 유효기간의 연장
실증을 위한 규제특례의 유효기간은 1회에 한정하여 연장이 가능하며, 유효기간을 연장하려는 자는 유효기간 만료 2개월 전에 과학기술정보통신부장관에게 신청해야 합니다(「정보통신 진흥 및 융합 활성화 등에 관한 특별법」 제38조의2제4항 후단).
유효기간의 연장을 신청하려는 자는 다음 서류를 과학기술정보통신부장관에게 제출해야 합니다(「정보통신 진흥 및 융합 활성화 등에 관한 특별법 시행령」 제42조의5제2항 및 「정보통신 진흥 및 융합 활성화 등에 관한 특별법 시행규칙」 제11조).
실증을 위한 규제특례 유효기간 연장신청서(「정보통신 진흥 및 융합 활성화 등에 관한 특별법 시행규칙」 별지 제15호서식)
해당 신규 정보통신융합 등 기술·서비스의 이용현황 및 실적에 관한 자료
실증을 위한 규제특례 연장 사유서
지정서 사본
위반 시 제재
거짓이나 그 밖의 부정한 방법으로 실증을 위한 규제특례의 지정을 받은 자는 3년 이하의 징역 또는 3천만원 이하의 벌금에 처해 집니다(「정보통신 진흥 및 융합 활성화 등에 관한 특별법」 제44조제1항제3호).
법인·단체의 대표자나 법인·단체 또는 개인의 대리인, 사용인, 그 밖의 종업원이 거짓이나 그 밖의 부정한 방법으로 실증을 위한 규제특례를 받은 경우에는 그 행위자를 벌하는 외에 그 법인·단체 또는 개인에게도 해당 조문의 벌금형이 부과됩니다(「정보통신 진흥 및 융합 활성화 등에 관한 특별법」 제45조 본문).
다만, 법인·단체 또는 개인이 그 위반행위를 방지하기 위해 해당 업무에 관하여 상당한 주의와 감독을 게을리 하지 않은 경우는 제외됩니다(「정보통신 진흥 및 융합 활성화 등에 관한 특별법」 제45조 단서)."
실증을 위한 규제특례 지정 후 후속처리,"관계기관의 관리·감독
과학기술정보통신부장관과 관계기관의 장은 지정받아 시행하는 제한적 시험·기술적 검증(이하 “실증”이라 함)을 위한 규제특례에 관한 다음 사항을 공동으로 관리·감독합니다(「정보통신 진흥 및 융합 활성화 등에 관한 특별법」 제38조의3제1항 및 「정보통신 진흥 및 융합 활성화 등에 관한 특별법 시행령」 제42조의6제1항).
실증계획서에 따른 계획 이행 여부
실증을 위한 규제특례 지정 조건의 이행 여부
관계 법령의 정비
관계기관의 장은 실증을 위한 규제특례의 유효기간이 만료되기 전에 관계 법령을 정비하는 것이 필요하다고 판단할 경우에는 법령이 정비되도록 노력해야 합니다(「정보통신 진흥 및 융합 활성화 등에 관한 특별법」 제38조의3제4항).
관계기관의 장은 법령정비 착수 및 완료 사실을 지체 없이 과학기술정보통신부장관에게 통지해야 합니다(「정보통신 진흥 및 융합 활성화 등에 관한 특별법 시행령」 제42조의6제4항).
이용자에 대한 통지 등
실증을 위한 규제특례의 지정을 받은 자는 해당 이용자가 쉽게 알 수 있도록 그 지정 사실 및 유효기간, 기술·서비스의 내용 등을 알려야 하고, 이용자의 생명·건강·안전, 환경, 개인정보의 안전한 보호 및 처리 등의 요청에 대해 적극적으로 대응해야 합니다(「정보통신 진흥 및 융합 활성화 등에 관한 특별법」 제38조의3제2항).
결과보고서의 제출
실증을 위한 규제특례 지정을 받은 자는 유효기간 만료일부터 30일 이내에 다음 사항을 포함한 결과보고서를 증명자료와 함께 과학기술정보통신부장관 및 관계기관의 장에게 제출해야 합니다(「정보통신 진흥 및 융합 활성화 등에 관한 특별법」 제38조의3제3항 및 「정보통신 진흥 및 융합 활성화 등에 관한 특별법 시행령」 제42조의6제2항).
실증계획서에 따른 목적 달성 여부
실증을 위한 규제특례 지정조건 이행 여부
기술·서비스에 대한 실증 결과
실증을 위한 규제특례의 지정 결과보고서를 과학기술정보통신부장관 및 관계기관의 장에게 제출하지 않은 자에게는 1천만원 이하의 과태료가 부과됩니다(「정보통신 진흥 및 융합 활성화 등에 관한 특별법」 제46조제1항제3호).
결과보고서의 보완요청 및 공개
과학기술정보통신부장관 및 관계기관의 장은 제출된 결과보고서에 보완이 필요하다고 판단하는 경우에는 보완에 필요한 상당한 기간을 정하여 보완을 요구할 있습니다(「정보통신 진흥 및 융합 활성화 등에 관한 특별법 시행령」 제42조의6제3항).
과학기술정보통신부장관은 신규 정보통신 및 정보통신융합(이하 “정보통신융합 등”이라 함) 기술·서비스 관련 시장의 활성화를 위해 제출된 규제특례 지정 결과보고서를 공개할 수 있습니다(「정보통신 진흥 및 융합 활성화 등에 관한 특별법」 제38조의3제5항).
책임보험 등의 가입
실증을 위한 규제특례 지정을 받은 자는 이용자에 대한 손해배상책임을 이행하기 위해 책임보험 등에 가입해야 합니다(「정보통신 진흥 및 융합 활성화 등에 관한 특별법」 제38조의3제6항 및 제37조제9항).
이를 위반하여 책임보험 등에 가입하지 않은 자에게는 1천만원 이하의 과태료가 부과됩니다(「정보통신 진흥 및 융합 활성화 등에 관한 특별법」 제46조제1항제1호).
※ 책임보험의 가입의무 및 배상금액 등에 관해서는 임시조치 규정을 준용하므로 이에 대한 더 자세한 사항은 이 콘텐츠 < 임시허가제도 – 임시허가 후 후속처리 > 에서 확인하실 수 있습니다.
실증을 위한 규제특례 지정의 취소
과학기술정보통신부장관은 실증을 위한 규제특례를 지정받은 자가 다음 중 어느 하나에 해당하는 경우에는 시정을 명하거나(1회에 한정), 심의위원회의 심의·의결을 거쳐 실증을 위한 규제특례 지정을 취소할 수 있습니다(「정보통신 진흥 및 융합 활성화 등에 관한 특별법」 제38조의4제1항 및 제2항).
거짓이나 그 밖의 부정한 방법으로 실증을 위한 규제특례를 지정 받은 경우(실증을 위한 규제특례 지정을 취소해야만 함)
과학기술정보통신부장관이 실증을 위한 규제특례 지정 시 붙인 조건(「정보통신 진흥 및 융합 활성화 등에 관한 특별법」 제38조의2제3항 후단)을 충족하지 못한 경우
실증을 위한 규제특례 지정에 관한 심의위원회의 세부 심사기준을 충족하지 못하게 된 경우
실증을 위한 규제특례의 목적을 달성하는 것이 명백히 불가능하다고 판단되는 경우
과학기술정보통신부장관이 실증을 위한 규제특례의 지정을 취소하려는 경우에는 청문절차를 거쳐야 합니다(「정보통신 진흥 및 융합 활성화 등에 관한 특별법」 제40조제3호).
실증을 위한 규제특례의 지정이 취소된 자는 해당 기술·서비스를 판매·이용 또는 제공 등을 해서는 안 됩니다(「정보통신 진흥 및 융합 활성화 등에 관한 특별법」 제38조의4제4항).
실증을 위한 규제특례의 지정이 취소된 후 해당 기술·서비스를 판매·이용 또는 제공 등을 한 경우에는 1천만원 이하의 과태료가 부과됩니다(「정보통신 진흥 및 융합 활성화 등에 관한 특별법」 제46조제1항제4호)."
