cate2,paragraph
신청의 취하 및 기각,"취하시기
채무자는 개인회생절차의 개시결정이 있기 전에는 신청을 취하할 수 있습니다(「채무자 회생 및 파산에 관한 법률」 제594조 본문).
다만, 채무자가 보전처분이나 중지명령을 받은 후에는 법원의 허가를 받아야 신청을 취하할 수 있습니다(「채무자 회생 및 파산에 관한 법률」 제594조 단서).
기각사유
법원은 다음 중 어느 하나에 해당하는 경우 개인회생절차개시신청을 기각할 수 있습니다(「채무자 회생 및 파산에 관한 법률」 제595조).
채무자가 신청자격을 갖추지 않은 경우
채무자가 신청서의 첨부서류를 제출하지 않거나, 허위로 작성해 제출했거나, 법원이 정한 제출기한을 준수하지 않은 경우
채무자가 절차의 비용을 납부하지 않은 경우
채무자가 변제계획안의 제출기한을 준수하지 않은 경우
채무자가 신청일 전 5년 이내에 면책(파산절차에 의한 면책 포함)을 받은 사실이 있는 경우
개인회생절차를 개시하는 것이 채권자 일반의 이익에 적합하지 않은 경우
그 밖에 신청이 성실하지 않거나 상당한 이유 없이 절차를 지연시키는 경우
불복방법
개인회생절차개시신청의 기각결정에 대해서는 재판이 고지된 날부터 1주 이내에 서면으로 즉시항고를 할 수 있습니다(「채무자 회생 및 파산에 관한 법률」 제14조, 제33조 및 「민사소송법」 제444조제1항).
※ 기각 사유의 판단에 관한 기준대법원은 「채무자 회생 및 파산에 관한 법률」 제595조제7호와 관련하여 “소정의 ‘그 밖에 신청이 성실하지 아니한 때’에 해당한다는 이유로 채무자의 개인회생절차 개시신청을 기각하려면 채무자에게 제595조제1호 내지 제5호에 준하는 절차적인 잘못이 있거나, 채무자가 개인회생절차의 진행에 따른 효과만을 목적으로 하는 등 부당한 목적으로 개인회생절차 개시신청을 하였다는 사정이 인정되어야 한다.그리고 법원 또는 회생위원은 채무자가 제출한 자료에 보완이 필요한 경우 언제든지 채무자에게 금전의 수입과 지출 그 밖에 채무자의 재산상의 업무에 관하여 보고를 요구할 수 있고, 필요하다고 인정하는 경우에는 재산상황의 조사, 시정의 요구 그 밖의 적절한 조치를 취할 수 있으며, 채무자가 법원의 보정 요구에 일단 응한 경우에는 그 내용이 법원의 요구사항을 충족시키지 못하였다 하더라도 특별한 사정이 없는 한 법원이 추가적인 보정 요구나 심문 등을 통하여 이를 시정할 기회를 제공하지 아니한 채 곧바로 그 신청을 기각하는 것은 허용되지 않는다.”라고 판시하였습니다(대법원 2013. 7. 12. 자 2013마668 결정)."
개인회생채권자집회,"개인회생채권자집회의 의미
“개인회생채권자집회”란 채무자가 개인회생채권자에게 변제계획의 요지를 설명하고, 개인회생채권자는 변제계획에 관해 이의를 진술할 수 있도록 마련된 자리입니다(「채무자 회생 및 파산에 관한 법률」 제613조제1항 및 제5항 참조).
변제계획에 관한 이의진술
채무자는 개인회생채권자집회에 출석해 개인회생채권자의 요구가 있는 경우 변제계획에 관해 필요한 설명을 해야 합니다(「채무자 회생 및 파산에 관한 법률」 제613조제2항).
※ 법원은 채무자가 정당한 사유 없이 출석 또는 설명을 하지 않거나 허위의 설명을 한 경우 직권으로 개인회생절차 폐지결정을 할 수 있습니다(「채무자 회생 및 파산에 관한 법률」 제620조제2항제2호).
채권자는 개인회생채권자집회에서 변제계획에 관해 이의를 진술할 수 있습니다(「채무자 회생 및 파산에 관한 법률」 제613조제5항).
※ 이의 진술은 개인회생채권자가 개인회생채권자집회기일의 종료 시까지 이의진술서를 법원에 제출하는 방식으로 갈음할 수 있습니다(「채무자 회생 및 파산에 관한 규칙」 제90조제1항).
채권자의 계좌신고
개인회생채권자는 개인회생채권자집회기일 종료 시까지 변제계획에 따른 변제액을 송금받기 위한 금융기관의 계좌 번호를 회생위원에게 신고해야 합니다(「채무자 회생 및 파산에 관한 규칙」 제84조제1항).
법원은 계좌신고를 하지 않는 개인회생채권자가 있는 경우 지급할 변제액은 변제계획에서 정하는 바에 따라 공탁할 수 있습니다(「채무자 회생 및 파산에 관한 규칙」 제84조제2항)."
채권자 목록에 대한 이의제기,"서면에 의한 이의제기
개인회생채권자목록의 내용에 관해 이의가 있는 개인회생채권자는 이의기간 안에 서면으로 이의를 신청할 수 있습니다(「채무자 회생 및 파산에 관한 법률」 제604조제1항 전단).
개인회생채권조사확정재판
“개인회생채권조사확정재판” 이란 개인회생채권자목록의 내용에 이의가 있는 개인회생채권자가 이의기간 안에 개인회생절차를 진행하고 있는 법원에 재판을 신청하면 법원이 조사하여 확정하는 재판을 말합니다(「채무자 회생 및 파산에 관한 법률」 제604조 참조).
개인회생채권조사확정재판은 별도의 소송으로 소송비용을 내야 하므로, 대부분의 경우에는 이의기간에 이의를 제기하는 방식을 취합니다.
※ 개인회생채권조사확정재판 신청서 양식은 <대한민국 법원 전자민원센터-민원안내-양식모음>에서 확인하실 수 있습니다.
이의제기로 인한 수정
채무자가 채권자의 이의내용을 인정하는 경우에는 법원의 허가를 받아 개인회생채권자목록을 변경할 수 있습니다. 이 경우 법원은 조사확정재판신청에 대한 결정을 하지 아니할 수 있습니다(「채무자 회생 및 파산에 관한 법률」 제604조제1항 후단).
개인회생채권의 확정
개인회생채권자목록에 기재된 채권자가 이의기간 안에 이의를 제기하지 않은 경우 및 개인회생채권조사확정재판신청이 각하된 경우 개인회생채권자목록의 기재대로 채권이 확정됩니다(「채무자 회생 및 파산에 관한 법률」 제603조제1항).
개인회생채권이 확정되면 개인회생채권자 전원에 대해 확정판결과 동일한 효력이 있습니다(「채무자 회생 및 파산에 관한 법률」 제603조제3항)."
인가결정,"이의가 없는 경우의 인가결정
법원은 개인회생채권자 또는 회생위원이 이의를 제기하지 않고, 다음 요건이 모두 충족된 경우 변제계획인가결정을 합니다(「채무자 회생 및 파산에 관한 법률」 제614조제1항 본문).
변제계획이 법률의 규정에 적합할 것
변제계획이 공정하고 형평에 맞으며 수행가능할 것
변제계획인가 전에 납부되어야 할 비용 수수료 그 밖의 금액이 납부되었을 것
변제계획의 인가결정일을 기준일로 평가한 개인회생채권에 대한 총변제액이 채무자가 파산하는 경우에 개인회생 채권자가 배당받을 총액보다 적지 않을 것(단, 채권자가 동의한 경우 제외)
다만, 법원의 변제계획안 수정명령에 불응한 경우에는 그렇지 않습니다(「채무자 회생 및 파산에 관한 법률」 제614조제1항 단서).
이의가 있는 경우의 인가결정
법원은 개인회생채권자 또는 회생위원이 이의를 제기한 경우 이의가 없는 경우의 인가결정 요건 외에 다음 요건을 구비하고 있는 경우에 한해 변제계획인가결정을 할 수 있습니다(「채무자 회생 및 파산에 관한 법률」 제614조제2항).
변제계획의 인가결정일을 기준일로 이의를 제기한 개인회생채권자에 대한 총변제액이 채무자가 파산하는 경우에 그 채권자가 받을 배당받을 총액보다 적지 않을 것
채무자가 최초의 변제일부터 변제계획에서 정한 변제기간 동안 수령할 수 있는 가용소득의 전부가 변제계획에 따른 변제에 제공될 것
변제계획의 인가결정일을 기준일로 평가한 개인회생채권에 대한 총변제액이 3천만원을 초과하지 않는 범위 안에서 다음의 금액보다 적지 않을 것
√ 변제계획의 인가결정일을 기준일로 평가한 개인회생채권의 총금액이 5천만원 미만인 경우 총금액에 100분의 5를 곱한 금액
√ 변제계획의 인가결정일을 기준일로 평가한 개인회생채권의 총금액이 5천만원 이상인 경우에는 위 총금액에 100분의 3을 곱한 금액에 1백만원을 더한 금액
인가결정의 공고
법원은 변제계획인부결정을 선고하고 그 주문, 이유의 요지와 변제계획의 요지를 공고해야 합니다. 이 경우 송달은 하지 않을 수 있습니다(「채무자 회생 및 파산에 관한 법률」 제614조제3항).
효력발생시기
변제계획은 인가결정이 있은 때부터 효력이 생깁니다(「채무자 회생 및 파산에 관한 법률」 제615조제1항 본문).
다만, 변제계획에 따른 권리의 변경은 면책결정이 확정되기까지는 생기지 않습니다(「채무자 회생 및 파산에 관한 법률」 제615조제1항 단서).
채무자 재산의 귀속
변제계획인가결정이 있는 경우 개인회생재단에 속하는 모든 재산은 채무자에게 귀속됩니다(「채무자 회생 및 파산에 관한 법률」 제615조제2항 본문).
다만, 변제계획 또는 변제계획인가결정에서 다르게 정한 경우에는 그렇지 않습니다(「채무자 회생 및 파산에 관한 법률」 제615조제2항 단서).
다른 절차의 효력 상실
변제계획인가결정이 있는 경우 개인회생절차개시결정으로 중지된 회생절차 및 파산절차와 개인회생채권에 기한 강제집행 가압류 또는 가처분은 그 효력을 잃습니다(「채무자 회생 및 파산에 관한 법률」 제615조제3항 본문).
다만, 변제계획 또는 변제계획인가결정에서 다르게 정한 경우에는 그렇지 않습니다(「채무자 회생 및 파산에 관한 법률」 제615조제3항 단서).
한국신용정보원의 장에 대한 통보
법원은 변제계획인가결정이 있는 경우 사건번호, 채무자의 성명, 주민등록번호, 인가결정일 등을 한국신용정보원의 장에게 통보해 신청인에 대한 연체정보 등을 삭제하도록 합니다[「개인회생사건 처리지침」(대법원 재판예규 제1693호, 2018. 6. 7. 발령, 2018. 6. 13. 시행) 제18조제1항제1호].
채권자목록 수정불가
변제계획인가결정 후에는 개인회생채권자목록 수정이 불가능합니다(「채무자 회생 및 파산에 관한 규칙」 제81조제1항 단서).
즉시항고
이해관계를 가진 자는 재판의 공고가 있은 날부터 14일 이내에 서면으로 변제계획인가결정에 대한 즉시항고를 할 수 있습니다(「채무자 회생 및 파산에 관한 법률」 제13조제2항, 제14조 및 제618조제1항).
Q. 개인회생절차를 신청하면 연체정보등록에서는 언제 해제되나요?A. 개인회생절차에서 변제계획안에 대한 인가결정을 받으면 연체정보등록에서 해제됩니다(법원이 인가결정을 한국신용정보원에 통지하면 한국신용정보원에서 연체정보등록을 해제해주도록 되어 있음).개인회생절차의 개시신청부터 변제계획안의 인가결정시까지는 6개월 정도가 소요될 것으로 예상되므로 통상은 개시신청 후 약 6개월이면 연체정보등록에서 해제될 수 있습니다.<대한민국 법원 전자민원센터 – 민원안내 – 자주 묻는 질문>"
폐지결정의 대상 및 효력,"변제계획인가 전 개인회생절차의 폐지
법원은 다음 중 어느 하나에 해당하는 경우 이해관계인의 신청이나 직권으로 개인회생절차 폐지결정을 해야 합니다(「채무자 회생 및 파산에 관한 법률」 제620조제1항).
개인회생절차의 개시결정 당시 채무자가 신청권자의 자격을 갖추지 않은 경우
채무자가 개인회생절차 신청일 전 5년 이내에 면책(파산절차에 의한 면책 포함)을 받은 사실이 있는 경우
채무자가 제출한 변제계획안을 인가할 수 없는 경우
법원은 다음 중 어느 하나에 해당하는 경우 직권으로 개인회생절차 폐지결정을 할 수 있습니다(「채무자 회생 및 파산에 관한 법률」 제620조제2항).
채무자가 「채무자 회생 및 파산에 관한 법률」 제589조제2항에 따른 첨부서류를 제출하지 않거나, 허위로 작성하여 제출 또는 법원이 정한 제출기한을 준수하지 않은 경우
채무자가 정당한 사유 없이 개인회생채권자집회에 출석 또는 설명을 하지 않거나 허위의 설명을 한 경우
변제계획인가 후 개인회생절차의 폐지
법원은 다음 중 어느 하나에 해당하는 경우 이해관계인의 신청이나 직권으로 개인회생절차 폐지결정을 해야 합니다(「채무자 회생 및 파산에 관한 법률」 제621조제1항).
면책불허가결정이 확정된 경우
채무자가 인가된 변제계획을 이행할 수 없음이 명백한 경우(단, 변제를 완료하지 못했으나 면책신청을 할 수 있는 요건을 갖추어 면책결정을 받은 경우 제외)
채무자가 재산 및 소득의 은닉 그 밖의 부정한 방법으로 인가된 변제계획을 수행하지 않는 경우
폐지결정의 공고
법원은 개인회생절차 폐지결정을 한 경우 그 주문과 이유의 요지를 공고하고, 송달은 하지 않을 수 있습니다(「채무자 회생 및 파산에 관한 법률」 제622조).
강제집행
개인회생절차 폐지결정이 확정되면 개인회생채권자는 채무자에 대해 개인회생채권자표에 기해 강제집행을 할 수 있습니다(「채무자 회생 및 파산에 관한 법률」 제603조제4항).
기 변제금액에 대한 영향
변제계획인가 후 개인회생절차의 폐지는 이미 행한 변제와 「채무자 회생 및 파산에 관한 법률」에 따라 생긴 효력에 영향을 미치지 않습니다(「채무자 회생 및 파산에 관한 법률」 제621조제2항).
한국신용정보원의 장에 대한 통보
법원은 개인회생절차 폐지결정이 확정된 경우 사건번호, 채무자의 성명, 주민등록번호, 폐지결정일, 폐지결정의 확정일을 한국신용정보원의 장에게 통보합니다[「개인회생사건 처리지침」(대법원 재판예규 제1693호, 2018. 6. 7. 발령, 2018. 6. 13. 시행) 제18조제1항제3호].
불복방법
개인회생절차 폐지결정에 대해서는 즉시항고를 할 수 있습니다(「채무자 회생 및 파산에 관한 법률」 제623조제1항).
※ 개인회생절차폐지결정이 확정된 경우 개인회생절차가 종료하는지 여부개인회생절차폐지결정이 확정된 경우 개인회생절차가 종료하는지 여부에 대해 대법원은 “「채무자 회생 및 파산에 관한 법률」(이하 ‘법’이라 함) 제621조제1항은 개인회생절차에서 변제계획인가 후 채무자가 인가된 변제계획을 이행할 수 없음이 명백한 때 등의 사유가 있는 때에는 법원은 개인회생절차를 폐지하여야 한다고 규정하고 있다. 개인회생절차에서 개인회생채권자는 변제계획에 의하지 아니하고는 변제하거나 변제받는 등 이를 소멸하게 하는 행위를 하지 못하는데, 개인회생채권자는 개인회생절차폐지결정이 확정된 때에는 채무자에 대하여 개인회생채권자표에 기하여 강제집행을 할 수 있어 개인회생채권자가 개인회생절차폐지결정의 확정으로 절차적 구속에서 벗어나는 점 등에 비추어 보면, 개인회생절차폐지결정이 확정된 경우에 개인회생절차는 종료한다고 봄이 타당하다. 「채무자 회생 및 파산에 관한 규칙」 제96조가 법 제624조의 면책결정이 확정되면 개인회생절차는 종료한다고 규정하고 있으나 이는 면책결정이 확정된 경우의 개인회생절차 종료사유에 관한 것이므로 개인회생절차폐지결정이 확정된 경우에도 개인회생절차가 종료한다고 판단하는 데 장애사유가 되지 아니한다.”고 판시 하였습니다(대법원 2012. 7. 12. 자 2012마811 결정)"
변제계획안의 변경 및 변제의 수행,"개인회생절차인가 전
채무자는 변제계획안이 인가되기 전에는 변제계획안을 수정할 수 있습니다(「채무자 회생 및 파산에 관한 법률」 제610조제2항).
법원은 이해관계인의 신청에 의하거나 직권으로 채무자에 대하여 변제계획안을 수정할 것을 명할 수 있습니다. 이 경우 채무자는 법원이 정하는 기한 이내에 변제계획안을 수정하여야 합니다(「채무자 회생 및 파산에 관한 법률」 제610조제3항 및 제4항).
개인회생절차인가 후
채무자·회생위원 또는 개인회생채권자는 변제계획에 따른 변제가 완료되기 전까지는 인가된 변제계획 변경안을 제출할 수 있습니다(「채무자 회생 및 파산에 관한 법률」 제619조제1항).
부본 제출
변제계획의 변경안을 제출하는 경우에는 알고 있는 개인회생채권자 수에 1을 더한 만큼의 부본을 함께 제출하여야 합니다(「채무자 회생 및 파산에 관한 규칙」 제85조제2항).
수정 후 절차
변제계획안에 변경이 생긴 경우에 법원은 개인회생절차개시결정문 공고 사항을 기재한 서면과 개인회생채권자 목록 및 변제계획안을 채무자, 알고 있는 개인회생채권자, 개인회생절차가 개시된 채무자의 재산을 소지하고 있거나 그에게 채무를 부담하는 사람에게 송달하여야 합니다(「채무자 회생 및 파산에 관한 법률」 제597조제2항 및 제619조제2항).
※ 개인회생절차개시결정문 공고에 대한 자세한 내용은 이 콘텐츠의 <개인회생절차 개시결정-개시 결정 등-개인회생절차 개시결정>에서 확인하실 수 있습니다.
개인회생절차인가 후 변제계획안이 변경된 경우에는 개인회생절차개시결정의 송달절차를 준용합니다(「채무자 회생 및 파산에 관한 법률」 제597조제3항 및 제2항).
※ 변제계획 수정안 제출서 양식은 <대법원 전자민원센터, 양식모음, 변제계획 수정안 제출서>에서 확인하실 수 있습니다.
변제계획에 따른 변제
채무자는 개인회생채권자목록에 기재된 개인회생채권에 관해서는 변제계획에 의하지 않고 변제하거나 변제받는 등 이를 소멸하게 하는 행위(면제 제외)를 하지 못합니다(「채무자 회생 및 파산에 관한 법률」 제582조).
개인회생재단채권의 경우 우선변제
개인회생재단채권은 일반 개인회생채권보다 먼저 변제합니다(「채무자 회생 및 파산에 관한 법률」 제583조제2항 및 제476조).
다음에 해당하는 청구권을 개인회생재단채권이라 합니다(「채무자 회생 및 파산에 관한 법률」 제583조제1항).
1. 회생위원의 보수 및 비용의 청구권
2. 「국세징수법」 또는 「지방세징수법」에 의하여 징수할 수 있는 다음의 청구권(단, 개인회생절차개시 당시 아직 납부기한이 도래하지 아니한 것에 한함)
가. 원천징수하는 조세
나. 부가가치세 개별소비세 주세 및 교통 에너지 환경세
다. 특별징수의무자가 징수하여 납부하여야 하는 지방세
라. 위 1. 부터 3. 에 따른 조세의 부과 징수의 예에 따라 부과 징수하는 교육세 및 농어촌특별세
3. 채무자의 근로자의 임금 퇴직금 및 재해보상금
4. 개인회생절차개시결정 전의 원인으로 생긴 채무자의 근로자의 임치금 및 신원보증금의 반환청구권
5. 채무자가 개인회생절차개시신청 후 개시결정 전에 법원의 허가를 받아 행한 자금의 차입, 자재의 구입 그 밖에 채무자의 사업을 계속하는데 불가결한 행위로 인하여 생긴 청구권
6. 위 1. 부터 5. 에 규정된 것 외의 것으로서 채무자를 위하여 지출하여야 하는 부득이한 비용
후순위개인회생채권이 있는 경우 변제
채무자가 채권자와 개인회생절차에서 다른 채권보다 후순위로 하기로 정한 채권은 그 정한 바에 따라 다른 채권보다 후순위로 합니다(「채무자 회생 및 파산에 관한 법률」 제581조제2항 및 제446조제2항).
다음에 해당하는 청구권을 후순위개인회생채권이라 합니다(「채무자 회생 및 파산에 관한 법률」 제581조제2항 및 제446조제1항).
개인회생절차개시결정 후의 이자
개인회생절차개시결정 후의 불이행으로 인한 손해배상액 및 위약금
개인회생절차참가비용
벌금·과료·형사소송비용·추징금 및 과태료
기한이 개인회생절차개시결정 후에 도래하는 이자없는 채권의 경우 개인회생절차개시결정이 있은 때부터 그 기한에 이르기까지의 법정이율에 의한 원리의 합계액이 채권액이 될 계산에 의해 산출되는 이자액에 상당하는 부분
기한이 불확정한 이자없는 채권의 경우 그 채권액과 개인회생절차개시결정 당시의 평가액과의 차액에 상당하는 부분
채권액 및 존속기간이 확정된 정기금채권인 경우 각 정기금에 대해 산출되는 이자의 합계액에 상당하는 부분과 각 정기금에 대해 산출되는 원금의 합계액이 법정이율에 의해 그 정기금에 상당하는 이자가 원금을 초과하는 경우에는 그 초과액에 상당하는 부분
변제금의 임치
채무자는 인가된 변제계획에 따라 개인회생채권자에게 변제할 금원을 회생위원에게 임치(任置)해야 합니다(「채무자 회생 및 파산에 관한 법률」 제617조제1항).
개인회생채권자는 임치된 금원을 변제계획에 따라 회생위원으로부터 지급받게 됩니다(「채무자 회생 및 파산에 관한 법률」 제617조제2항 전단).
개인회생채권자가 지급받지 않는 경우에는 회생위원은 채권자를 위하여 공탁할 수 있습니다(「채무자 회생 및 파산에 관한 법률」 제617조제2항 후단).
※ 회생위원은 변제액을 송금받기 위한 금융기관 계좌번호를 신고하지 않은 채권자(신고한 계좌번호에 오류가 있는 채권자도 포함)에 대해서는 변제계획에 따라 연 1회(변제계획인가일부터 1년이 지날 때마다 1회) 변제액을 공탁할 수 있습니다[「개인회생사건 처리지침」(대법원 재판예규 제1693호, 2018. 6. 7. 발령, 2018. 6. 13. 시행) 제11조의5제1항]."
