cate2,paragraph
성희롱의 개념,"성희롱이란 상대방이 원하지 않는 성적인 말이나 행동을 하여 상대방에게 성적 굴욕감이나 수치심을 느끼게 하는 행위를 말합니다.  법령에서 성희롱의 개념을 정의하고 있는 예는 「국가인권위원회법」과 「남녀고용평등과 일ㆍ가정 양립지원에 관한 법률」 및 「양성평등기본법」에서 찾아볼 수 있는데, ① ‘자기의 지위를 이용하거나 업무 등과 관련하여 성적인 말과 행동으로 상대방에게 성적인 굴욕감이나 혐오감을 느끼게 하는 것뿐만 아니라 ② 그러한 언동에 거부하는 것을 이유로 고용 등에서 불이익을 주는 것까지 포함합니다. 성희롱은 강간이나 강제추행 등과 같이 형사처벌의 대상이 되는 범죄와는 구별되고, 단순한 친밀감의 표시와도 구별됩니다.
성희롱의 법적 개념
일반적으로 성희롱이란 상대방이 원하지 않는 성적(性的)인 말이나 행동을 하여 상대방에게 성적 굴욕감이나 수치심을 느끼게 하는 행위를 말합니다.
성희롱의 개념을 정의하고 있는 입법례는 「국가인권위원회법」과 「남녀고용평등과 일·가정 양립지원에 관한 법률」 및 「양성평등기본법」에서 찾아볼 수 있는데 공통적으로 성희롱이란 ‘지위를 이용하거나 업무와 관련하여' 성적(性的) 언동(言動) 등으로 성적 굴욕감(屈辱感) 또는 혐오감(嫌惡感)을 느끼게 하거나, 성적 언동 그 밖의 요구 등에 대한 불응을 이유로 고용에서 불이익을 주는 것까지 포함하는 근로관계를 전제로 하는 경우가 대부분입니다.
「국가인권위원회법」 제2조제3호라목 “성희롱”이란 업무, 고용 그 밖의 관계에서 공공기관의 종사자, 사용자 또는 근로자가 그 직위를 이용하거나 업무 등과 관련해 성적 언동 등으로 성적 굴욕감 또는 혐오감을 느끼게 하거나 성적 언동 그 밖의 요구 등에 대한 불응을 이유로 고용상의 불이익을 주는 것을 말합니다.
「남녀고용평등과 일·가정 양립지원에 관한 법률」 제2조제2호 “직장 내 성희롱”이란 사업주·상급자 또는 근로자가 직장 내의 지위를 이용하거나 업무와 관련하여 다른 근로자에게 성적 언동 등으로 성적 굴욕감 또는 혐오감을 느끼게 하거나 성적 언동 또는 그 밖의 요구 등에 따르지 않았다는 이유로 근로조건 및 고용에서 불이익을 주는 것을 말합니다.
「양성평등기본법」 제3조제2호 및 「양성평등기본법 시행령」 제2조 “성희롱”이란 업무, 고용, 그 밖의 관계에서 국가기관·지방자치단체 또는 각급 학교 및 공직 유관 단체의 종사자, 사용자 또는 근로자가 다음의 어느 하나에 해당하는 행위를 하는 경우를 말합니다. 지위를 이용하거나 업무 등과 관련하여 성적 언동 등으로 상대방에게 성적 굴욕감이나 혐오감을 느끼게 하는 행위 상대방이 성적 언동 또는 요구에 대한 불응을 이유로 불이익을 주거나 그에 따르는 것을 조건으로 이익 공여의 의사표시를 하는 행위
그 밖에 「경범죄 처벌법」 제3조제1항제33호에서는 직접 성희롱을 정의하고 있지는 않으나 신체의 과다노출로 다른 사람에게 부끄러움이나 불쾌감을 주는 행위를 금지하고 있습니다.
또한, 성희롱이 그 정도를 넘어서 성범죄에 해당하거나 그 밖에 형사처벌의 대상이 되는 경우에는 「형법」, 「성폭력범죄의 처벌 등에 관한 특례법」 및 「경범죄처벌법」에 따라 형사처벌의 대상이 됩니다.
‘성적 언동 등'의 의미
남녀 간의 육체적 관계나 남성 또는 여성의 신체적 특징과 관련된 육체적, 언어적, 시각적 행위로서 사회공동체의 건전한 상식과 관행에 비추어 볼 때 객관적으로 상대방과 같은 처지에 있는 일반적이고도 평균적인 사람에게 성적 굴욕감이나 혐오감을 느끼게 할 수 있는 행위를 말합니다(대법원 2008.7.10. 선고 2007두22498판결).
성적 언동이 아닌 여성비하적인 발언이나 가부장적인 발언은 성희롱에 해당하지 않습니다.
※ 예: 여성에게만 차심부름을 시키거나 ‘야'라고 부르는 경우
‘지위를 이용하거나 업무 등과 관련하여'의 의미
포괄적인 업무관련성을 나타낸 것으로서 업무수행의 기회나 업무수행에 편승하여 성적 언동이 이루어진 경우뿐만 아니라 권한을 남용하거나 업무수행을 빙자하여 성적 언동을 한 경우도 성희롱에 포함됩니다.
업무관련성이 인정되는지는 양 당사자의 관계, 행위가 행해진 장소 및 상황, 행위의 내용 및 정도 등의 구체적 사정을 고려해 판단해야 합니다(대법원 2006.12.21. 선고 2005두13414판결).
※ 지위를 이용하거나 업무관련성이 인정되는 경우라면 사업장 밖이나 근무시간 외에서의 행위라도 성희롱에 해당할 수 있습니다.
◀업무관련성: 직장상사와 친분 있는 자의 성희롱▶ Q: 동사무소 공무원입니다. 같은 동사무소 직원들은 근처의 다른 동사무소 직원들과 업무로 인해 유대관계를 가지고 있는데, 다른 동사무소 직원인 A의 생일 파티자리에서 A가 나에게 입을 맞추고 동료 직원들과 상사들이 재미있다고 웃으며 “좋겠다”라고 까지 했습니다. 그러나 당시 분위기 때문에 화를 내지 못했습니다. 또 한번은 저녁 술자리에서 A가 “다리가 매끈하다, 가슴이 크다, 몸매가 좋다”라는 말을 하고 계속 가슴과 다리를 쳐다보았고 이후 가슴을 만지기까지 했습니다. 사과를 요구하였지만 A는 성희롱에 대해 전혀 인식하지 못하고 성희롱적인 메일을 보내기도 했습니다. 이런 경우에도 국가인권위원회의 도움을 받을 수 있나요? A: 「국가인권위원회법」 제2조제3호라목, 「남녀고용평등과 일·가정 양립지원에 관한 법률」 제2조제2호 및 「여성발전기본법」 제3조제4호에서는 모두 성희롱 행위에 대해 지위를 이용하거나 업무와 관련하여 성적 언동 등을 했을 것을 요구하고 있습니다. 따라서 같은 직장의 근로자가 아니라도 업무적 유대관계를 위한 회식자리 등에서 성적 언동을 했다면 업무관련성이 인정됩니다. 따라서 업무와 관련한 상대방의 성적 언동으로 수치심을 느꼈다면「국가인권위원회법」에 따라 국가인권위원회에 진정할 수 있습니다.(국가인권위원회  인권상담사례)
♣ 국가인권위원회 상담·진정사례-1 성적 굴욕감◎ 사례교사로 근무하고 있습니다. 일 때문에 몇 번 본 적이 있는 교육청 교육과장이 ‘편지를 읽고 내용에 대한 생각은 전화로 말해 달라'며 몇 장의 종이를 건네주었습니다. 종이 맨 위에는 남녀가 열렬히 키스하는 장면으로 유명 화가의 그림이 있었고, 아랫부분에는 사회적으로 회제가 된 스캔들의 주인공에게 내연녀가 썼다고 하는 연애편지가 적혀 있었는데 “죽음에 가까운 정사, 오르가즘 직전의 환희” 등의 문구와 같이 매우 외설적인 느낌의 내용이었습니다.◎ 국가인권위원회의 판단성희롱이 성립하기 위해서는 행위자가 피해자에게 고의적으로 성적 모멸감을 주고 괴롭히려는 동기나 의도가 필수적이지 않으며, 진정인에게 성적 수치심을 줄 의도가 없었고 분위기를 전환할 의도에서 행동한 것이라 하더라도 결과적으로 피해자에게 성적 굴욕감을 주었다면 성희롱에 해당함. 피진정인에게 특별인권교육을 받을 것을 권고함.(국가인권위원회 , 2008 인권상담사례집)♣ 국가인권위원회 상담·진정사례-2 성적 의미가 포함된 언동◎ 사례아르바이트로 엔터테인먼트 회사에서 근무하고 있습니다. A를 고용한 팀장이 티셔츠가 맘에 든다며 “나도 입어 보자. 옷 좀 벗어 달라”고 여러 차례 말했습니다.◎ 국가인권위원회의 판단피진정인의 행위는 성적 의미가 포함된 언동으로 받아들여질 소지가 충분함.장난이나 친근함의 표현이었다면 피진정인이 싫다고 했을 때 이를 중단했어야 함에도 몇 차례 동일한 언동을 반복한 것은 계속 더 큰 불쾌감을 느꼈을 것으로 판단됨.(국가인권위원회 , 2008 인권상담사례집)
「형법」은 강간(强姦)이나 추행(醜行), 성풍속에 관한 죄, 간음(姦淫)에 관한 죄를 규정하고 있습니다. 「성폭력범죄의 처벌 등에 관한 특례법」에서는 「형법」에 규정하고 있지 않은 성범죄의 유형도 성폭력에 포함시키고 있습니다.
성범죄에 해당하면 형사처벌의 대상이 된다는 점에서 경미한 성적 언어나 행동으로서 형벌부과의 대상이 되지 않는 성희롱과 차이가 있습니다.
강제추행과의 구별
강제추행(强制醜行)이란 폭행(暴行)·협박(脅迫)으로 다른 사람을 추행(醜行)하는 것을 말합니다.
폭행이란 사람에 대한 유형력(有形力)의 행사를 말하고, 협박이란 상대방의 반항을 불가능하게 하거나 현저히 곤란하게 할 정도의 해악(害惡)을 알리는 것을 말합니다.
추행(醜行)이란 주관적인 목적이나 경향을 불문하고 객관적으로 일반인에게 성적 수치심이나 혐오감을 느끼게 하는 일체의 행위를 말합니다. 객관적으로 성적(性的)인 수치심이나 도덕감을 현저히 해할 수 있을 정도의 중요한 행위에 제한됩니다.
강제추행은 성희롱과 구별하기 어려운 경우가 많지만, 폭행·협박의 정도에 이르지 않은 경우에는 성희롱이라고 볼 수 있습니다.
강간과의 구별
폭행·협박으로 상대방인 사람의 반항을 곤란하게 하여 간음(姦淫)하는 것을 말합니다.
간음이란 결혼 아닌 성교(性交)행위로서 남자의 성기를 여자의 성기에 삽입하는 것을 말합니다.
폭행·협박은 상대방의 반항을 불가능하게 할 뿐만 아니라 현저히 곤란하게 하는 경우도 포함합니다.
경미한 성희롱은 일상적인 인간관계에서 허용되는 친밀감 표시와 구별이 어렵습니다.
일상적인 친밀감의 표시인지 성희롱인지를 구별하기 위해서는 주위 상황이나 강제력의 정도 등 모든 사정을 종합적으로 고려해야 합니다.
성차별이란 합리적인 이유 없이 특정한 성에게 불이익한 처우를 하는 것을 말합니다. 「국가인권위원회법」 제2조제3호에서는 성희롱을 평등권 침해의 차별행위로 규정하고 있어 성차별에 해당합니다."
성희롱 여부의 판단 기준,"성희롱에 해당하는지는 피해자의 주관적 사정과 함께 사회 통념을 고려하고, 성적 언동의 성격과 사건의 배경 등 모든 상황과 기록을 전체적으로 보아 판단합니다. 단 한 번의 행위라도 성희롱이 될 수 있으며, 거부의 뜻을 분명히 나타내지 못한 경우에도 성희롱이 될 수 있습니다. 행위자가 성적 만족을 느끼기 위해서 한 것이라거나 피해자가 현실적으로 성적 수치심을 느껴야 하는 것은 아닙니다.  「남녀고용평등과 일ㆍ가정 양립 지원에 관한 법률 시행규칙」에서는 성희롱 행위를 판단하기 위한 기준을 예시하고 있습니다.
성희롱 여부에 대한 판단
성희롱 여부를 판단할 경우에는 피해자의 주관적 사정을 고려하되, 사회통념상 합리적인 사람이 피해자의 입장이라면 문제가 되는 행동에 대해 어떻게 판단하고 대응했을 것인지를 함께 고려해야 하며, 결과적으로 위협적이고 적대적인 고용환경을 형성하여 업무능률을 떨어뜨리게 되는지를 검토합니다.
피해자의 주관적인 사정
행위자의 주관적인 동기가 아니라, 피해자의 관점을 기초로 문제된 행위를 원했던 것인지 아닌지를 중심으로 판단합니다.
비록 친밀감의 표시로 한 언동이었다 하더라도 상대방이 성적 굴욕감이나 혐오감을 느꼈다면 성희롱에 해당할 수 있습니다.
사회통념의 고려
사회통념상 피해자가 합리적인 사람이라면 문제가 되는 상황에서 어떻게 판단하고 대응했을 것인지를 고려합니다.
사안에 따른 판단
피해자의 주관적인 사정과 사회통념에 따라 판단하되, 성적(性的) 언동(言動)의 성격과 사건이 일어나게 된 배경 등 모든 상황과 기록을 전체적으로 고려하여 사안에 따라 결정합니다.
그 밖의 고려사항
성희롱 행위는 반드시 반복적이거나 계속적일 필요는 없습니다.
단 한 번의 성적 언동도 성희롱으로 판단될 수 있습니다.
피해자가 거부의 뜻을 분명히 나타내지 않은 경우에도 객관적 사정으로 판단해 볼 때 실제로 원하지 않았음을 알 수 있다면 성희롱에 해당할 수 있습니다.
성적인 언동이라도 당시에 서로 동의하였거나 성적인 언동에 자발적으로 참여한 경우라면 나중에 이를 성희롱행위라고 주장할 수는 없습니다.
행위자가 성적 만족을 느끼거나 성적 만족을 위해서 한 것이어야 하는 것은 아닙니다.
성적 언동 등으로 인해 피해자가 성적 굴욕감을 느끼는 것을 기준으로 삼고 있으므로 행위자가 성적 만족을 위한 것이었거나 성적 만족감을 느껴야만 성희롱이 되는 것은 아닙니다. 단순한 호기심이나 악감정에서 비롯된 것이라도 성희롱에 해당할 수 있습니다.
피해자가 당시에 현실적으로 성적 수치심을 느껴야 하는 것은 아닙니다.
정신장애를 가진 사람에 대한 행위도 성희롱에 해당합니다.
「남녀고용평등과 일·가정 양립 지원에 관한 법률 시행규칙」에서는 성희롱 행위인지를 판단하기 위한 기준을 예시하고 있습니다(「남녀고용평등과 일·가정 양립 지원에 관한 법률 시행규칙」 제2조 및 별표 1).
성적인 언동의 예시
육체적 행위 입맞춤, 포옹 또는 뒤에서 껴안는 등의 신체적 접촉행위 가슴·엉덩이 등 특정 신체부위를 만지는 행위 안마나 애무를 강요하는 행위 언어적 행위 음란한 농담을 하거나 음탕하고 상스러운 이야기를 하는 행위(전화통화 포함) 외모에 대한 성적인 비유나 평가를 하는 행위 성적인 사실 관계를 묻거나 성적인 내용의 정보를 의도적으로 퍼뜨리는 행위 성적인 관계를 강요하거나 회유하는 행위 회식자리 등에서 무리하게 옆에 앉혀 술을 따르도록 강요하는 행위 시각적 행위 음란한 사진·그림·낙서·출판물 등을 게시하거나 보여주는 행위(컴퓨터통신이나 팩시밀리 등을 이용하는 경우 포함) 성과 관련된 자신의 특정 신체부위를 고의적으로 노출하거나 만지는 행위 그 밖에 사회통념상 성적 굴욕감 또는 혐오감을 느끼게 하는 것으로 인정되는 언어나 행동
고용에서 불이익을 주는 것의 예시
채용탈락, 감봉(減俸), 승진탈락, 전직(轉職), 정직(停職), 휴직, 해고 등과 같이 채용 또는 근로조건을 일방적으로 불리하게 하는 것
◀시각적인 성희롱▶ Q: 직장 동료가 여성의 누드 사진을 자신의 컴퓨터 바탕화면으로 저장해 둔 경우나 사무실에 야한 달력을 걸어 둔 것도 성희롱에 해당하나요? A: 오직 자신이 즐기기 위해 그와 같은 행위를 했다면 그 자체로는 성희롱 행위에 해당하지 않습니다. 그러나 이로 인해 다른 사람이 성적 굴욕감이나 혐오감을 느꼈고 그 감정을 표현했는데도 그러한 행동을 계속한다면 시각적 행위에 의한 성희롱 행위[「남녀고용평등과 일·가정 양립 지원에 관한 법률 시행규칙」 제2조 및 별표 1 제1호다목(1)]에 해당합니다.
◀언어적 행위에 의한 성희롱▶ Q: 우리 회사 사무실에는 남자 사원들이 대부분입니다. 회식자리 뿐만 아니라 업무 중에도 음담패설이나 야한 농담을 하곤 해서 당혹스럽습니다. 성희롱에 해당하나요? A: 음란한 농담이나 음담패설은 언어적 행위에 의한 성희롱 행위[「남녀고용평등과 일·가정 양립 지원에 관한 법률 시행규칙」 제2조 및 별표 1 제1호나목(1)]에 해당합니다.특히 어느 한쪽의 성(性)이 수적으로 우세한 곳에서 성적인 농담을 하는 것은 다른 성을 가진 사람에게 더욱 당혹감을 줄 수 있습니다. 상대방이 그런 행위에 대해 어떠한 거부 의사도 표현하지 않았다고 해서 성희롱 행위에 대한 책임에서 벗어날 수 있는 것은 아닙니다. 상대방이 그러한 행위에 동참하지 않았다는 것은 소극적인 거부의 의사로 보아야 합니다. (법률신문-법률상담사례)"
