cate2,paragraph
소액사건재판의 개념,"“소액사건재판”이란 소송의 당사자가 소송에 의해 청구하는 금액이나 물건의 가치가 3,000만원을 초과하지 않는 소액사건에 대하여 다른 민사사건보다 간편하게 소를 제기하고 소송을 수행할 수 있게 하는 제도를 말합니다.  「소액사건심판법」의 적용을 받을 목적으로 청구를 분할하여 그 일부만을 청구할 수 없습니다.
소액사건재판
“소액사건재판”이란 민사사건 중 ‘소송목적의 값’이 3,000만원 이하인 사건(「소액사건심판법」 제2조제1항, 「소액사건심판규칙」 제1조의2)인 경우 다른 민사사건에 대한 소송보다 간편하게 소를 제기하고 소송을 수행할 수 있는 제도를 말합니다.
“소송목적의 값”이란 소송목적의 값을 말하는 것으로, 원고가 소송을 통해 달성하려는 목적이 갖는 경제적 이익을 화폐단위로 평가한 금액입니다. 「민사소송법」 제26조제1항에서 “소로서 주장하는 이익”이 이에 해당합니다.
소액사건재판의 특징
1. 소액사건의 신속한 처리를 위하여 소장이 접수되면 즉시 변론기일을 지정하여 1회의 변론기일로 심리를 마치고 즉시 선고할 수 있도록 하고 있습니다.다만, 법원이 이행권고결정을 하는 경우에는 즉시 변론기일을 지정하지 않고, 일단 피고에게 이행권고결정등본을 송달(送達)한 후 이의가 있을 경우에만 변론기일을 즉시 지정하여 재판을 진행하게 됩니다.2. 당사자의 배우자, 직계혈족, 형제자매는 법원의 허가 없이도 소송대리인이 될 수 있습니다.이 경우 신분관계를 증명할 수 있는 가족관계기록사항에 관한 증명서 또는 주민등록등본 등으로 신분관계를 증명하고, 소송위임장으로 수권(授權)관계를 증명하여야 합니다.3. 법원은 소장, 준비서면 기타 소송기록에 의하여 청구가 이유 없음이 명백한 때에는 변론 없이도 청구를 기각(棄却)할 수 있습니다.4. 증인은 판사가 신문(訊問)하고, 상당하다고 인정한 때에는 증인 또는 감정인의 신문에 갈음하여 진술을 기재한 서면을 제출케 할 수 있습니다.5. 판결의 선고는 변론종결 후 즉시 할 수 있고, 판결서에는 이유를 기재하지 않을 수 있습니다.<출처 : 대법원 전자민원센터-절차안내-민사-소액사건재판>
소액사건의 범위
지방법원 및 지방법원지원의 관할인 제1심 사건으로서 제소한 때의 소송목적의 값이 3,000만원을 초과하지 않는 금전 기타 대체물이나 유가증권의 일정한 수량의 지급을 목적으로 하는 제1심의 민사사건이 소액사건에 해당합니다(「소액사건심판법」 제2조제1항, 「소액사건심판규칙」 제1조의2 본문).
다만, 다음의 어느 하나에 해당하는 사건은 소액사건에서 제외합니다(「소액사건심판규칙」 제1조의2 단서).
√ 소의 변경으로 소액사건에 해당하지 않게 된 사건
√ 당사자참가, 중간확인의 소 또는 반소(反訴)의 제기 및 변론의 병합으로 인하여 소액사건에 해당하지 않는 사건과 병합심리하게 된 사건
소송목적의 값 산정
소송목적의 값은 원고가 청구취지로써 구하는 범위에서 원고의 입장에서 보아 전부 승소하였을 경우에 직접 받게 될 경제적 이익을 객관적으로 평가하여 산정하는데, 소가 제기된 때를 기준으로 하여 정하게 됩니다(「민사소송법」 제26조, 「민사소송 등 인지법」 제2조제3항, 「민사소송 등 인지규칙」 제6조 및 제7조).
하나의 소로 여러 개의 청구를 하는 경우에는 그 여러 청구의 값을 모두 합하여 소송목적의 값을 정합니다(「민사소송법」 제27조제1항).
주된 청구와 함께 과실(果實)·손해배상·위약금 또는 비용의 부대(附帶)청구를 하는 경우에는 그 값은 소송목적의 값에 넣지 않습니다(「민사소송법」 제27조제2항).
※ 소송목적의 값 산정의 예 A가 B에게 1년 전 빌려준 돈 2000만원, 6개월 전 빌려준 돈 500만원을 모두 돌려받기 위해 하나의 소로써 대여금반환청구를 하는 경우 소송목적의 값은 2,500만원이 되며, 이 때 원금에 대한 이자는 소송목적의 값에 산입하지 않습니다.
소송목적의 값 산정에 대한 구체적인 기준은 「민사소송 등 인지규칙」 에서 자세히 정하고 있으며(「민사소송 등 인지규칙」 제9조부터 제24조까지), 소송목적의 값의 산정을 위한 자료가 부족하거나 그 밖의 사유에 따라 소송목적의 값을 산정하기 어려운 때에는 재판장이 소송목적의 값을 인정하게 됩니다(「민사소송 등 인지법」 제2조제3항 및 「민사소송 등 인지규칙」 제3조 본문).
일부 청구의 금지
일반적인 민사소송절차보다 간편한 「소액사건심판법」을 적용받기 위해 금전 기타 대체물이나 유가증권의 일정한 수량의 지급을 목적으로 하는 청구에 있어서 채권자는 「소액사건심판법」의 적용을 받을 목적으로 청구를 분할하여 그 일부만을 청구할 수 없습니다(「소액사건심판법」 제5조의2제1항).
이에 위반한 소는 판결로 각하(却下)됩니다(「소액사건심판법」 제5조의2제2항).
※ 예를 들어, 빌려준 돈 5,000만원을 받기 위해 각각 2,500만원씩 나누어 대여금반환청구를 하여 소액사건재판제도를 이용할 수는 없습니다.
< 소액사건의 소제기는 어떻게 하나요? >  Q. 청구금액이 적은 민사사건에 대해서는 법원에 소액심판청구를 하면 간편하게 해결할 수 있다는 이야기를 들었습니다. 소액심판청구는 어떻게 하면 되나요?  A. 소를 제기한 때의 소송목적의 값이 3,000만원을 초과하지 않는 금전 기타 대체물, 유가증권의 지급을 청구하는 경우에는 일반민사절차에 비해 신속하고 간편한 소액심판절차를 이용할 수 있습니다. 소액사건의 소제기는 말로 하거나(「소액사건심판법」 제4조) 당사자가 직접 소장을 작성하는 방식으로 할 수 있습니다. 말로 소제기를 하고자 할 경우에는 소송에 필요한 증거서류와 도장, 인지대, 송달료 등을 준비하고 상대방의 주소, 성명을 정확히 알아서 법원 소장접수 담당사무관 등에게 제출하고 면전에서 진술하면 법원사무관 등이 제소조서를 작성하게 됩니다(「소액사건심판규칙」 제3조). 그리고 직접 소장을 작성하여 제출하고자 할 경우에는 관할지방법원, 지원 또는 시·군 법원 민원실에서 양식을 교부받아 소장작성요령에 따라 작성하여 제출하면 됩니다."
소액사건재판의 진행과정,"원고가 소액사건의 소를 제기하여 법원이 이행권고결정을 할 경우, 피고의 이의가 없으면 결정이 확정되어 이에 따라 강제집행을 할 수 있고, 피고가 이의 신청을 하면 법원은 지체 없이 변론기일을 지정합니다.     법원이 이행권고결정을 하지 않는 경우, 법원은 소액사건심판법에 따라 지체 없이 변론기일을 지정하거나, 통상의 민사소송절차와 동일하게 피고에게 답변서 제출의무를 고지합니다.     소액사건인 경우 원칙적으로는 1회 변론을 통하여 판결이 선고됩니다.
Q. 소액심판의 경우 이행권고결정제도라는 것이 있어 간편한 절차만 거쳐도 판결을 받은 것과 비슷한 효과를 얻을 수 있다고 하는데, 이행권고결정제도란 어떤 것인가요?
A. 이행권고결정이란 소액사건의 소가 제기된 때에 법원이 결정으로 소장부본이나 제소조서등본을 첨부하여 피고에게 청구취지대로 이행할 것을 권고하는 결정을 말합니다(「소액사건심판법」 제5조의3제1항). 이행권고결정은 원고전부승소판결을 할 수 있는 사건에 한하여 할 수 있으며, ①독촉절차 또는 조정절차에서 소송절차로 이행된 때, ②청구취지나 청구원인이 불명한 때, ③그밖에 이행권고를 하기에 적절하지 않다고 인정하는 때는 할 수 없습니다(「소액사건심판법」 제5조의3제1항). 이행권고결정에는 당사자, 법정대리인, 청구의 취지와 원인, 이행조항을 기재하고, 피고가 이의신청을 할 수 있음과 이행권고결정의 효력의 취지를 부기(附記)하게 됩니다(「소액사건심판법」 제5조의3제2항). 피고는 이행권고결정등본을 송달 받은 날부터 2주 안에 서면으로 이의신청을 할 수 있으며, 그 등본이 송달되기 전에도 이의신청을 할 수 있습니다(「소액사건심판법」 제5조의4제1항·제2항). 이행권고결정은 ①피고가 이행권고결정을 송달 받은 날부터 2주일 안에 이의신청을 하지 않는 때, ②이의신청에 대한 각하결정이 확정된 때, ③이의신청이 취하된 때는 확정판결과 같은 효력을 갖습니다(「소액사건심판법」 제5조의7제1항).
※ 이행권고결정제도에 대한 더 자세한 사항은 이 콘텐츠의 <결정에 의한 이행권고-이행권고결정>에서 확인할 수 있습니다.
통상의 민사소송은 다음과 같은 절차에 따라 진행됩니다.
<출처: 대법원 전자민원센터 홈페이지-절차안내-민사-재판-사건관리개요>
소의 제기 및 소장 부본(副本)의 송달(送達)
소장이 접수되면 형식적 하자(瑕疵)가 없는 한 그 부본을 즉시 상대방에게 송달하고 30일 이내에 답변서를 제출하도록 최고합니다(「민사소송법」 제254조, 제255조 및 제256조제1항).
소장이 송달불능이 된 경우에는 주소보정(補正)명령에 따라 주소를 보정하여 다시 송달하게 되고(「민사소송법」 제254조제1항 참조), 당사자의 주소나 근무장소를 알 수 없는 경우에는 당사자의 신청 또는 직권에 따라 공시송달(公示送達)을 할 수 있습니다(「민사소송법」 제194조제1항).
※ “공시송달”이란 당사자의 행방을 알기 어려워 통상의 방법으로는 송달할 수 없는 경우에 법원사무관 등은 직권으로 또는 당사자의 신청에 따라 공시송달을 할 수 있으며, 재판장은 소송의 지연을 피하기 위해 필요하다고 인정하는 때에 공시송달을 명할 수 있습니다. 공시송달은 법원사무관 등이 송달할 서류를 보관하고 그 사유를 법원게시판에 게시하거나, 관보·공보 또는 신문 게재하거나, 전자통신매체를 이용해 공시하는 방법으로 송달하는 것을 말합니다(「「민사소송규칙」 제54조제1항 및 「민사소송법」 제194조제1항·제3항).
답변서 제출과 변론준비절차
피고가 소장 부본이 송달된 때로부터 30일 이내에 원고의 주장을 부인하는 취지의 답변서를 제출하여 다투는 경우에는 사건을 변론준비절차에 부치게 됩니다(「민사소송법」 제256조제1항 본문).
변론준비절차는 서면을 통해 쟁점을 정리하는 절차입니다(「민사소송법」 제279조제1항, 제280조제1항 및 제285조제1항 참조).
√ 변론준비절차에서는 변론이 효율적이고 집중적으로 실시될 수 있도록 당사자의 주장과 증거 정리
√ 쌍방 당사자는 준비서면에 의한 주장의 제출과 더불어 그 주장을 뒷받침하는 증거신청 및 증거의 현출(現出)을 모두 이 단계에서 마쳐야 함
소장 부본이 송달된 때로부터 30일 이내에 답변서가 제출되지 않았거나 자백 취지의 답변서가 제출된 경우에는 변론없이 원고승소판결을 하게 됩니다(「민사소송법」 제257조 및 제256조제1항).
변론기일과 증거조사
변론준비절차를 거쳐 사건의 쟁점 및 증거가 정리되면 재판장이 미리 지정한 기일에 공개법정에서 변론이 진행됩니다(「민사소송법」 제165조제1항).
가능하면 최초의 기일에 증거조사를 모두 마쳐 변론을 종결하지만(「민사소송법」 제287조), 특별한 사정이 있는 경우에도 가능한 최단기간 안의 날로 다음 변론기일을 지정해야 합니다(「민사소송규칙」 제72조제1항 단서).
쟁점정리기일이 끝나면 이른바 집중증거조사기일이 이어지는데, 증인신문과 당사자신문은 당사자의 주장과 증거를 정리한 뒤 집중적으로 해야 합니다(「민사소송법」 제293조).
소액사건재판의 절차는 다음과 같습니다.
소액사건심판절차는 다음과 같은 점에서 통상의 민사소송절차와 차이가 있습니다.
※ 그러나 소액사건절차는 제1심에 대한 특별절차이므로(「소액사건심판법」 제1조 참조) 소액사건이라도 상고 및 재항고 제한(「소액사건심판법」 제3조) 외에는 민사에 대한 통상의 항고심절차에 따르게 됩니다.
구술에 따른 소 제기
소장이라는 서면으로 소를 제기해야 하는 통사의 민사소송절차와는 달리 구술(具述)로써 소를 제기할 수 있습니다(「소액사건심판법」 제4조).
이행권고결정과 확정판결의 효력
법원은 소가 제기된 경우에 결정으로 소장부본이나 제소조서등본을 첨부하여 피고에게 청구취지대로 이행할 것을 권고할 수 있습니다. 다만, 다음의 어느 하나에 해당하는 때에는 그러하지 않습니다(「소액사건심판법」 제5조의3제1항).
√ 독촉절차 또는 조정절차에서 소송절차로 이행된 때
√ 청구취지나 청구원인이 불명한 때
√ 그 밖에 이행권고를 하기에 적절하지 아니하다고 인정하는 때
※ 소액사건재판에서는 통상의 민사소송절차에서의 피고의 답변서 제출이나 변론준비절차 등의 과정을 볼 수 없으며, 피고가 이행권고결정에 대해 이의신청을 하지 않는 한 변론기일이 별도로 지정되지 않습니다.
이행권고결정은 다음 중 어느 하나에 해당하면 확정판결과 같은 효력을 가집니다(「소액사건심판법」 제5조의7제1항 및 제5조의4제1항).
√ 피고가 이행권고결정서의 등본을 송달받은 날부터 2주일 내에 이의신청을 하지 않은 때
√ 이의신청에 대한 각하(却下)결정이 확정된 때
√ 이의신청이 취하(取下)된 때
이의신청과 변론기일의 지정
피고는 이행권고결정서의 등본을 송달받은 날부터 2주일 내에 서면으로 이행권고결정에 대하여 이의신청을 할 수 있습니다. 다만, 그 등본이 송달되기 전에도 이의신청을 할 수 있습니다(「소액사건심판법」 제5조의4제1항).
피고가 이의신청을 한 때에는 원고가 주장한 사실을 다툰 것으로 보므로 법원은 지체없이 변론기일을 지정해야 합니다(「소액사건심판법」 제5조의4제3항·제5항)."
소액사건재판의 관련 법령,"소액사건에 대하여는 「소액사건심판법」에 특별한 규정이 있는 경우를 제외하고는 「민사소송법」에 따릅니다.
「소액사건심판법」과 「민사소송법」
「소액사건심판법」은 지방법원 및 지방법원지원에서 소액의 민사사건을 간이한 절차에 따라 신속히 처리하기 위하여 「민사소송법」에 대한 특례를 규정하고 있습니다(「소액사건심판법」 제1조).
소액사건에 대하여는 「소액사건심판법」에 특별한 규정이 있는 경우를 제외하고는 「민사소송법」의 규정을 적용합니다(「소액사건심판법」 제2조제2항).
그 밖의 관련 법령
「법원조직법」은 헌법에 따라 사법권을 행사하는 법원의 조직을 정함을 목적으로(「법원조직법」 제1조) 법원의 권한, 종류 등을 정하고 있으며, 「각급 법원의 설치와 관할구역에 관한 법률」은 각급법원의 설치와 관할구역을 정하고 있습니다.
그 밖에 「민사소송 등 인지법」은 민사소송절차에서 인지에 관한 사항을, 「민사집행법」은 강제집행, 경매 및 보전처분의 절차에 관한 사항을 정하고 있습니다.
「주택임대차보호법」 제13조에서는 임차인이 임대인에 대하여 제기하는 보증금반환청구소송에 대해서는 「소액사건심판법」 제6조, 제7조, 제10조 및 제11조의2를 준용합니다."
