cate2,paragraph
민사소송과 소송 전 분쟁해결,"민사소송을 제기하기 전에 간편하게 민사관련 분쟁을 해결할 수 있는 절차에는 민사조정, 제소전 화해, 지급명령신청(독촉절차) 등이 있으며, 그 중 지급명령신청(독촉절차)은 인지액과 송달료 등 비용이 특히 저렴합니다.
민사분쟁해결 절차
민사소송을 하기 전에 간편하게 민사분쟁을 해결할 수 있는 절차에는 민사조정, 제소전 화해, 지급명령신청(독촉절차) 등이 있습니다.
“민사조정”은 민사에 관한 분쟁을 조정(調停) 절차에 따라 당사자의 자주적·자율적 분쟁 해결 노력을 존중하면서 적정·공정·신속하고 효율적으로 해결하기 위한 제도로서(「민사조정법」 제1조), 민사분쟁의 당사자는 법원에 조정을 신청할 수 있고(「민사조정법」 제2조), 당사자 사이에 합의된 사항을 조서에 기재하여 조정이 성립된 경우 재판상의 화해와 같은 효력이 있습니다(「민사조정법」 제28조 및 제29조).
“제소전 화해”란 민사소송을 제기하기 전에 지방법원단독판사 앞에서 화해신청을 하여 민사에 대한 다툼을 미리 해결하는 절차를 말합니다(「민사소송법」 제385조제1항 참조).
화해가 성립하여 조서가 작성된 때에는 확정판결과 같은 효력이 생깁니다(「민사소송법」 제220조).
“지급명령신청(독촉절차)”이란 채권자가 법원에 대해 금전, 그 밖에 대체물이나 유가증권의 일정한 수량의 지급을 목적으로 하는 청구에 대해 법원에 지급명령을 신청하는 절차를 말합니다(「민사소송법」 제462조).
지급명령의 신청에 대해 법원은 채무자를 심문(審問)하지 않고 그 결정을 하게 되며(「민사소송법」 제467조), 이에 대해 채무자가 이의신청을 하지 않거나, 이의신청이 취하(取下) 또는 각하(却下)된 때에는 확정판결과 마찬가지로 채무자에 대해 강제집행할 수 있습니다(「민사소송법」 제474조 및 「민사집행법」 제56조제3호).
※ 지급명령신청(독촉절차)은 채무자가 채무사실은 인정하면서 돈을 갚지 않으려고 하는 경우 신속하고 경제적인 분쟁해결을 기대할 수 있습니다. 따라서 채무자가 채무의 존재를 부정하거나 이미 갚았다고 다투는 경우에는 지급명령신청(독촉절차)보다는 조정신청 또는 소송을 제기하는 것이 더 바람직합니다.
민사조정절차의 장점
1. 소송과 같은 엄격한 절차를 거치지 않고 자유로운 분위기에서 자신의 의견을 충분히 말할 수 있습니다.2. 소송에 비하여 신속한 해결이 가능합니다. 민사조정을 신청하면 빠른 시일 내에 조정기일이 정해지고, 대부분 한번의 기일(期日)출석으로 종료됩니다.3. 비용이 저렴합니다. 소송에 비하여 인지대가 1/10로 저렴합니다.4. 당사자 사이의 상호 타협과 양보에 따라 분쟁을 해결하므로 감정대립이 남지 않습니다.5. 일반적으로 민사조정절차는 조정담당판사 또는 조정위원회가 딱딱한 법정이 아닌 자유로운 분위기의 조정실에서 당사자의 말을 충분히 듣고 실정에 맞게 분쟁을 해결하고, 비공개로 진행되기 때문에 비밀이 철저히 보장됩니다.<출처 : 대법원 전자민원센터-절차안내-민사-소액사건재판-민사조정>
조정의 신청
민사에 관한 분쟁의 당사자는 법원에 조정을 신청할 수 있습니다(「민사조정법」 제2조).
조정사건은 다음의 어느 하나에 해당하는 곳을 관할하는 지방법원, 지방법원지원, 시법원 또는 군법원의 관할로 합니다(「민사조정법」 제3조제1항).
피신청인에 대한 「민사소송법」 제3조부터 제6조까지에 따른 보통재판적 소재지 피신청인의 사무소 또는 영업소 소재지 피신청인의 근무지 분쟁의 목적물 소재지 손해발생지
다만, 조정사건은 그에 상응하는 소송사건의 전속관할법원이나 당사자 사이에 합의로 정한 법원에서 관할할 수 있습니다(「민사조정법」 제3조제2항).
조정의 신청은 서면이나 구술로 할 수 있습니다(「민사조정법」 제5조제1항).
구술로 신청할 때에는 법원서기관, 법원사무관, 법원주사 또는 법원주사보(이하 ‘법원사무관 등’이라 함)의 앞에서 진술해야 합니다(「민사조정법」 제5조제2항).
위의 경우에 법원사무관 등은 조정신청조서를 작성하고 이에 기명날인(記名捺印)해야 합니다(「민사조정법」 제5조제3항).
조정신청을 할 때에는 「민사조정규칙」이 정하는 바에 따라 조정수수료를 내야 합니다(「민사조정법」 제5조제4항).
조정이 성립한 경우
조정은 당사자 사이에 합의한 사항을 조서에 기재함으로써 성립합니다(「민사조정법」 제28조).
조정은 재판상의 화해와 동일한 효력이 있습니다(「민사조정법」 제29조).
조정이 성립하지 않은 경우
조정담당판사는 당사자 사이에 합의가 성립하지 않거나 성립된 합의의 내용이 적당하지 않다고 인정하는 경우에 「민사조정법」 제30조에 따른 결정을 하지 않을 때에는 조정이 성립하지 않은 것으로 사건을 종결시켜야 합니다(「민사조정법」 제27조).
조정담당판사는 합의가 성립되지 않은 사건 또는 당사자 사이에 성립된 합의의 내용이 적당하지 않다고 인정한 사건에 대해 직권으로 당사자의 이익 그 밖의 모든 사정을 고려하여 신청인의 신청 취지에 반하지 않는 한도에서 사건의 공평한 해결을 위한 결정을 할 수 있습니다(「민사조정법」 제30조).
피신청인이 조정기일에 출석하지 않은 경우 조정담당판사는 상당하다고 인정하는 때에는 직권으로 위 결정을 할 수 있습니다(「민사조정법」 제32조).
화해신청의 방식
민사상 다툼에 관하여 당사자는 청구의 취지·원인과 다투는 사정을 밝혀 상대방의 보통재판적이 있는 곳의 지방법원에 화해를 신청할 수 있습니다(「민사소송법」 제385조제1항).
“사람의 보통재판적”은 그의 주소에 따라 정합니다. 다만, 대한민국에 주소가 없거나 주소를 알 수 없는 경우에는 거소(居所)에 따라 정하고, 거소가 일정하지 않거나 거소도 알 수 없으면 마지막 주소에 따라 정합니다(「민사소송법」 제3조).
당사자는 이 화해를 위하여 대리인을 선임하는 권리를 상대방에게 위임할 수 없습니다(「민사소송법」 제385조제2항).
법원은 필요한 경우 대리권의 유무를 조사하기 위하여 당사자본인 또는 법정대리인의 출석을 명할 수 있습니다(「민사소송법」 제385조제3항).
화해신청에는 그 성질에 어긋나지 않으면 소에 관한 규정을 준용(準用)합니다(「민사소송법」 제385조제4항).
화해가 성립한 경우
화해가 성립한 때에는 법원사무관 등은 조서에 당사자, 법정대리인, 청구의 취지와 원인, 화해조항, 날짜와 법원을 표시하고 판사와 법원사무관 등이 기명날인(記名捺印) 또는 서명합니다(「민사소송법」 제386조).
화해, 청구의 포기·인낙(認諾)을 변론조서·변론준비기일조서에 적은 때에는 그 조서는 확정판결과 같은 효력을 가집니다(「민사소송법」 제220조).
화해가 성립하지 않은 경우
화해가 성립하지 않은 때에는 법원사무관 등은 그 사유를 조서에 적어야 합니다(「민사소송법」 제387조제1항).
신청인 또는 상대방이 기일(期日)에 출석하지 않은 때에는 법원은 이들의 화해가 성립하지 않은 것으로 볼 수 있습니다(「민사소송법」 제387조제2항).
법원사무관 등은 「민사소송법」 제387조제1항의 조서등본을 당사자에게 송달(送達)해야 합니다(「민사소송법」 제387조제3항).
※ “송달(送達)”이란 법원이 소송에 관련된 서류를 일정한 방식에 따라 당사자나 소송 관계인에게 보내는 일을 말하는데, 자세한 내용은 「민사소송법」 제174조부터 제197조까지에서 정하고 있습니다.
화해가 성립하지 않은 경우에 당사자는 소제기신청을 할 수 있습니다(「민사소송법」 제388조제1항).
적법한 소제기신청이 있으면 화해신청을 한 때에 소가 제기된 것으로 봅니다. 이 경우 법원사무관 등은 바로 소송기록을 관할법원에 보내야 합니다(「민사소송법」 제388조제2항).
소제기신청은 「민사소송법」 제387조제3항의 조서등본이 송달된 날부터 2주 이내에 해야 합니다. 다만, 조서등본이 송달되기 전에도 신청할 수 있습니다(「민사소송법」 제388조제3항).
위의 기간은 불변기간(不變期間)으로 합니다(「민사소송법」 제388조제4항).
※ “불변기간(不變期間)”에 대해서는 「민사소송법」 제172조 및 「민사소송법」 제173조에서 정하고 있습니다.
화해의 비용
화해비용은 화해가 성립된 경우에는 특별한 합의가 없으면 당사자들이 각자 부담하고, 화해가 성립되지 않은 경우에는 신청인이 부담합니다. 다만, 소제기신청이 있는 경우에는 화해비용을 소송비용의 일부로 합니다(「민사소송법」 제389조).
지급명령신청(독촉절차)의 장점
1. 서류심리만으로 지급명령을 발령합니다.지급명령신청(독촉절차)에서는 법원이 분쟁당사자를 심문(審問)함이 없이 지급명령을 신청한 채권자가 제출한 서류만을 심사하고 지급명령을 발령하므로 채권자는 통상의 소송절차처럼 법원의 법정에 출석할 필요가 없고, 그 결과 법정에 출석하는 데에 따른 시간과 노력을 절약할 수 있습니다.2. 신속하게 분쟁해결을 할 수 있습니다.지급명령신청(독촉절차)은 채무자가 주로 대여금, 물품대금, 임대료 등 금전 지급 채무를 변제하지 않는 경우에 채권자의 지급 명령 신청에 따라 이루어지는 약식의 분쟁 해결 절차입니다. 따라서 채무자가 이의신청을 하면 통상의 소송절차로 이행되지만, 만일 이의신청을 하지 아니하여 지급명령이 확정되면 채권자는 확정된 지급명령에 기하여 강제집행을 신청하여 신속하게 자신의 채권을 만족 받을 수 있으므로 신속한 분쟁 해결이 가능합니다.3. 채권자가 법원에 납부하는 각종 비용이 저렴합니다.채권자는 지급명령을 신청할 때에 소송의 10분의 1에 해당하는 수수료와 당사자 1인당 4회분의 송달료만 납부하면 되므로, 소송절차에 비하여 소요되는 각종 비용이 저렴합니다.4. 지급명령이 확정되면 확정판결과 동일한 같은 효력이 있습니다.또한 지급명령이 확정될 때에는 원칙적으로 별도의 집행문 부여없이 강제집행할 수 있도록 강제집행상의 특례를 규정하고 있습니다.<출처 : 대법원 전자민원센터 홈페이지-절차안내-민사-독촉절차>
지급명령의 신청
금전, 그 밖에 대체물이나 유가증권의 일정한 수량의 지급을 목적으로 하는 청구에 대해 법원은 채권자의 신청에 따라 지급명령을 할 수 있습니다. 다만, 대한민국에서 공시송달(公示送達) 외의 방법으로 송달할 수 있는 경우에 한합니다(「민사소송법」 제462조).
지급명령의 신청(독촉절차)은 채무자의 보통재판적이 있는 곳의 지방법원이나「민사소송법」제7조, 「민사소송법」 제8조 및 「민사소송법」 제9조, 「민사소송법」 제12조 또는 「민사소송법」 제18조에 따른 관할법원의 전속관할로 합니다(「민사소송법」 제463조).
“사람의 보통재판적”은 그의 주소에 따라 정합니다. 다만, 대한민국에 주소가 없거나 주소를 알 수 없는 경우에는 거소(居所)에 따라 정하고, 거소가 일정하지 않거나 거소도 알 수 없으면 마지막 주소에 따라 정합니다(「민사소송법」 제3조).
지급명령의 신청에는 그 성질에 어긋나지 않으면 소에 관한 규정을 준용(準用)합니다(「민사소송법」 제464조).
지급명령의 신청이 「민사소송법」 제462조 본문(적용의 요건) 또는 「민사소송법」 제463조(관할법원)에 어긋나거나, 신청의 취지로 보아 청구에 정당한 이유가 없는 것이 명백한 때에는 그 신청을 각하(却下)해야 합니다. 청구의 일부에 대해 지급명령을 할 수 없는 때에 그 일부에 대해서도 또한 같습니다(「민사소송법」 제465조제1항).
신청을 각하하는 결정에 대해서는 불복할 수 없습니다(「민사소송법」 제465조제2항).
인지액 및 송달료
지급명령신청서에는 「민사소송 등 인지법」 제2조 규정액의 10분의 1에 해당하는 인지를 붙여야 합니다(「민사소송 등 인지법」 제7조제2항).
독촉사건 경우에는 당사자 1명당 4회분의 송달료를 미리 납부합니다[「송달료규칙의 시행에 따른 업무처리요령」(대법원재판예규 제1760호, 시행 2020. 11. 26. 발령·시행) 별표 1].
지급명령의 심문(審問) 등
지급명령은 채무자를 심문하지 않고 합니다(「민사소송법」 제467조).
지급명령에는 당사자, 법정대리인, 청구의 취지와 원인을 적고, 채무자가 지급명령이 송달(送達)된 날부터 2주 이내에 이의신청을 할 수 있다는 것을 덧붙여 적어야 합니다(「민사소송법」 제468조).
지급명령은 당사자에게 송달(送達)해야 합니다(「민사소송법」 제469조제1항).
채무자는 지급명령에 대해 이의신청을 할 수 있습니다(「민사소송법」 제469조제2항).
지급명령에 대해 이의신청이 없거나, 이의신청을 취하하거나, 각하(却下)결정이 확정된 때에는 지급명령은 확정판결과 같은 효력이 있습니다(「민사소송법」 제474조).
지급명령을 하지 않는 경우
채권자는 법원으로부터 채무자의 주소를 보정(補正)하라는 명령을 받은 경우에 소제기신청을 할 수 있습니다(「민사소송법」 제466조제1항).
지급명령을 공시송달(公示送達)에 따르지 않고는 송달할 수 없거나 외국으로 송달해야 할 때에는 법원은 직권에 따른 결정으로 사건을 소송절차에 부칠 수 있습니다(「민사소송법」 제466조제2항).
이 결정에 대해서는 불복할 수 없습니다(「민사소송법」 제466조제3항).
지급명령에 대한 이의신청
채무자가 지급명령을 송달받은 날부터 2주 이내에 이의신청을 한 때에는 지급명령은 그 범위 안에서 효력을 잃습니다(「민사소송법」 제470조제1항).
이 기간은 불변기간(不變期間)으로 합니다(「민사소송법」 제470조제2항).
※ “불변기간(不變期間)”에 대해서는 「민사소송법」 제172조 및 「민사소송법」 제173조에서 정하고 있습니다.
법원은 이의신청이 부적법하다고 인정한 때에는 결정으로 이를 각하(却下)해야 합니다(「민사소송법」 제471조제1항).
이 결정에 대해서는 즉시항고(卽時抗告)를 할 수 있습니다(「민사소송법」 제471조제2항).
소송으로의 이행
채권자가 「민사소송법」 제466조제1항에 따라 소제기신청을 한 경우, 또는 법원이「민사소송법」 제466조제2항에 따라 지급명령신청사건을 소송절차에 부치는 결정을 한 경우에는 지급명령을 신청한 때에 소가 제기된 것으로 봅니다(「민사소송법」 제472조제1항).
채무자가 지급명령에 대해 적법한 이의신청을 한 경우에는 지급명령을 신청한 때에 이의신청된 청구목적의 값에 관하여 소가 제기된 것으로 봅니다(「민사소송법」 제472조제2항).
「민사소송법」 제472조에 따라 소가 제기된 것으로 보는 경우, 지급명령을 발령한 법원은 채권자에게 상당한 기간을 정하여, 소를 제기하는 경우 소장에 붙여야 할 인지액에서 소제기신청 또는 지급명령신청시에 붙인 인지액을 뺀 액수의 인지를 보정(補正)하도록 명해야 합니다(「민사소송법」 제473조제1항).
채권자가 이 기간 이내에 인지를 보정하지 않는 때에는 위 법원은 결정으로 지급명령신청서를 각하(却下)해야 합니다. 이 결정에 대해서는 즉시항고를 할 수 있습니다(「민사소송법」 제473조제2항).
인지가 보정되면 법원사무관 등은 바로 소송기록을 관할법원에 보내야 합니다. 이 경우 사건이 합의부의 관할에 해당되면 법원사무관 등은 바로 소송기록을 관할법원 합의부에 보내야 합니다(「민사소송법」 제473조제3항).
「민사소송법」 제472조의 경우 독촉절차의 비용은 소송비용의 일부로 합니다(「민사소송법」 제473조제4항).
대한법률구조공단 법률상담
법률지식이 부족하면서도 경제적으로 어려워 법의 보호를 충분히 받지 못하는 사람들에게 법률상담, 변호사에 의한 소송대리 및 형사변호 등의 법률적 지원을 하기 위하여 「법률구조법」에 따라 설립된 공공기관인 대한법률구조공단에서는 전 국민을 대상으로 법률문제 전반에 대한 법률상담을 무료로 하고 있습니다.
※ ‘대한법률구조공단 홈페이지-법률구조안내-대상사건 대상자 안내’ 를 참조하시면, 법률상담안내 및 법률구조 또는 소송구조의 대상사건과 대상자 등에 대해 알아 볼 수 있습니다."
소 제기방법,"소액사건의 소 제기는 구술로써 법원사무관 등의 면전(面前)에서 진술하거나 임의로 법원에 출석하여 할 수 있습니다.     소장을 작성하여 제출할 경우 사건의 종류별로 해당하는 양식에 맞게 청구취지와 청구원인을 기재합니다.
구술에 따른 소의 제기
소액사건의 소는 구술로 제기할 수 있습니다(「소액사건심판법」 제4조제1항).
구술로 소를 제기하는 때에는 법원서기관·법원사무관·법원주사 또는 법원주사보(이하 “법원사무관 등”이라 함)의 면전(面前)에서 진술해야 합니다(「소액사건심판법」 제4조제2항).
이 경우에 법원사무관 등은 제소조서를 작성하고 이에 기명날인(記名捺印)해야 합니다(「소액사건심판법」 제4조제3항).
구술제소를 하는 경우에 법원사무관 등은 제소조서의 말미에 다음의 사항을 첨가할 수 있습니다(「소액사건심판규칙」 제3조제1항 및 「민사소송법」 제274조제1항).
1. 당사자의 성명·명칭 또는 상호와 주소
2. 대리인의 성명과 주소
3. 사건의 표시
4. 공격 또는 방어의 방법
5. 상대방의 청구와 공격 또는 방어의 방법에 대한 진술
6. 덧붙인 서류의 표시
7. 작성한 날짜
8. 법원의 표시
임의출석에 따른 소의 제기
소액사건의 경우 양쪽 당사자는 임의로 법원에 출석하여 소송에 대해 변론할 수 있습니다(「소액사건심판법」 제5조제1항).
이 경우에 소의 제기는 구술에 따른 진술로써 합니다(「소액사건심판법」 제5조제2항).
소장제출에 따른 소의 제기
소는 법원에 소장을 제출함으로써 제기합니다(「민사소송법」 제248조).
법원에 비치된 소액사건에 관한 소장양식의 빈칸을 기재하여 직접 작성할 수 있습니다.
법률전문가에게 위임하여 작성할 수 있습니다.
소장의 작성
소장에는 당사자와 법정대리인, 청구의 취지와 원인을 적어야 합니다(「민사소송법」 제249조제1항)
청구원인 기재사항(「민사소송규칙」 제62조)
√ 청구를 뒷받침하는 구체적 사실√ 피고가 주장할 것이 명백한 방어방법에 대한 구체적인 진술√ 입증이 필요한 사실에 대한 증거방법
소장의 첨부서류(「민사소송규칙」 제63조)
√ 피고가 소송능력 없는 사람인 때에는 법정대리인, 법인인 때에는 대표자, 법인이 아닌 사단이나 재단인 때에는 대표자 또는 관리인의 자격을 증명하는 서면√ 부동산에 관한 사건은 그 부동산의 등기사항증명서√ 친족·상속관계 사건은 가족관계기록사항에 관한 증명서√ 어음 또는 수표사건은 그 어음 또는 수표의 사본√ 그 밖에 증거로 될 문서 가운데 중요한 것의 사본√ 정기금판결에 대한 변경의 소(「민사소송법」 제252조제1항)의 소장의 경우 정기금지급확정판결의 사본
소액사건에 관한 소장양식이 법원에 비치되어 있는데, 소장표지는 동일하고 표지 다음에 청구취지와 청구원인을 기재하는 부분에 대하여는 사건의 종류별로 그 양식이 다르므로 해당하는 양식을 찾아 기재합니다.
※ 법원에 비치되어 있는 소액사건에 관한 소장양식의 예는 다음과 같습니다.(예시)1. 노임청구사건의 청구취지 및 청구원인 기재 양식(소액)2. 대여금 청구사건의 청구취지 및 청구원인 기재 양식(소액)3. 매매(물품)대금 청구사건의 청구취지 및 청구원인 기재 양식(소액)4. 수표금 청구사건의 청구취지 및 청구원인 기재 양식(소액)5. 약속어음금 청구사건의 청구취지 및 청구원인 기재 양식(소액)6. 양수금, 인수금 청구사건의 청구취지 및 청구원인 기재 양식(소액)7. 이득상환청구사건의 청구취지 및 청구원인 기재 양식(소액)<출처: ‘대한민국 법원 전자민원센터-양식모음’>
재판장의 소장 심사
당사자와 법정대리인, 청구의 취지와 원인 등 소장의 기재사항에 흠이 있는 경우와 소장에 법률의 규정에 따른 인지를 붙이지 않은 경우에는 재판장은 상당한 기간을 정하고, 그 기간 이내에 흠을 보정(補正)하도록 명해야 합니다. 재판장은 법원사무관등으로 하여금 위 보정명령을 하게 할 수 있습니다(「민사소송법」 제249조제1항 및 제254조제1항).
원고가 이 기간 이내에 흠을 보정(補正)하지 않은 때에는 재판장은 명령으로 소장을 각하(却下)해야 합니다(「민사소송법」 제254조제2항).
재판장의 소장각하명령에 대해서는 즉시항고를 할 수 있습니다(「민사소송법」 제254조제2항 및 제3항).
※ '즉시항고'란 법원의 결정·명령에 대해 상급법원에 불복신청을 하는 것으로서, 신속한 사건해결을 위해 결정·명령이 고지된 날부터 통상 1주일 내에 제기하도록 되어 있습니다(「민사소송법」 제444조 참조).
재판장은 소장을 심사하면서 필요하다고 인정하는 경우에는 원고에게 청구하는 이유에 대응하는 증거방법을 구체적으로 적어 내도록 명할 수 있으며, 원고가 소장에 인용한 서증(書證)의 등본 또는 사본을 붙이지 않은 경우에는 이를 제출하도록 명할 수 있습니다(「민사소송법」 제254조제4항)."
