cate2,paragraph
이행권고결정의 개념,"소액사건의 소장이 접수되면 판사는 심사하여 피고에게 청구취지대로 이행할 것을 권고할 수 있습니다.     이행권고결정에 대하여 피고가 이의신청을 하지 않거나 이의신청에 대한 각하(却下)결정이 확정되거나 이의신청이 취하된 경우에는 이행권고결정은 확정판결과 같은 효력을 가집니다.
결정에 의한 이행권고
법원은 소액사건에 대한 소가 제기된 경우에 결정으로 소장부본(副本)이나 제소조서등본(구술제소의 경우)을 첨부하여 피고에게 청구취지대로 이행할 것을 권고할 수 있습니다(「소액사건심판법」 제5조의3제1항 본문).
※ 다만, 다음의 어느 하나에 해당하는 때에는 결정으로 이행할 것을 권고할 수 없습니다(「소액사건심판법」 제5조의3제1항 단서). 독촉절차 또는 조정절차에서 소송절차로 이행된 때 청구취지나 청구원인이 불명한 때 그 밖에 이행권고를 하기에 적절하지 않다고 인정하는 때
이행권고결정에는 당사자, 법정대리인, 청구의 취지와 원인, 이행조항을 기재하고, 피고가 이의신청을 할 수 있음과 이행권고결정의 효력의 취지를 부기(附記)해야 합니다(「소액사건심판법」 제5조의3제2항).
이행권고결정서의 등본 송달(送達)
법원사무관 등은 이행권고결정서의 등본을 피고에게 송달해야 합니다. 다만, 그 송달은 「민사소송법」 제187조(우편송달), 「민사소송법」 제194조 ,「민사소송법」 제195조 및 「민사소송법」 제196조의 방법(공시송달)으로는 송달할 수 없습니다(「소액사건심판법」 제5조의3제3항).
※“송달(送達)”이란 법원이 소송에 관련된 서류를 일정한 방식에 따라 당사자나 소송 관계인에게 보내는 일을 말하는데, 자세한 내용은 「민사소송법」 제174조부터 제197조까지에서 정하고 있습니다.
법원은 우편송달 및 공시송달의 방법에 의하지 않고는 피고에게 이행권고결정서의 등본을 송달할 수 없는 때에는 지체 없이 변론기일을 지정해야 합니다(「소액사건심판법」 제5조의3제4항).
원고는 법원의 이행권고결정이 피고에게 송달되지 않아 법원으로부터 피고의 주소에 대한 보정(補正)명령을 받은 경우에 「민사소송법」 제187조(우편송달) 또는 「민사소송법」 제194조 ,「민사소송법」 제195조 및 「민사소송법」 제196조의 방법(공시송달)에 의하지 않고는 송달할 방법이 없음을 소명(疎明)하여 변론기일 지정신청을 할 수 있습니다(「소액사건심판규칙」 제3조의3제1항).
이 경우에 법원은 지체 없이 변론기일을 지정해야 합니다(「소액사건심판규칙」 제3조의3제2항).
확정판결과 같은 효력
이행권고결정은 다음의 어느 하나에 해당하면 확정판결과 같은 효력을 가집니다(「소액사건심판법」 제5조의7제1항).
피고가 이행권고결정서의 등본을 송달받은 날부터 2주일 안에 이의신청을 하지 않은 때 이의신청에 대한 각하(却下)결정이 확정된 때 이의신청이 취하된 때
위에 해당하지 않는 이행권고결정은 제1심 법원에서 판결이 선고된 때, 그 효력을 잃습니다(「소액사건심판법」 제5조의7제3항)."
이의신청,"이행권고결정서를 받은 피고는 원고의 청구에 대하여 이의가 있으면 송달(送達)받은 날부터 2주일 내에 또는 등본이 송달되기 전에 서면으로 이의신청을 할 수 있습니다.
이행권고결정에 대한 이의신청
피고는 이행권고결정서의 등본을 송달(送達)받은 날부터 2주일 내에 서면으로 이의신청을 할 수 있습니다. 다만, 그 등본이 송달되기 전에도 이의신청을 할 수 있습니다(「소액사건심판법」 제5조의4제1항).
※ “송달(送達)”이란 법원이 소송에 관련된 서류를 일정한 방식에 따라 당사자나 소송 관계인에게 보내는 일을 말하는데, 자세한 내용은 「민사소송법」 제174조부터 제197조까지에서 정하고 있습니다.
이 기간은 불변기간(不變期間)으로 합니다(「소액사건심판법」 제5조의4제2항).
※ “불변기간(不變期間)”에 대하여는 「민사소송법」 제172조 및 「민사소송법」 제173조에서 정하고 있습니다.
법원은 이의신청이 있는 때에는 지체 없이 변론기일을 지정하여야 합니다(「소액사건심판법」 제5조의4제3항).
이의신청을 한 피고는 제1심 판결이 선고되기 전까지 이의신청을 취하할 수 있습니다(「소액사건심판법」 제5조의4제4항).
피고가 이의신청을 한 때에는 원고가 주장한 사실을 다툰 것으로 봅니다(「소액사건심판법」 제5조의4제5항).
< 이행권고결정을 받은 경우 어떻게 대처해야 하나요?>  Q. 저는 급하게 돈이 필요하여 6개월 전 사채업자로부터 500만원을 빌린 적이 있습니다. 현재 원금은 모두 갚았고 이자만 일부 남아 있는 상황인데, 최근 집으로 이자부분을 넘는 금액이 기재된 이행권고결정이 송달되어 왔습니다. 이 경우 어떻게 대처해야 하나요?  A. 이행권고결정이라 함은 소액사건의 소가 제기된 때에 법원이 결정으로 소장부본이나 제소조서등본을 첨부하여 피고에게 청구취지대로 이행할 것을 권고하는 결정을 말합니다(「소액사건심판법」 제5조의3제1항). 사채업자로부터 빌린 돈의 원금을 모두 변제했다면, 이행권고결정등본을 송달 받은 날부터 2주일의 불변기간 안에 서면으로 이의신청을 할 수 있으며(「소액사건심판법」 제5조의4제1항 본문), 그 등본이 송달되기 전에도 이의신청을 할 수 있습니다(「소액사건심판법」제5조의4제1항 단서). 이의신청이 있으면 법원은 지체 없이 변론기일을 지정해야 합니다(「소액사건심판법」 제5조의4 제3항). 이 경우 이행권고결정등본이 송달된 때는 피고에게 다시 소장부본을 송달하지는 않고 소장부본이나 제소조서등본이 송달된 것으로 간주하고 있습니다(「소액사건심판법」 제6조 단서). 이의신청의 방식은 서면으로 하여야 하는데(「소액사건심판법」 제5조의4제1항), 이의신청서의 양식은 법원에 비치되어 있습니다. 이의신청을 한 때에는 구체적인 이의사유를 기재하지 않더라도 원고의 주장사실을 다툰 것으로 봅니다(「소액사건심판법」 제5조의4제5항).
이의신청의 각하(却下)
법원은 이의신청이 적법하지 않다고 인정되는 경우에는 그 흠을 보정(補正)할 수 없으면 결정으로 이를 각하하여야 합니다(「소액사건심판법」 제5조의5제1항).
이 결정에 대하여는 즉시항고(卽時抗告)를 할 수 있습니다(「소액사건심판법」 제5조의5제2항).
이의신청의 추후보완(追後補完)
피고는 부득이한 사유로 2주일(「소액사건심판법」 제5조의4제1항) 내에 이의신청을 할 수 없었던 경우에는 그 사유가 없어진 후 2주일 내에 이의신청을 추후보완할 수 있습니다. 다만, 그 사유가 없어질 당시 외국에 있는 피고에 대하여는 그 기간을 30일로 합니다(「소액사건심판법」 제5조의6제1항).
피고는 이의신청과 동시에 서면으로 그 추후보완사유를 소명(疎明)하여야 합니다(「소액사건심판법」 제5조의6제2항).
법원은 추후보완사유가 이유 없다고 인정되는 때에는 결정으로 이의신청을 각하(却下)하여야 합니다(「소액사건심판법」 제5조의6제3항).
이 결정에 대하여는 즉시항고를 할 수 있습니다(「소액사건심판법」 제5조의6제4항).
이의신청의 추후보완이 있는 때에는 「민사소송법」 제500조를 준용(準用)합니다(「소액사건심판법」 제5조의6제5항).
추후보완신청이 있는 경우에 불복하는 이유로 내세운 사유가 법률상 정당한 이유가 있다고 인정되고, 사실에 대한 소명(疎明)이 있는 때에는 법원은 당사자의 신청에 따라 담보를 제공하게 하거나 담보를 제공하지 않게 하고 강제집행을 일시정지하도록 명할 수 있으며, 담보를 제공하게 하고 강제집행을 실시하도록 명하거나 실시한 강제처분을 취소하도록 명할 수 있습니다(「민사소송법」 제500조제1항).
담보 없이 하는 강제집행의 정지는 그 집행으로 보상할 수 없는 손해가 생기는 것을 소명한 때에만 합니다(「민사소송법」 제500조제2항).
위의 재판은 변론 없이 할 수 있으며, 이 재판에 대하여는 불복할 수 없습니다(「민사소송법」 제500조제3항).
추후보완신청의 경우에 소송기록이 원심법원에 있으면 그 법원이 위의 재판을 합니다(「민사소송법」 제500조제4항)."
강제집행의 특례 등,"판결이 확정되면 채권자는 따로 집행문을 부여받을 필요 없이 이행권고결정에 기한 강제집행을 할 수 있습니다.     확정된 이행권고결정에 대한 청구이의의 소에 있어서는 이행권고결정 이후의 청구권의 소멸이나 청구권의 행사를 저지하는 사유뿐만 아니라, 이행권고결정 전의 청구권의 불성립이나 무효 등도 그 이의사유가 됩니다.
원고의 강제집행
이행권고결정에 기한 강제집행은 집행문을 부여받을 필요 없이 「소액사건심판법」 제5조의7제2항의 결정서의 정본(正本)에 따라야 합니다. 다만, 다음의 어느 하나에 해당하는 경우에는 그렇지 않습니다(「소액사건심판법」 제5조의8제1항).
이행권고결정의 집행에 조건을 붙인 경우
당사자의 승계인을 위하여 강제집행을 하는 경우
당사자의 승계인에 대하여 강제집행을 하는 경우
원고가 여러 통의 이행권고결정서의 정본(正本)을 신청하거나, 전에 내어준 이행권고결정서 정본을 돌려주지 않고 다시 이행권고결정서 정본을 신청한 때에는 법원사무관 등이 이를 부여합니다. 이 경우 그 사유를 원본(原本)과 정본에 적어야 합니다(「소액사건심판법」 제5조의8제2항).
※ ‘강제집행'에 관한 자세한 내용은 <대법원 전자민원센터 홈페이지-절차안내-강제집행>의 내용을 참조하시기 바랍니다.
피고의 청구이의(請求異議)의 소
확정된 이행권고결정에 대한 청구에 관한 이의의 주장에 관하여는, 「민사집행법」 제44조제2항[판결에 따라 확정된 청구에 관한 청구이의의 소에 있어서는 그 이유가 변론이 종결된 뒤(변론 없이 한 판결의 경우에는 판결이 선고된 뒤)에 생긴 것이어야 한다는 내용의 규정]에 따른 제한을 받지 않습니다(「소액사건심판법」 제5조의8제3항).
따라서 확정된 이행권고결정에 대한 청구이의의 소에 있어서는 이행권고결정 이후의 청구권의 소멸이나 청구권의 행사를 저지하는 사유뿐만 아니라, 이행권고결정 전의 청구권의 불성립이나 무효 등도 그 이의사유가 됩니다(출처: 대법원 2006. 1. 26. 선고 2005다54999 판결)."
변론기일의 지정,"소액사건의 소의 제기가 있는 경우에 판사는 바로 변론기일을 정할 수 있습니다.     판사는 되도록 1회의 변론기일로 심리를 마치도록 하여야 하므로 당사자는 최초의 기일에 필요한 모든 증거방법을 제출할 수 있도록 사전 준비를 하는 것이 좋습니다.
소장의 송달
소장부본(副本)이나 제소조서등본(구술제소의 경우)은 지체 없이 피고에게 송달하여야 합니다. 다만, 피고에게 이행권고결정서의 등본이 송달된 때에는 소장부본이나 제소조서등본이 송달된 것으로 봅니다(「소액사건심판법」 제6조).
※“송달(送達)”이란 법원이 소송에 관련된 서류를 일정한 방식에 따라 당사자나 소송 관계인에게 보내는 일을 말하는데, 자세한 내용은 「민사소송법」 제174조부터 제197조까지에서 정하고 있습니다.
1회 변론종결 원칙
소액사건의 소 제기가 있는 경우에 판사는 「민사소송법」 제256조, 「민사소송법」 제257조 및 「민사소송법」제258조의 규정에도 불구하고 바로 변론기일을 정할 수 있습니다(「소액사건심판법」 제7조제1항).
이 경우에 판사는 되도록 1회의 변론기일로 심리를 마치도록 하여야 합니다(「소액사건심판법」 제7조제2항).
1회 변론종결(「소액사건심판법」 제7조제2항)을 위하여 판사는 변론기일 전이라도 당사자로 하여금 증거신청을 하게 하는 등 필요한 조치를 취할 수 있습니다(「소액사건심판법」 제7조제3항).
1회 변론종결(「소액사건심판법」 제7조제2항)을 위하여 원고에 대한 최초의 기일통지서에는 다음의 사항을 적어야 합니다(「소액사건심판규칙」 제5조제1항).
√ 최초의 기일(期日)에 필요한 모든 증거방법을 제출할 수 있도록 사전 준비를 할 것√ 최초의 기일 전이라도 증거신청이 가능하다는 것√ 서증(書證)을 제출할 때에는 동시에 그 사본 2통을 첨가하여 제출하여야 한다는 것(상대방의 수가 2인 이상일 때에는 그 수에 1을 더한 통수)√ 증인신문(訊問)을 신청하는 때에는 신청서와 동시에 신문사항의 요령을 기재한 서면 4통을 제출하여야 한다는 것(상대방의 수가 2인 이상일 때에는 그 수에 3을 더한 통수)
※ 다음의 어느 하나에 해당하는 경우 법원은 지체 없이 변론기일을 지정하여야 합니다.
√ 이행권고결정에 대하여 피고가 이의신청을 한 경우(「소액사건심판법」 제5조의4제3항)
√ 우편송달 및 공시송달의 방법에 의하지 않고는 피고에게 이행권고결정서의 등본을 송달할 수 없는 경우(「소액사건심판법」 제5조의3제4항)
공휴일·야간의 개정(開廷)
판사는 필요한 경우 근무시간 외 또는 공휴일에도 개정할 수 있습니다(「소액사건심판법」 제7조의2)."
소액사건의 심리,"법원은 소액사건의 경우 소장ㆍ준비서면 기타 소송기록에 의하여 청구가 이유 없음이 명백한 때에는 변론 없이 청구를 기각할 수 있습니다.     판사는 직권으로 증거조사를 할 수 있습니다.     소액사건의 경우 원격영상재판을 활용할 수 있습니다.
변론의 생략 등
법원은 소장·준비서면 기타 소송기록에 따라 청구가 이유 없음이 명백한 때에는 변론 없이 청구를 기각할 수 있습니다(「소액사건심판법」 제9조제1항).
판사의 경질이 있는 경우라도 변론의 갱신(更新) 없이 판결할 수 있습니다(「소액사건심판법」 제9조제2항).
판사의 증거조사
판사는 필요하다고 인정한 때에는 직권으로 증거조사를 할 수 있습니다. 그러나 그 증거조사의 결과에 관하여는 당사자의 의견을 들어야 합니다(「소액사건심판법」 제10조제1항).
증인은 판사가 신문(訊問)합니다. 그러나 당사자는 판사에게 고(告)하고 신문(訊問)할 수 있습니다(「소액사건심판법」 제10조제2항).
서면 제출
판사는 상당하다고 인정한 때에는 증인 또는 감정인(鑑定人)의 신문(訊問)에 갈음하여 서면을 제출하게 할 수 있습니다(「소액사건심판법」 제10조제3항).
위 규정에에 따라 신문(訊問)에 갈음하여 서면을 제출하기로 결정된 증인 또는 감정인(鑑定人)은 법원에 그 신문서(訊問書)를 제출할 때에 주민등록표 초본이나, 동장·이장이 그 동일성을 증명하는 서면을 첨부하여야 합니다(「소액사건심판규칙」 제6조제1항).
증인 또는 감정인에 대한 서면신문은 재판사무에 관한 문서양식에 따른 신문서(訊問書)를 송달(送達)하여 행합니다(「소액사건심판규칙」 제6조제2항).
※ “송달(送達)”이란 법원이 소송에 관련된 서류를 일정한 방식에 따라 당사자나 소송 관계인에게 보내는 일을 말하는데, 자세한 내용은 「민사소송법」 제174조부터 제197조까지에서 정하고 있습니다.
신문서에는 증인 또는 감정인이 서명·날인하여야 합니다(「소액사건심판규칙」 제6조제3항).
판사의 허가
조서는 당사자의 이의가 있는 경우를 제외하고 판사의 허가가 있는 때에는 이에 기재할 사항을 생략할 수 있습니다(「소액사건심판법」 제11조제1항).
위 규정은 변론의 방식에 관한 규정의 준수와 화해·인낙(認諾)·포기·취하 및 자백에 대하여는 이를 적용하지 않습니다(「소액사건심판법」 제11조제2항).
원격영상재판이란
원격영상재판이란 재판관계인이 교통의 불편 등으로 법정에 직접 출석하기 어려운 경우에 재판관계인이 동영상 및 음성을 동시에 송·수신하는 장치가 갖추어진 다른 원격지의 법정에 출석하여 진행하는 재판을 말합니다(「원격영상재판에관한특례법」 제2조제2호).
※ ""재판관계인""이란 법관·당사자·증인 등 법원의 재판절차에 참여하는 자를 말합니다(「원격영상재판에관한특례법」 제2조제1호).
소액사건에 대하여도 원격영상재판을 할 수 있습니다.
법원은 다음의 어느 하나에 해당하는 사건에 한하여 원격영상재판을 할 수 있습니다(「원격영상재판에관한특례법」 제3조).
「소액사건심판법」의 적용을 받는 민사사건 화해·독촉 및 조정에 관한 사건 20만원 이하의 벌금 또는 구류(拘留)나 과료(科料)에 처할 범죄사건(즉결심판하는 경우에 한함) 「가족관계의 등록 등에 관한 법률」 제75조에 의한 협의상 이혼의 확인 원격영상재판을 하는 과정에서 발생하는 「법원조직법」 제61조제1항(감치 등)의 사건 다른 법률에 의하여 시(市)법원 또는 군(郡)법원의 권한에 속하는 사건
원격영상재판의 효과
원격영상재판은 재판관계인이 같은 법정에 출석하여 진행하는 재판으로 봅니다(「원격영상재판에관한특례법」 제4조)."
