cate2,paragraph
입양기관의 직무 및 사후서비스 제공,"입양기관은 양친의 자격요건을 조사하고 양친될 사람에게 입양아동에 관한 교육 및 인도,양자가 될 아동에 대한 가족관계 등록 창설 신고, 인도받은 날부터 입양이 완료될 때까지 그 아동의 후견인이 되는 등 입양 전반에 걸친 모든 업무를 담당하고 있습니다. 입양기관은 입양이 성립된 후 1년 동안 양친과 양자의 상호적응을 위하여 사후관리를 해야 하며, 국가가 구축한 정보시스템을 통해 입양아동 등에 대한 사후서비스 제공과 국내입양 활성화에 필요한 정보를 제공받습니다.
양친이 될 사람에 대한 자격요건 조사
입양기관은 입양을 알선할 때 그 양친이 될 사람에 대한 자격요건(「입양특례법」 제10조)을 조사합니다(「입양특례법」 제21조제2항).
입양아동에 관한 교육 및 인도와 보고
입양기관은 양친이 될 사람에게 입양 전에 아동양육에 관한 교육을 해야 하며, 입양이 성립된 후에는 입양아동과 그에 관한 기록과 소유물품을 양친 또는 양친이 될 사람에게 건네주고, 그 결과를 특별자치도지사·시장·군수·구청장에게 보고합니다(「입양특례법」 제21조제3항 및 「입양특례법 시행규칙」 제22조제1항).
입양정보의 제공
입양기관은 입양업무의 효율 및 입양기관 간의 협력체계 구축을 위하여 입양아동과 가족에 관한 다음의 정보를 아동권리보장원에 제공합니다(「입양특례법」 제21조제4항·제7항 및 「입양특례법 시행규칙」 제23조제1항).
입양기관에 보호 의뢰된 아동의 성명·주민등록번호·주소, 출생 일시 및 장소, 성별, 장애 또는 질환의 유무와 종류
친생부모의 성명·주민등록번호·주소·연락처, 입양 사유와 입양의 동의에 관한 사항 및 입양정보의 공개에 대한 동의 여부
양친 또는 양친이 될 사람의 성명·생년월일·국적·주소 및 연락처
가정법원의 입양허가 결정이 확정된 시기 및 입양신고일(국외입양의 경우 출국일)
입양업무 기록 및 전자기록의 보존
입양기관은 입양업무에 관한 다음의 사항을 기록하며, 입양기록은 전자문서로 기록할 수 있습니다(「입양특례법」 제21조제5항 및 「입양특례법 시행규칙」 제24조).
「입양특례법」 제10조제3항에 따른 교육
「입양특례법」 제13조제3항 및 제4항에 따른 상담
입양 알선 및 실적
「입양특례법」 제19조제3항에 따른 국외입양아동의 외국 국적 취득 보고
「입양특례법」 제20조제4항에 따른 보수교육
「입양특례법」 제23조에 따른 가족관계 등록 창설
「입양특례법」 제25조에 따른 사후서비스 제공
「입양특례법」 제23조제1항 각 호의 정보
입양업무에 관한 기록은 입양아동에 대한 사후관리를 위하여 영구보존합니다(「입양특례법」 제21조제6항).
입양기록을 전자문서로 기록한 경우에는 「입양특례법」 제6조의 정보시스템을 이용하여 영구보존합니다(「입양특례법 시행규칙」 제25조제1항).
입양정보의 공개
입양기관은 양자가 된 사람의 요청이 있을 때에는(단, 양자가 된 사람이 미성년자인 경우에는 양친의 동의를 받아야 함) 입양아동의 친생부모의 동의를 받아 정보를 공개해야 합니다. 다만, 친생부모가 정보의 공개에 동의하지 않는 경우에는 그 친생부모의 인적사항을 제외하고 정보를 공개합니다(「입양특례법」 제36조제1항·제2항).
친생부모가 사망이나 그 밖의 사유로 동의할 수 없는 경우에는 양자가 된 사람의 의료상 목적 등 특별한 사유가 있는 경우에는 친생부모의 동의 여부와 관계없이 입양정보를 공개할 수 있습니다(「입양특례법」 제36조제3항).
입양기관의 후견직무
입양기관은 입양을 알선하기 위해서 보장시설의 장, 부모 등으로부터 양자될 아동을 인도받았을 때에는 인도받은 날부터 입양이 완료될 때까지 그 아동의 후견인이 됩니다. 다만, 양자가 될 아동에게 법원이 이미 후견인을 둔 경우에는 예외로 합니다(「입양특례법」 제22조제1항).
가족관계 등록 창설
입양기관은 양자가 될 아동이 가족관계등록이 되어 있지 않는 때에는 그 아동에 대한 가족관계 등록 창설 신고를 합니다(「입양특례법」 제23조).
입양알선이 곤란한 사람의 보호
입양기관은 다음의 어느 하나에 해당하는 사람이 있는 경우에는 시·도지사 또는 시장·군수·구청장에게 이를 보고합니다(「입양특례법」 제24조제1항).
부모 또는 후견인이 입양에 동의하여 보장시설에 보호 의뢰된 사람으로서 입양알선이 곤란한 사람
「입양특례법」에 따른 입양이 취소되거나 파양을 선고받은 사람으로서 보호자가 입양기관에 보호를 요청한 사람
양친과 양자의 상호적응을 위한 사후관리
입양기관은 입양이 성립된 후 1년 동안 양친과 양자의 상호적응을 위하여 다음의 사후관리를 해야 합니다. 다만, 국외입양은 해당되지 않습니다(「입양특례법」 제25조제1항).
양친과 양자의 상호적응상태에 관한 관찰 및 이에 필요한 서비스
입양가정에서의 아동양육에 필요한 정보의 제공
입양가정이 수시로 상담할 수 있는 창구의 개설 및 상담요원의 배치
입양기관은 해당 국가의 협력기관을 통하여 입양아동이 입양된 국가의 국적을 취득하였는지를 확인하고 그 결과를 「아동복지법」 제10조의2에 따른 아동권리보장원의 원장을 통하여 보건복지부장관에게 보고해야 합니다(「입양특례법」 제25조제2항).
입양기관은 국외로 입양된 아동을 위하여 모국방문사업 등 다음의 사업을 실시합니다(「입양특례법」 제25조제3항 및 「입양특례법 시행령」 제5조).
모국방문사업
모국어 연수 지원
모국에 관한 자료 제공
친생부모 찾기 사업과 입양정보 공개제도에 관한 홍보
국적 회복 지원
국외로 입양된 아동(성년이 된 경우를 포함)을 위한 상담
입양기관은 국가가 구축한 정보시스템을 통해 입양아동 등에 대한 사후서비스 제공과 국내입양 활성화에 필요한 정보를 제공받습니다(「입양특례법」 제6조제1항)."
아동권리보장원,"중앙입양원은 아동의 권익을 보장하고 입양에 대한 사회적 책임을 완수하기 위하여 입양 관련 업무지원ㆍ조정 기능을 수행합니다. 중앙입양원은 입양아동ㆍ가족정보 및 친가족 찾기에 필요한 통합데이터베이스를 운영ㆍ구축ㆍ연계하고 국내외 입양정책 및 서비스에 관한 조사 및 연구, 입양 관련 국제협력 등을 주된 업무로 하고 있습니다.
아동권리보장원의 설립목적
보건복지부장관은 아동정책에 대한 종합적인 수행과 아동복지 관련 사업의 효과적인 추진을 위하여 필요한 정책의 수립을 지원하고 사업평가 등의 업무를 수행할 수 있도록 아동권리보장원을 설립하며, 아동복지보장원은 「아동복지법」에서 정한 사항 외에는 「민법」 중 재단법인에 관한 규정을 준용하여 운영합니다(「아동복지법」 제10조의2제1항·제6항).
아동권리보장원은 모든 아동이 안전하고 행복하게 성장할 권리를 보장한다는 미션아래 아동 이익을 최우선으로 하는 아동권리 실현의 중심기관이라는 비전을 가지고 통합적 아동 서비스 체계 구축과 아동정책 서비스의 전문성 제고 및 아동서비스 책임성 강화라는 전략을 실현하기 위해 운영되고 있습니다(출처: 아동권리보장원 홈페이지).
※ 기존「입양특례법」의 중앙입양원을「아동복지법」 제10조의2에 따른 아동권리보장원으로 합니다[「입양특례법」 부칙(법률 제16248호) 제6조].
아동권리보장원은 다음의 업무를 수행합니다(「아동복지법」 제10조의2제2항제9호).
입양아동·가족정보 및 친가족 찾기에 필요한 통합데이터베이스 운영
입양아동의 데이터베이스 구축 및 연계
국내외 입양정책 및 서비스에 관한 조사 및 연구
입양 관련 국제협력 업무
관계 기관 등에 대한 협조 요청
아동권리보장원 원장은 업무수행을 위하여 필요한 경우 공공기관, 입양기관 등에 대하여 자료를 제출하도록 요청할 수 있으며, 요청을 받은 기관은 특별한 사유가 없으면 자료를 제출하여야 합니다(「입양특례법」 제29조제1항).
제공된 자료는 「아동복지법」 제10조의2제2항에서 정한 업무수행을 위한 목적 외에는 사용해서는 안 됩니다(「입양특례법」 제29조제2항).
입양정보의 공개
입양기관은 양자가 된 사람의 요청이 있을 때에는(단, 양자가 된 사람이 미성년자인 경우에는 양친의 동의를 받아야 함) 입양아동의 친생부모의 동의를 받아 정보를 공개해야 합니다. 다만, 친생부모가 정보의 공개에 동의하지 않는 경우에는 그 친생부모의 인적사항을 제외하고 정보를 공개합니다(「입양특례법」 제36조제1항, 제2항).
친생부모가 사망이나 그 밖의 사유로 동의할 수 없는 경우에는 양자가 된 사람의 의료상 목적 등 특별한 사유가 있는 경우에는 친생부모의 동의 여부와 관계없이 입양정보를 공개할 수 있습니다(「입양특례법」 제36조제3항).
입양정보에 대한 비밀유지의무
입양기관에 종사하는 사람 또는 종사하였던 사람은 입양정보를 공개하는 때를 제외하고는 그 업무를 행하는 과정에서 알게 된 비밀을 누설해서는 안 됩니다(「입양특례법」 제37조).
※ 이를 위반하는 경우 3년 이하의 징역 또는 3천만원 이하의 벌금에 처해집니다(「입양특례법」 제44조제1항제3호)."
일반양자의 입양 신고절차,"일반양자의 입양은, 「가족관계의 등록 등에 관한 법률」이 정한 바에 따라 신고함으로써 그 효력이 생깁니다.
일반양자 입양의 효력 발생
입양은 「가족관계의 등록 등에 관한 법률」이 정한 바에 따라 신고함으로써 그 효력이 생깁니다(「민법」 제878조).
신고자 및 신고방법
입양 신고는 입양의 당사자가 해야 하며, 양자가 13세 미만인 경우에는 입양을 승낙한 법정대리인이 신고해야 합니다( 「가족관계의 등록 등에 관한 법률」 제62조제1항).
신고자가 미성년자 또는 피성년후견인인 경우에는 친권자, 미성년후견인 또는 성년후견인이 신고의무자가 되지만, 미성년자 또는 피성년후견인 본인이 직접 신고를 해도 됩니다( 「가족관계의 등록 등에 관한 법률」 제26조제1항).
친권자, 미성년후견인 또는 성년후견인이 신고하는 경우에는 신고서에 ① 신고해야 할 미성년자 또는 피성년후견인의 성명·출생연월일·주민등록번호 및 등록기준지, ② 신고하여야 할 사람이 미성년자 또는 피성년후견인이라는 사실, ③ 신고인이 친권자, 미성년후견인 또는 성년후견인이라는 사실을 기재해야 합니다( 「가족관계의 등록 등에 관한 법률」 제26조제2항).
입양신고는 서면이나 말로 할 수 있으며, 그 외에 시(구)·읍·면의 사무소에 출석하여 신고서에 기재할 사항을 진술하는 방법으로도 할 수 있습니다( 「가족관계의 등록 등에 관한 법률」 제23조제1항 및 제31조).
입양신고는 전산정보처리조직을 이용하여 전자문서로도 가능하며, 이 때 입양신고는 신고사건 본인의 등록기준지 시·읍·면의 장이 처리합니다( 「가족관계의 등록 등에 관한 법률」 제23조의2제1항 및 제2항 전단).
신고의 기간 및 장소
입양신고는 입양의 요건이 갖추어지면 언제든지 할 수 있습니다. 입양신고는 창설적인 신고이기 때문입니다.
입양신고는 신고사건 본인의 등록기준지 또는 신고인의 주소지나 현재지에서 할 수 있습니다(「가족관계의 등록 등에 관한 법률」 제20조제1항 본문).
※ 다만, 외국에 거주하거나 체류하는 대한민국 국민의 경우 재외국민 가족관계등록사무소에서도 할 수 있습니다(「가족관계의 등록 등에 관한 법률」 제20조제1항 단서).
※ “등록기준지”란 가족관계등록부의 등록을 하는 곳(시·읍·면의 사무소, 특별시 및 광역시와 구를 둔 시에서는 구의 사무소)을 말합니다. 출생 또는 그 밖의 사유로 처음으로 등록하는 경우에는 등록기준지를 정하여 신고해야 하는데, 신고인이 임의로 정할 수 있으며, 대법원규칙으로 정하는 절차에 따라 변경할 수도 있습니다.(「가족관계의 등록 등에 관한 법률」 제3조, 제10조 및「가족관계의 등록 등에 관한 규칙」 제4조 참조).
입양신고서의 기재사항 및 첨부서류
입양신고서에는 다음의 사항을 기재해야 합니다[「가족관계의 등록 등에 관한 법률」 제24조, 제61조 및 「가족관계등록사무의 문서 양식에 관한 예규」(대법원 가족관계등록예규 제543호, 2019. 12. 19. 발령, 2019. 12. 27. 시행) 제3조 및 양식 제4호].
당사자(양친과 양자)의 성명·본·출생연월일·주민등록번호·등록기준지(당사자가 외국인인 때에는 그 성명·출생연월일·국적 및 외국인등록번호) 및 양자의 성별
양자의 친생부모의 성명·주민등록번호 및 등록기준지
입양에 대한 부모 또는 다른 사람의 동의나 승낙이 필요한 경우에는 신고서에 그 동의나 승낙을 증명하는 서면(동의서 등)을 첨부해야 하며, 이 경우 동의나 승낙을 한 사람으로 하여금 신고서에 그 사유를 적고 서명 또는 기명날인하게 함으로써 그 서면의 첨부를 갈음할 수 있습니다(「가족관계의 등록 등에 관한 법률」 제32조제1항).
미성년자를 입양하는 경우 또는 피성년후견인이 입양을 하거나 양자가 되는 경우에는 가정법원의 허가서를 첨부해야 합니다( 「가족관계의 등록 등에 관한 법률」 제62조제2항).
부모의 동의를 갈음하는 심판이 있는 경우에는 가정법원의 심판서를 첨부해야 합니다( 「가족관계의 등록 등에 관한 법률」 제62조제3항).
입양신고의 심사
시·읍·면·동의 장이나 재외공관의 장은 입양신고서를 심사하여 입양의 요건, 입양신고의 방식 그 밖에 법령에 위반함이 없는 때에는 지체 없이 그 신고를 수리합니다(「민법」 제881조, 「가족관계의 등록 등에 관한 규칙」 제43조제1항).
외국에서의 신고
외국에 있는 본국민사이의 입양은 그 외국에 주재하는 대사, 공사 또는 영사에게 신고할 수 있습니다(「민법」 제882조 및 제814조제1항).
위 신고를 수리한 대사, 공사, 영사 또는 재외공관의 장은 1개월 이내에 그 신고서류를 재외국민 가족관계등록사무소에 송부해야 합니다(「민법」 제882조, 제814조제2항 및 「가족관계의 등록 등에 관한 법률」 제34조, 제35조, 제36조 참조)."
친양자의 입양허가 및 신고,"친양자 입양이 성립하려면, 친양자 입양에 필요한 요건을 갖추어 가정법원에 친양자 입양의 청구를 하고, 가정법원의 허락결정을 받아 친양자 입양신고를 하면 됩니다.
가정법원의 허가
친양자를 입양하려는 자는 친양자 입양의 성립요건을 모두 갖추어 가정법원에 친양자 입양을 청구해야 합니다(「민법」 제908조의2제1항).
※ 친양자 입양의 성립요건에 관한 자세한 내용은 찾기쉬운 생활법령정보『입양』의 < 입양의 성립–입양의 성립 요건–친양자의 입양 >부분에서 확인할 수 있습니다.
가정법원은 친양자로 될 사람의 복리를 위하여 그 양육 상황, 친양자 입양의 동기, 양부모의 양육능력 등에 대해서도 심사를 합니다(「민법」 제908조의2제3항).
이것은 사적계약에 의해 성립하는 입양에 국가기관인 법원이 관여함으로써 입양을 다른 목적으로 악용하는 것을 방지하고 친양자의 복리를 보호하기 위한 취지라고 할 수 있습니다.
가정법원은 친양자 입양의 실질적 요건이 모두 갖추어진 경우에도 친양자 입양이 친양자로 될 사람의 복리에 적당하다고 인정되는 때에는 친양자 입양을 허가하고, 그렇지 않을 때에는 친양자 입양청구를 기각할 수 있습니다(「민법」 제908조의2제3항).
친양자 입양신고
가정법원의 친양자 입양재판이 확정된 경우 친양자 입양청구를 한 사람은 그 재판의 확정일부터 1개월 이내에 재판의 등본 및 확정증명서를 첨부하여 친양자 입양신고를 해야 합니다(「가족관계의 등록 등에 관한 법률」 제67조제1항, 제68조 및 제58조).
이 경우 친양자 입양청구의 상대방도 재판서의 등본 및 확정증명서를 첨부하여 친양자 입양의 재판이 확정된 취지를 신고할 수 있습니다.
입양신고서에는 다음의 사항을 기재해야 합니다[「가족관계의 등록 등에 관한 법률」 제67조 및 제61조,「가족관계등록사무의 문서 양식에 관한 예규」(대법원 가족관계등록예규 제543호, 2019. 12. 19. 발령, 2019. 12. 27. 시행) 제3조 및 양식 제5호].
당사자의 성명·본·출생연월일·주민등록번호·등록기준지(당사자가 외국인인 때에는 그 성명·출생연월일·국적 및 외국인등록번호)
양자의 성별과 양자의 친생부모의 성명·주민등록번호 및 등록기준지
재판확정일"
