cate2,paragraph
입양기관을 통한 입양의 취소,"입양아동의 친생의 부 또는 모는 자신에게 책임이 없는 사유로 인하여 입양의 동의를 할 수 없었던 경우에는 입양의 사실을 안 날부터 6개월 안에 가정법원에 입양의 취소를 청구할 수 있습니다. 입양기관을 통해 입양된 아동의 입양이 취소되면, 친양자관계는 소멸하고 입양 전의 친족관계가 부활되며, 취소 신고에 따라 양자의 성과 본은 원래의 성과 본으로 회복합니다.
입양기관에 의한 입양 취소의 개념
입양아동의 친생의 부 또는 모는 자신에게 책임이 없는 사유로 인하여 「입양특례법」 제12조제1항제2호에 따른 입양의 동의를 할 수 없었던 경우에는 입양의 사실을 안 날부터 6개월 안에 가정법원에 입양의 취소를 청구할 수 있습니다(「입양특례법」 제16조제1항).
소의 당사자
원고
입양아동이 입양 될 당시 자신에게 책임없는 사유로 인해 입양의 동의를 할 수 없었던 친생의 부 또는 모입니다.
피고
양부모와 양자를 피고로 하고, 그 중 어느 한쪽이 사망한 경우에는 생존해 있는 사람을 피고로 합니다[「입양특례법의 시행에 관한 대법원규칙」(대법원규칙 제2705호, 2016. 12. 29. 발령, 2017. 2 . 1. 시행) 제5조제1항].
관할법원
일반적으로 양부모 중 1명의 보통재판적이 있는 곳으로 하며, 양부모가 모두 사망한 경우에는 그 중 1명의 마지막 주소지의 가정법원의 전속관할로 합니다(「입양특례법의 시행에 관한 대법원규칙」 제2조제2항).
심리
조정전치주의
입양기관에 의한 입양취소에 관한 사건은 나류 가사소송사건이므로, 가정법원에 친양자 입양취소의 소를 제기하려는 사람은 먼저 조정을 신청해야 합니다[「입양특례법의 시행에 관한 대법원규칙」 제11조, 「가사소송법」 제2조제1항제1호나목13) 및 제50조제1항].
만일 조정을 신청하지 않고 소를 제기한 때에는 가정법원이 조정에 회부하게 됩니다. 다만 공시송달에 의하지 않고는 당사자 일방 또는 쌍방을 소환할 수 없거나, 그 사건이 조정에 회부되더라고 조정이 성립될 수 없다고 인정할 때에는 조정에 회부하지 않습니다(「가사소송법」 제50조제2항).
조정이 성립되지 않은 경우 등에는 재판을 받을 수 있습니다(「가사소송법」 제49조 및 「민사조정법」 제36조).
제척기간
입양기관에 의한 입양취소의 청구기간은 친생의 부 또는 모가 입양의 사실을 안 날부터 6개월 안에 가정법원에 입양의 취소를 청구할 수 있습니다(「입양특례법」 제16조제1항).
소송절차 승계
원고가 사망 그 밖의 사유(소송능력을 상실한 경우는 제외)로 소송절차를 속행할 수 없게 된 때에는 다른 제소권자는 소송절차를 승계할 수 있습니다. 승계신청은 승계의 사유가 생긴 날로부터 6개월 이내에 해야 하고, 그 기간 내에 승계신청이 없을 때에는 소가 취하된 것으로 봅니다(「가사소송법」 제16조).
확정판결의 기판력
입양기관에 의한 입양취소의 청구를 인용한 확정판결은 제3자에게도 효력이 있으므로 입양취소를 재판당사자이외의 사람에게도 주장할 수 있습니다. 청구를 기각한 확정판결은 다른 제소권자가 그 소송의 사실심의 변론종결 전에 참가할 수 없었음에 대하여 정당한 사유가 없는 한 다시 소를 제기할 수 없습니다(「가사소송법」 제21조).
입양기관에 의한 입양 취소의 효과
입양취소 판결이 확정되면, 친양자관계는 소멸하고 입양 전의 친족관계는 부활됩니다. 이 경우 입양취소의 효력은 입양성립일로 소급되지 않습니다(「민법」 제908조의7).
입양기관을 통해 입양된 입양아동의 입양이 취소되면, 취소 신고에 따라 양자의 성과 본은 원래의 성과 본으로 회복합니다[「입양특례법에 따른 가족관계등록사무 처리지침」(가족관계등록예규 제353호, 2012. 7. 25. 발령, 2012. 8. 5. 시행) 제10조].
입양기관에 의한 입양 취소의 통지
가정법원의 법원서기관, 법원사무관, 법원주사 또는 법원주사보는 입양의 취소 청구에 대한 판결이 확정되거나 심판의 효력이 발생한 때에는 지체 없이 그 뜻을 가정법원 소재지의 시장·군수·구청장에게 통지해야 합니다(「입양특례법」 제16조제2항 및 「입양특례법의 시행에 관한 대법원규칙」 제10조).
가정법원의 법원서기관, 법원사무관, 법원주사 또는 법원주사보는 입양의 취소 청구 사건이 접수된 때에는 지체 없이 해당 아동의 입양을 알선한 입양기관 및 해당 아동이 보호의뢰된 「국민기초생활 보장법」 제32조에 따른 보장시설에 대하여 그 내용을 통지해야 합니다(「입양특례법」 제16조제2항 및「입양특례법의 시행에 관한 대법원규칙」 제10조제1항)."
일반양자의 파양,"파양은 입양으로 생긴 양부모와 양자관계를 해소시키는 행위로서, 협의상 파양과 재판상 파양이 있습니다. 파양은 양부모와 양자의 합의로 가능하고, 파양신고로 그 효력이 발생합니다. 만일, 파양에 관해 합의가 되지 않고, 법률상 파양 원인이 있는 경우에는 재판을 통해서 파양할 수 있습니다. 파양에 따라 입양으로 인한 친족관계는 소멸되고, 재판상 파양의 경우 당사자 일방은 과실 있는 상대방에게 손해배상을 청구할 수 있습니다.
파양의 의의
“파양”이란 입양성립 후에 발생한 원인으로 양부모와 양자의 친자관계를 해소시키는 행위를 말합니다.
양부모와 양자의 친자관계는 입양 당사자의 사망만으로 해소되지 않고, 파양에 의해서만 해소됩니다(「민법」 제776조). 왜냐하면, 입양의 성립으로 양부모와 양자 사이에 양부모와 양자관계 및 그 양부모의 혈족과의 사이에도 혈족관계가 생기기 때문입니다.
파양의 종류
파양의 종류에는 협의상 파양과 재판상 파양이 있습니다.
협의상 파양은 입양 당사자 사이의 협의에 의하여 입양으로 발생한 양부모와 양자관계를 해소하는 것입니다(「민법」 제898조 본문).
재판상 파양은 법률에 규정된 파양원인이 있는 경우 양부모, 양자 또는 파양 청구권자(「민법」 제906조)가타방을 상대로 소를 제기하여 법원의 판결로 양부모와 양자관계를 해소하는 것입니다(「민법」 제905조).
√ 재판상 파양의 기준은 입양아동의 복리를 위해 필요한지의 여부입니다. 이것은 양자제도가 입양아동의 복리를 실현하기 위한 것이기 때문입니다.
협의상 파양의 신고
양부모와 양자는 협의에 의해 파양할 수 있고, 「가족관계의 등록 등에 관한 법률」이 정한 바에 따라 신고함으로써 파양의 효력이 생깁니다(「민법」 제898조 본문, 제904조 및 제878조제1항).
협의상 파양의 실질적 요건
파양 당사자 사이에 파양의사의 협의가 있어야 합니다(「민법」 제898조 본문). 따라서 파양의사의 협의가 없는 가장(假裝)파양은 무효입니다.
파양의사에는 조건과 기한을 붙일 수 없습니다.
파양의사는 파양신고서를 작성할 때와 파양신고가 수리될 때에 모두 존재해야 합니다. 따라서 파양신고가 수리되기 이전에 파양당사자 일방이 파양의사를 철회하면 그 파양신고는 수리되더라도 무효로 됩니다.
사기 또는 강박으로 파양의사를 표시한 때에는 파양취소 사유가 됩니다(「민법」 제904조 및 제823조).
※ 판례는 협의상 파양의 당사자인 양부모가 부부인 때에는 부부의 공동입양의 원칙(「민법」 제874조제1항)에 비추어 파양의 경우에도 공동으로 해야 한다고 판시하고 있습니다. 그러나 양부모의 일방이 사망하였거나 이혼한 경우에는 일방이 단독으로 파양할 수 있습니다(대법원 2001. 8. 21. 선고 99므2230 판결).
다만, 양자가 미성년자 또는 피성년후견인인 경우에는 양부모와 양자의 협의로 파양할 수 없습니다(「민법」 제898조 단서).
피성년후견인은 양부모는 성년후견인의 동의를 받아 파양을 협의할 수 있습니다(「민법」 제902조).
협의상 파양의 형식적 요건
파양은 「가족관계의 등록 등에 관한 법률」이 정한 바에 따라 파양의 신고를 하면, 그 효력이 발생합니다(「민법」 제904조 및 제878조).
협의상 파양의 신고절차
신고자
파양 신고는 파양의 당사자가 해야 하며, 파양 신고자가 미성년자 또는 피성년후견인인 경우에는 친권자, 미성년후견인 또는 성년후견인이 신고의무자가 되지만, 미성년자 또는 피성년후견인 본인이 직접 신고를 해도 됩니다( 「가족관계의 등록 등에 관한 법률」 제26조제1항).
친권자, 미성년후견인 또는 성년후견인이 신고하는 경우에는 신고서에 ① 신고해야 할 미성년자 또는 피성년후견인의 성명·출생연월일·주민등록번호 및 등록기준지, ② 신고하여야 할 사람이 미성년자 또는 피성년후견인이라는 사실, ③ 신고인이 친권자, 미성년후견인 또는 성년후견인이라는 사실을 기재해야 합니다( 「가족관계의 등록 등에 관한 법률」 제26조제2항).
파양신고의 기간 및 장소
협의상 파양의 신고는 언제든지 할 수 있습니다.
파양의 신고는 신고사건 본인의 등록기준지 또는 신고인의 주소지나 현재지에서 할 수 있습니다(「가족관계의 등록 등에 관한 법률」 제20조제1항 본문).
※ 다만, 외국에 거주하거나 체류하는 대한민국 국민의 경우 재외국민 가족관계등록사무소에서도 할 수 있습니다(「가족관계의 등록 등에 관한 법률」 제20조제1항 단서).
※ “등록기준지”란 가족관계등록부의 등록을 하는 곳(시·읍·면의 사무소, 특별시 및 광역시와 구를 둔 시에서는 구의 사무소)을 말합니다. 출생 또는 그 밖의 사유로 처음으로 등록하는 경우에는 등록기준지를 정하여 신고해야 하는데, 신고인이 임의로 정할 수 있으며, 대법원규칙으로 정하는 절차에 따라 변경할 수도 있습니다(「가족관계의 등록 등에 관한 법률」 제3조 및 「가족관계의 등록 등에 관한 규칙」 제4조 참조).
신고서의 기재사항
파양신고서에는 다음의 사항을 기재해야 합니다[「가족관계의 등록 등에 관한 법률」 제63조, 「가족관계등록사무의 문서 양식에 관한 예규」(대법원 가족관계등록예규 제543호, 2019. 12. 19. 발령, 2019. 12. 27. 시행) 제3조 및 양식 제6호].
√ 당사자(양부모와 양자)의 성명·본·출생연월일·주민등록번호·등록기준지(당사자가 외국인인 때에는 그 성명·출생연월일·국적 및 외국인등록번호)
√ 양자의 친생부모의 성명·주민등록번호 및 등록기준지
협의상 파양신고의 심사
파양신고는 파양의 실질적 요건 및 그 밖의 법령에 위반하지 않았음이 확인되면 수리됩니다(「민법」 제903조).
협의상 파양의 무효
당사자 사이에 파양의 합의가 없는 경우 그 협의상 파양은 당연무효입니다(「민법」 제898조).
따라서 의사무능력자의 파양행위, 가장파양, 조건부파양, 제3자가 파양 당사자가 모르는 사이에 신고한 파양, 대낙권이 없는 사람이 협의한 파양, 파양신고가 수리되기 전에 파양의사를 철회한 경우 등은 무효입니다.
협의상 파양에 관하여 다툼이 있는 경우에는 가정법원에 파양무효의 소를 제기할 수 있습니다(「가사소송법」 제31조, 제23조 및 제24조).
협의상 파양무효의 소
당사자
원고
√ 당사자, 법정대리인 또는 4촌 이내의 친족은 언제든지 입양무효의 소를 제기할 수 있습니다(「가사소송법」 제31조 및 제23조).
피고
√ 양부모와 양자 중 일방이 소를 제기할 때에는 양부모와 양자의 다른 일방을 상대방으로 하고, 다른 일방이 사망한 때에는 검사를 상대방으로 합니다(「가사소송법」 제31조 및 제24조).
√ 제3자가 소를 제기할 때에는 양부모와 양자 쌍방을 상대방으로 하고, 그 일방이 사망한 때에는 생존자를 상대방으로 하며, 그 쌍방이 모두 사망한 때에는 검사를 상대방으로 합니다(「가사소송법」 제31조 및 제24조).
관할
양부모 중 1명의 보통재판적 소재지의 가정법원을 전속관할로 합니다. 양부모가 모두 사망한 때에는 그 중 1명의 최후주소지의 가정법원을 전속관할로 합니다(「가사소송법」 제30조).
소송절차의 승계
원고가 사망 그 밖의 사유(소송능력을 상실한 경우는 제외)로 소송절차를 속행할 수 없게 된 때에는 다른 제소권자는 소송절차를 승계할 수 있습니다. 소송절차의 승계신청을 승계의 사유가 생긴 때부터 6개월 이내에 해야 하고 승계신청이 없으면 소는 취하됩니다(「가사소송법」 제16조).
확정판결의 기판력
파양무효의 청구를 인용한 확정판결 제3자에게도 효력이 있습니다(「가사소송법」 제21조제1항). 따라서 입양무효를 재판당사자 이외의 사람에게도 주장할 수 있습니다.
청구를 기각한 확정판결은 그 소송의 사실심의 변론종결 전에 다른 제소권자가 참가할 수 없었음에 대해 정당한 사유가 없으면 다시 소를 제기할 수 없습니다(「가사소송법」 제21조제2항).
협의상 파양의 취소
협의상 파양이 사기 또는 강박으로 이루어진 경우에는 이를 취소할 수 있습니다.
이 경우에는 사기를 안 날 또는 강박을 면한 날로부터 3개월 내에 가정법원에 파양취소의 소를 제기해야 하며, 3개월을 경과한 때에는 그 취소를 청구할 수 없습니다[「민법」 제904조, 제823조 및 「가사소송법」 제2조제1항제1호나목11)].
파양취소의 소를 제기하려는 사람은 먼저 가정법원에 조정을 신청해야 합니다. 만일 조정을 신청하지 않고 소를 제기하면, 가정법원이 그 사건을 조정에 회부하게 됩니다[「가사소송법」 제2조제1항제1호나목11) 및 제50조].
조정이 성립하지 않으면 재판을 받을 수 있습니다(「가사소송법」 제49조, 「민사조정법」 제36조).
심리
당사자(「가사소송법」 제31조 및 제24조)
양부모와 양자 일방이 파양취소의 소를 제기할 때에는 양부모와 양자 중 일방을 상대방으로 합니다.
제3자가 파양취소의 소를 제기할 때에는 양부모와 양자를 상대방으로 하고, 양부모와 양자 중 일방이 사망을 한 때에는 그 생존자를 상대방으로 합니다.
상대방이 될 자가 사망한 때에는 검사를 상대방으로 합니다.
관할법원
파양취소의 소는 양부모 중 1명의 보통재판적 소재지, 양부모가 모두 사망한 때에는 그 중 1명의 최후주소지의 가정법원을 전속관할로 합니다(「가사소송법」 제30조).
소송절차 승계
원고가 사망 그 밖의 사유(소송능력을 상실한 경우는 제외)로 소송절차를 속행할 수 없게 된 때에는 다른 제소권자는 소송절차를 승계할 수 있습니다. 승계신청은 승계의 사유가 생긴 날로부터 6개월 이내에 해야 하고, 그 기간 내에 승계신청이 없을 때에는 소가 취하된 것으로 봅니다(「가사소송법」 제16조).
확정판결의 기판력
파양취소의 청구를 인용한 확정판결은 제3자에게도 효력이 있습니다. 따라서 제3자에게 파양의 무효를 주장할 수 있습니다(「가사소송법」 제21조제1항).
파양취소의 청구를 기각한 판결이 확정된 때에는 다른 제소권자가 사실심의 변론종결 전에 참가할 수 없었음에 대하여 정당한 사유가 없는 한 다시 소를 제기할 수 없습니다(「가사소송법」 제21조제2항).
가족관계등록부의 정정
파양무효 또는 파양취소의 판결에 따라 당사자는 그 판결의 확정일로부터 1개월 이내에 판결의 등본 및 그 확정증명서를 첨부하여 가족관계등록부의 정정을 신청할 수 있습니다(「가족관계의 등록 등에 관한 법률」 제107조).
재판상 파양의 의의
“재판상 파양”은 「민법」에 규정된 파양의 원인이 있는 경우 양부모, 양자 또는 파양 청구권자(「민법」 제906조)가타방을 상대로 소를 제기하여 법원의 판결로 성립하는 파양을 말합니다(「민법」 제905조).
재판상 파양은 조정절차가 선행하며, 조정이 성립되면 파양의 효력이 생기게 되고[「가사소송법」제2조제1항제1호나목12) 및 제50조], 조정이 성립하지 않으면 재판을 받을 수 있으며, 파양을 인용하는 판결로 파양의 효력이 생깁니다.
재판상 파양의 사유
양부모와 양자 일방은 다음의 어느 하나의 사유가 있는 경우에는 가정법원에 파양을 청구할 수 있습니다(「민법」 제905조).
양부모가 양자를 학대 또는 유기하거나 그 밖에 양자의 복리를 현저히 해친 경우
양부모가 양자로부터 심히 부당한 대우를 받은 경우
√ “심히 부당한 대우”란 양자 또는 양부모에게 가하는 신체·정신에 대한 학대, 방임, 모욕 등과 같은 것을 말합니다.
양부모나 양자의 생사가 3년 이상 분명하지 않은 경우
√ “생사가 분명하지 않은 경우”란 양자가 살아 있는지 죽었는지를 전혀 증명할 수 없는 상태를 말합니다.
그 밖에 양친자관계를 계속하기 어려운 중대한 사유가 있는 경우
√ “중대한 사유”란 일반적인 사회생활 관계에 비추어 보아 양부모와 양자관계를 유지하기 어렵다고 판단되는 경우를 말합니다.
심리
조정전치주의
재판상 파양소송을 제기하려는 자는 미리 가정법원에 조정을 신청해야 합니다[「가사소송법」 제2조제1항제1호나목12) 및 제50조제1항].
만일 조정을 신청하지 않고 소를 제기한 때에는 그 사건을 조정에 회부하게 됩니다. 그러나 공시송달에 의하지 않고는 당사자 일방 또는 쌍방을 소환할 수 없거나 그 사건이 조정에 회부되더라도 조정이 성립될 수 없는 경우에는 조정절차를 거치지 않습니다(「가사소송법」 제50조제2항).
조정이 성립되면 파양의 효력이 생기고, 조정이 성립하지 않으면 재판을 받을 수 있습니다(「가사소송법」 제49조, 「민사조정법」 제36조).
파양 청구권자
양자가 13세 미만인 경우
√ 양자가 13세 미만인 경우에는 법정대리인이 양자를 갈음하여 파양을 청구할 수 있습니다(「민법」 제906조제1항 전단 및 제869조제2항).
√ 만약 파양을 청구할 수 있는 사람이 없는 경우에는 ① 8촌 이내의 혈족, ② 4촌 이내의 인척, ③ 배우자 등 양자의 친족이나 이해관계인이 가정법원의 허가를 받아 파양을 청구할 수 있습니다(「민법」 제906조제1항 후단 및 제777조).
양자가 13세 이상의 미성년자인 경우
√ 이 때에는 미성년자 입양에 동의(「민법」 제870조제1항)한 부모의 동의를 받아 파양을 청구할 수 있습니다(「민법」 제906조제2항 전단).
√ 다만, 부모가 사망하거나 그 밖의 사유로 동의할 수 없는 경우에는 동의 없이 파양을 청구할 수 있습니다(「민법」 제906조제2항 후단).
양부모나 양자가 피성년후견인인 경우에는 성년후견인의 동의를 받아 파양을 청구할 수 있습니다(「민법」 제906조제3항).
검사는 미성년자나 피성년후견인인 양자를 위하여 파양을 청구할 수 있습니다(「민법」 제906조제4항).
관할법원
양부모 중 1명의 보통재판적 소재지, 양부모가 모두 사망한 때에는 그 중 1명의 최후주소지의 가정법원을 전속관할로 합니다(「가사소송법」 제30조).
※ “보통재판적 소재지”란 민사소송에서 특정인에 대한 일체의 소송사건에 관하여 일반적으로 인정되는 토지관할을 말합니다. 사람의 보통재판적은 그의 주소에 따라 정하되, 대한민국에 주소가 없거나 주소를 알 수 없는 경우에는 거소(居所)에 따라 정하고, 거소가 일정하지 않거나 거소도 알 수 없으면 마지막 주소에 따라 정합니다(「민사소송법」 제3조).
파양 청구권의 소멸
재판상 파양의 원인 중 양부모나 양자의 생사가 3년 이상 분명하지 않는 경우로 인한 파양의 소는 언제든지 제기할 수 있습니다.
그러나 그 밖의 파양의 원인으로 인한 파양의 소는 그 사유를 안 날로부터6개월, 그 사유가 있은 날부터3년이 지나면 파양을 청구할 수 없습니다(「민법」 제907조).
파양 청구 인용판결의 기판력
재판상 파양 청구를 인용한 확정판결의 효력은 제3자에게도 파양의 효력을 주장할 수 있습니다(「가사소송법」 제21조제1항).
파양 청구를 기각한 확정판결은 그 소송의 사실심의 변론종결 전에 다른 제소권자가 참가할 수 없었음에 대하여 정당한 사유가 없는 한 다시 소를 제기할 수 없습니다(「가사소송법」 제21조제2항).
재판상 파양의 신고
재판상 파양의 신고는 보고적 신고로서, 파양청구의 인용판결이 있을 때에는 소를 제기한 사람은 재판 확정일부터 1개월 이내에 파양신고를 해야 합니다. 소송의 상대방도 파양신고를 할 수 있습니다(「가족관계의 등록 등에 관한 법률」 제66조 및 제58조).
파양신고서에는 재판확정일을 기재하고, 재판서의 등본 및 확정증명서를 첨부해야 합니다[「가족관계의 등록 등에 관한 법률」 제66조 및 제58조, 「가족관계등록사무의 문서 양식에 관한 예규」 제3조 및 양식 제6호].
파양으로 가족관계증명서에는 친생부모만 기재될 뿐 양부모는 기재되지 않습니다. 그러나 입양관계증명서에 대한 상세증명서에는 파양사실이 기재됩니다(「가족관계의 등록 등에 관한 법률」 제15조제3항제4호).
친족관계의 소멸
파양을 하면 입양으로 발생한 친족관계는 종료됩니다(「민법」 제776조). 즉, 양자와 양부모 사이의 친자관계뿐만 아니라 양자와 양부모의 혈족관계도 종료됩니다.
따라서 양자의 신분에서 발생했던 양부모와의 사이의 법률효과(친권관계, 부양관계, 상속관계 등)는 소멸합니다.
양부모 중 일방이 사망한 후 생존하는 다른 일방이 양자를 파양한 경우 그 친족관계의 종료가 사망한 일방과 양자 사이에는 적용되지 않습니다(대법원 2001. 8. 21. 선고 99므2230 판결).
파양의 경우 양자가 미성년자인 때에는 그 양자의 친권이 친생부모에게로 부활됩니다.
손해배상 청구
재판상 파양으로 손해를 입은 당사자 일방은 과실 있는 상대방에게 손해배상을 청구할 수 있습니다(「민법」 제908조 및 제806조제1항).
재판상 파양으로 인한 손해의 범위는 재산상의 손해뿐만 아니라 정신상 고통에 대한 손해도 포함됩니다. 정신상 고통에 대한 배상청구권은 당사자간에 이미 그 배상에 관한 계약이 성립되거나 소를 제기한 후가 아니라면 양도 또는 승계할 수 없습니다(「민법」 제908조 및 제806조제2항 및 제3항).
재판상 파양의 손해배상을 청구하려는 당사자는 먼저 가정법원에 조정신청을 해야 합니다[「가사소송법」 제2조제1항제1호다목3) 및 제50조]."
