cate2,paragraph
친양자 입양 및 입양기관을 통한 입양의 효과,"친양자 제도의 목적은 양자와 친생자 사이에 존재할 수 있는 모든 종류의 차별을 없애고, 양자에게 친생자와 같은 양육환경으로 만들어 주는데 있습니다. 따라서 친양자로 입양되면 혼인중의 출생자 신분을 취득하게 되고, 일반양자와는 달리 입양전의 친족관계는 종료하게 됩니다. 기관을 통해 입양된 아동도 친양자와 동일한 지위를 가집니다.
혼인 중 출생자의 신분 취득
친양자는 부부의 혼인 중의 출생자로 봅니다(「민법」 제908조의3제1항). 이에 따라 친양자의 성과 본은 양부의 성과 본으로 변경됩니다.
다만, 부모가 혼인신고할 때 모의 성과 본을 따르기로 협의한 경우에는 모의 성과 본을 따르게 됩니다[「민법」 제908조의8, 제781조제1항 및 「친양자 입양재판에 따른 사무처리지침」(가족관계등록예규 제373호, 2013. 6. 7. 발령, 2013. 7. 1. 시행) 제4조].
친양자와 양부모 및 그 혈족, 인척사이의 친계와 촌수는 입양한 때부터 혼인중의 출생자와 같은 촌수를 가지게 됩니다. 친양자의 배우자, 직계비속과 그 배우자도 친양자의 친계를 기준으로 촌수를 정하게 됩니다(「민법」 제908조의8 및 제772조).
친양자는 양부모의 친권에 따르게 됩니다(「민법」 제909조제1항 후단).
친양자와 양부모 및 양부모의 혈족 사이에는 서로 부양관계와 상속관계가 생깁니다(「민법」 제974조).
유용한 법령정보  4
Q.재혼을 했는데, 전 남편의 아이를 재혼한 남편의 성으로 변경할 수 있을까요?  A. 네, 현재 남편의 가족관계등록부에 아이를 입적시키고, 남편의 성을 따르게 하고 싶으면 친양자로 입양하면 됩니다. 「민법」상 친양자로 입양된 경우에는 양부의 성과 본을 따르게 되어 있어서(「민법」 제781조제1항 본문) 친양자로 입양을 하면 아이의 성과 본을 변경할 수 있습니다.또한, 친양자 입양 외에도 자녀의 복리를 위하여 법원의 허가를 받아 자녀의 성과 본을 변경 할 수도 있습니다(「민법」 제781조제6항).
입양 전의 친족관계의 종료
친양자 입양 전의 친족관계는 친양자 입양이 확정된 때에 종료됩니다(「민법」 제908조의3제2항 본문).
다만, 부부의 일방이 그 배우자의 친생자를 단독으로 입양한 때에는 배우자 및 그 친족과 친생자간의 친족관계는 종료되지 않습니다(「민법」 제908조의3제2항 단서).
√ 예를 들면, 부가 처의 친생자(전혼관계에서 출생한 자 또는 인지된 혼외자)를 친양자로 입양하였다면, 친양자로 입양된 자와 생부 및 생부의 친족간의 친족관계는 소멸하지만, 모자관계 및 모의 친족에 대한 자의 친족관계는 소멸하지 않습니다.
혼인 외의 자가 친양자로 된 경우에는 생부라고 하더라도 친양자 관계가 존속하는 동안에는 인지를 할 수 없습니다.
친족관계가 종료된다고 하더라도 생물학적인 혈족관계까지 소멸하는 것은 아니므로 종전의 혈족과의 근친혼금지 규정의 효력은 그대로 유지됩니다.
※ “근친혼금지”란, ① 8촌 이내의 혈족(친양자의 입양 전의 혈족 포함) 사이, ② 6촌 이내의 혈족의 배우자, ③ 배우자의 6촌 이내의 혈족, ④ 배우자의 4촌 이내의 혈족의 배우자인 인척이거나 이러한 인척이었던 자 사이, ⑤ 6촌 이내의 양부모계의 혈족이었던 자와 4촌 이내의 양부모계의 인척이었던 자 사이에서 혼인을 금지하는 것을 말합니다(「민법」 제809조).
가족관계등록부의 기재 및 교부
시(구)·읍·면의 장은 친양자 입양을 한 양부모의 가족관계등록부에 친양자입양사유를 기록하고, 친양자의 성명 등 특정등록사항을 기록하여 가족관계증명서에는 친양자가 자녀로, 친양자입양관계증명서에는 친양자임이 드러나도록 해야 합니다(「친양자 입양재판에 따른 사무처리지침」 제6조제1항).
친양자 입양사유는 친양자입양관계증명서에 나타나도록 합니다(「친양자 입양재판에 따른 사무처리지침」 제6조제2항).
이와 같이 친양자입양관계증명서의 교부는 엄격히 제한되어 있어, 친족이라 할지라도 이 증명서의 교부를 청구할 수 없습니다. 또한 다른 증명서와는 달리 가족은 물론 본인의 경우에도 미성년자인 경우에는 발급이 제한됩니다 [「가족관계의 등록 등에 관한 법률」 제14조제7항 단서 및 「등록사항별 증명서의 발급 등에 관한 사무처리지침」(대법원 가족관계등록예규 제557호, 2020. 11. 24. 발령, 2020. 12. 10. 시행) 제3조].
다만, 다음 어느 하나에 해당하는 경우에는 친양자입양관계증명서의 교부를 청구할 수 있습니다(「가족관계의 등록 등에 관한 법률」 제14조제2항, 「가족관계의 등록 등에 관한 규칙」 제23조제3항 및 「등록사항별 증명서의 발급 등에 관한 사무처리지침」 제3조제1항).
√ 친양자가 성년이 되어 신청하는 경우
√ 혼인당사자가 근친혼금지의 친족관계를 파악하려는 경우
√ 법원의 사실조회촉탁이 있거나 수사기관이 수사상 필요에 따라 문서로 신청하는 경우
√ 친양자 입양취소 또는 친양자 파양을 할 때 이에 관한 법원의 접수증명원이 첨부된 경우
√ 「입양특례법」에 따른 입양의 취소 또는 파양을 할 때 이에 관한 법원의 접수증명원이 첨부된 경우
√ 친양자의 복리를 위하여 필요함을 친양자의 양부모가 구체적으로 소명자료를 첨부하여 신청하는 경우
√ 친양자입양관계증명서가 소송, 비송, 민사집행·보전의 각 절차에서 필요한 때 법원의 보정명령서, 재판서, 촉탁서 등을 첨부한 경우
√ 상속등기를 위하여 사망한 사람의 친양자입양관계증명서를 신청하는 경우로서 사망한 사람이 재산적인 권리를 가지고 있었음을 소명하는 자료(부동산등기부 등·초본)를 첨부하여, 사망한 사람의 가족관계증명서에 기재된 사람이 신청하는 경우
√ 가족관계등록부가 작성되지 않은 채로 사망한 사람의 상속인의 친양자입양관계증명서가 필요한 경우로서 법률상의 이해관계를 소명하는 자료를 첨부하여 신청하는 경우
√ 법률상의 이해관계를 소명하기 위하여 친양자의 친생부모·양부모의 친양자입양관계증명서를 신청하는 경우로서 그 해당법령과 그에 따른 구체적인 소명자료 및 필요이유를 제시하여 신청하는 경우
√ 성년인 친양자의 친생부모·양부모가 본인의 친양자입양관계증명서를 신청하는 경우로서 친양자가 성년자임을 소명하는 경우
친양자입양관계증명서는 전자적 방법에 의한 열람을 청구할 수 있으나, 이 경우에도 친양자입양관계증명서의 기록사항에 대하여는 친양자가 성년이 된 이후에만 청구할 수 있습니다(「가족관계의 등록 등에 관한 법률」 제14조제7항).
입양기관에 의한 입양의 효과
「입양특례법」에 따라 기관을 통해 입양된 아동은 친양자와 동일한 지위를 가집니다. 그러므로 그 효과는 「민법」상의 친양자 규정을 준용합니다(「입양특례법」 제14조 및 제42조)."
국제입양의 효과,"국제입양이 성립되면 그 효력은 입양 당시 양부모의 본국법에 따르게 되므로, 양부모와 양자 사이에는 친자관계가 생기게 됩니다. 이러한 친자간의 법률관계는 부모와 자녀의 본국법이 모두 동일한 경우에는 그 법에 따르고, 그 외의 경우에는 자녀의 상거소지법에 따르게 됩니다.
국제입양의 효과
국제입양이 성립되면 그 효력은 양부모의 본국법에 따르게 됩니다(「국제사법」 제43조). 따라서 국제입양이 성립되면 양부모와 양자 사이에는 친자관계가 형성됩니다.
친자간의 법률관계는 부모와 자녀의 본국법이 모두 동일한 경우에는 그 법에 따르고, 그 외의 경우에는 자녀의 상거소지법에 따르게 됩니다(「국제사법」 제45조).
※ “상거소(常居所)”란 당사자가 사실상 생활의 중심지로 일정한 장소에서 상당기간 정주(定住)한 장소를 말하며, 상거소가 있는 국가의 법을 상거소지법(常居所地法)이라 합니다. 상거소의 존재여부는 구체적인 상황에 따라 당사자의 체류기간, 체류목적, 가족관계, 근무관계 등 관련 요소를 종합적으로 판단하게 됩니다(법무부 국제법무과 『국제사법 해설』, 2001. 5, 31면 참조).
양자의 이름 개명
외국인 양부모에게 입양된 한국인 양자가 양부모의 본국법에 따라 양자의 이름을 개명한 경우라도 개명허가결정을 받은 경우가 아닌 한, 외국에서 개명한 이름을 한국의 가족관계등록부에 기록할 수는 없습니다[「개명허가신청사건 사무처리지침」(대법원 가족관계등록예규 제307호, 2009. 7. 17. 발령·시행) 제11조제1항].
※ “개명허가결정”이란 개명하려는 사람이 자신의 주소지(재외국민의 경우 등록기준지)를 관할하는 가정법원으로부터 개명허가결정을 받는 것을 말합니다(「가족관계의 등록 등에 관한 법률」 제99조제1항).
다만, 외국인 양부모에게 입양된 한국인 양자가 우리나라 국적을 상실하기 전이라면 한국의 법원에 개명허가결정을 받아 개명할 수 있습니다(「개명허가신청사건 사무처리지침」 제11조제2항).
국적의 취득
외국인인 양자는 입양으로 바로 대한민국 국적을 취득하게 되는 것은 아니고, 귀화허가를 받아야만 한국국적을 취득할 수 있습니다(「국적법」 제4조제1항).
외국인인 양자가 입양 당시 성년자인 경우에는 대한민국에 3년 이상 계속하여 주소가 있으면, 간이귀화 요건에 해당하여 귀화허가를 받아 대한민국 국적을 취득할 수 있습니다(「국적법」 제6조제1항제3호).
외국인인 양자가 입양 당시 미성년자인 경우에는, 대한민국에 주소가 있으면 특별귀화 요건에 해당하여 귀화허가를 받아 대한민국 국적을 취득할 수 있습니다(「국적법」 제7조제1항제1호 본문).
국적의 상실
한국인인 양자는 외국인인 양부모에게 입양되었다고 하여 바로 대한민국 국적을 상실하는 것은 아닙니다.
외국인인 양부모에게 입양되어 양부 또는 양모의 국적을 취득하게 된 한국인 양자는, 그 외국 국적을 취득한 때부터 6개월 이내에 법무부장관에게 대한민국 국적을 보유할 의사가 있다는 뜻을 신고하지 않으면, 그 외국 국적을 취득한 때로 소급하여 대한민국 국적을 상실하게 됩니다(「국적법」 제15조제2항제2호).
외국인인 양부모에게 입양된 한국인인 양자가 양부모의 본국법에 따라 입양으로 자동적으로 그 외국 국적을 취득한 경우가 아닌, 별도의 귀화절차를 통해 외국 국적을 취득하게 된 한국인인 양자는 그 외국 국적을 취득한 때에 자동적으로 대한민국 국적을 상실하게 됩니다(「국적법」 제15조제1항)."
양자의 성(姓)과 본(本),"일반양자로 입양된 경우에는 양자의 성과 본은 변경되지 않습니다. 친양자 또는 기관을 통해 입양된 아동은 부부의 혼인중 출생자와 동일하므로 양부의 성과 본을 따르게 됩니다. 국제입양이 성립되면 양부모와 양자 사이에는 친자관계가 생기게 되고, 이러한 친자관계는 부모와 자녀의 본국법이 같은 경우에는 그 법에 따르고, 그 외의 경우에는 자녀의 상거소지법에 따르게 됩니다.
일반양자의 성과 본
일반양자로 입양된 경우에는 양자의 성과 본은 변경되지 않습니다. 다만, 예외적으로 양자의 복리를 위하여 양자의 성과 본을 양부모의 성과 본으로 변경할 수 있으며, 이 경우에는 양부모 또는 양자가 가정법원에 성과 본의 변경허가를 청구해야 합니다(「민법」 제781조제6항).
친양자의 성과 본
친양자로 입양된 경우는 부부의 혼인중 출생자와 동일하므로 양부의 성과 본을 따르게 됩니다(「민법」 제781조제1항 본문 및 제908조의3제1항).
다만, 양부모가 혼인신고 시 자녀가 모의 성과 본을 따르기로 협의를 한 경우에는, 친양자의 성과 본은 모의 성과 본을 따르게 됩니다(「민법」 제781조제1항 단서,「친양자 입양재판에 따른 사무처리지침」(가족관계등록예규 제373호, 2013. 6. 7. 발령, 2013. 7. 1. 시행) 제4조).
친양자가 취소되거나 파양되면, 친양자관계는 소멸하고 입양 전의 친족관계가 부활되므로 친양자는 친생부모의 성과 본을 따르게 됩니다(「민법」 제908조의7제1항 및 「친양자 입양재판에 따른 사무처리지침」 제10조).
기관을 통해 입양된 양자의 성과 본
기관을 통해 입양된 아동은 친양자와 동일한 지위를 가지며, 그 효과는 성과 본에 있어서도 「민법」상의 친양자 규정을 준용합니다. 따라서 양부의 성과 본을 따르게 됩니다(「입양특례법」 제14조 및 제42조).
다만, 양부모가 혼인신고시 자녀가 모의 성과 본을 따르기로 협의한 경우에는 모의 성과 본을 따릅니다[「입양특례법에 따른 가족관계등록사무 처리지침」(가족관계등록예규 제353호, 2012. 7. 25. 발령, 2012. 8. 5. 시행) 제4조].
입양기관을 통해 입양된 입양아동의 입양이 취소되거나 파양되면, 취소 또는 파양신고에 따라 양자의 성과 본은 원래의 성과 본으로 회복합니다(「입양특례법에 따른 가족관계등록사무 처리지침」 제10조).
국제입양 양자의 성과 본
국제입양이 성립되면 양부모와 양자 사이에는 친자관계가 생기게 되고, 이러한 친자관계는 부모와 자녀의 본국법이 같은 경우에는 그 법에 따르고, 그 외의 경우에는 자녀의 상거소지법에 따르게 됩니다(「국제사법」 제43조 및 제45조).
※ “상거소(常居所)”란 당사자가 사실상 생활의 중심지로 일정한 장소에서 상당기간 정주(定住)한 장소를 말하며, 상거소가 있는 국가의 법을 상거소지법(常居所地法)이라 합니다. 상거소의 존재여부는 구체적인 상황에 따라 당사자의 체류기간, 체류목적, 가족관계, 근무관계 등 관련 요소를 종합적으로 판단하게 됩니다(법무부 국제법무과 『국제사법 해설』, 2001. 5, 31면 참조).
따라서 외국인 양부모가 한국인을 양자로 입양한 경우, 한국인 자녀의 성과 본은 그 상거소지법의 태도에 따라 변경의 여부 및 방법이 정해지게 됩니다(법원행정처 「가족관계등록실무자료집(기재편)」, 2007. 12, 73-74면 및 93-94면 참조).
한국인이 외국인을 양자로 입양하는 경우
외국인이 한국 국적을 취득한 경우에는 원칙적으로 외국에서 사용하던 성명을 그 원지음에 따라 한글로 표기하며, 부, 모, 배우자의 성명이 외국어인 경우에는 원지음(原地音)을 한글로 표기합니다(「가족관계의 등록 등에 관한 규칙」 제80조의2제4항).
외국의 성을 쓰는 국적취득자가 그 성을 쓰지 아니하고 새롭게 성과 본을 정하고자 하는 경우에는 그 등록기준지·주소지 또는 등록기준지로 하려는 곳을 관할하는 가정법원의 허가를 받고 그 등본을 받은 날부터 1개월 이내에 그 성과 본을 신고해야 합니다. 신고서에는 다음 사항을 기재하며, 허가의 등본을 첨부합니다(「가족관계의 등록 등에 관한 법률」 제96조제1항, 제4항, 제5항).
√ 종전의 성
√ 창설한 성과 본
√ 허가의 연월일
대한민국의 국적을 회복하거나 재취득하는 경우에는 종전에 사용하던 대한민국식 성명으로 국적회복신고 또는 국적재취득신고를 할 수 있으며 신고서에는 종전에 사용하던 대한민국식 성명을 소명해야 합니다(「가족관계의 등록 등에 관한 법률」 제96조제2항 및 제3항).
외국인이 한국인을 양자로 입양하는 경우
한국인이 외국인에게 입양되었다고 하더라도 양자의 가족관계등록부상 성과 본이 변경되는 것은 아닙니다. 다만, 「민법」 제908조의3에 따른 친양자 입양의 경우에는 성과 본을 변경할 수 있으며, 이름은 법원의 허가를 받아 외국식 이름으로 개명할 수 있습니다[「한국인이 외국인에게 입양·파양될 경우의 사무처리지침」(대법원 가족관계등록예규 제416호, 2015. 1. 8. 발령 2015. 2. 1. 시행)]."
자녀의 성(姓)과 본(本)의 변경,"자녀는 부의 성을 따르는 것이 원칙이지만 자녀의 복리를 위하여 자녀의 성과 본을 변경할 필요가 있는 때에는 법원의 허가를 얻어 이를 변경할 수 있습니다. “자녀의 복리를 위하여”라는 요건을 폭넓게 해석할 수 있으므로, 양자의 성과 본이 양부모의 성과 본과 다른 경우에도 변경할 수 있습니다.
성과 본의 변경제도의 의의
자녀는 부의 성을 따르는 것이 원칙이지만, “자녀의 복리를 위하여” 자녀의 성과 본을 변경할 필요가 있는 때에는 법원의 허가를 얻어 이를 변경할 수 있습니다(「민법」 제781조제1항 및 제6항).
청구권자
부, 모 또는 자녀가 성과 본의 변경허가를 가정법원에 청구할 수 있습니다. 다만, 자녀가 미성년자이고 법정대리인이 청구할 수 없는 경우에는 8촌 이내의 혈족, 4촌 이내의 인척, 배우자, 또는 검사가 청구할 수 있습니다(「민법」 제781조제6항).
관할법원
성과 본을 변경하려는 자녀의 주소지의 가정법원(가정법원 및 가정지원이 설치되지 않은 지역은 해당지방법원 및 지방법원 지원)에 청구하면 됩니다(「가사소송법」 제44조).
심리
자녀의 성과 본의 변경허가 사건은 라류 가사비송사건이므로, 「가사소송법」과 다른 법률 또는 「가사소송규칙」에 특별한 규정이 있는 경우를 제외하고는 사건관계인을 심문하지 않고 서면심리에 의하는 것이 일반적입니다[「가사소송법」 제2조제1항제2호가목6) 및 제45조].
가정법원은 자녀의 성과 본의 변경허가 청구가 있는 경우, 부, 모 및 자녀가 13세 이상인 때에는 그 자녀의 의견을 들을 수 있습니다. 이 경우 자녀의 부모 중 자녀와 성과 본이 동일한 사람의 사망 그 밖의 사유로 의견을 들을 수 없는 경우에는 자녀와 성과 본이 동일한 최근친 직계존속의 의견을 들을 수 있습니다(「가사소송규칙」 제59조의2제2항).
성과 본의 변경신고
자녀의 성과 본을 변경하려는 사람은 재판확정일부터 1개월 이내에 재판서의 등본 및 확정증명서를 첨부하여 신고해야 합니다(「가족관계의 등록 등에 관한 법률」 제100조제1항).
성변경신고서에는 아래의 사항을 기재해야 합니다[「가족관계의 등록 등에 관한 법률」 제100조제2항, 「가족관계등록사무의 문서 양식에 관한 예규」(대법원 가족관계등록예규 제543호, 2019. 12. 19. 발령, 2019. 12. 27. 시행) 제3조 및 양식 제34호].
√ 변경 전의 성과 본
√ 변경한 성과 본
√ 관할법원 및 허가일자"
