cate2,paragraph
성년후견의 개시,"""성년후견""은 질병, 장애, 노령, 그 밖의 사유로 인한 정신적 제약으로 사무를 처리할 능력이 지속적으로 결여된 성인이 가정법원의 결정으로 선임된 후견인을 통해 재산관리 및 일상생활에 관한 폭넓은 보호와 지원을 제공받는 제도입니다.성년후견은 일정한 자의 청구에 따른 가정법원의 성년후견심판으로 개시됩니다.
성년후견제도의 의의
'성년후견'은 질병, 장애, 노령, 그 밖의 사유로 인한 정신적 제약으로 사무를 처리할 능력이 지속적으로 결여된 성인이 가정법원의 결정으로 선임된 후견인을 통해 재산관리 및 일상생활에 관한 폭넓은 보호와 지원을 제공받는 제도입니다(「민법」 제9조 참조).
관할
성년후견개시심판은 피성년후견인(성년후견을 받는 사람을 말함. 이하 같음)이 될 사람의 주소지 가정법원 및 가정법원 지원에서 관할합니다(「가사소송법」 제44조제1항제1호의2 본문).
다만, 성년후견 개시의 심판이 확정된 이후의 후견에 관한 사건은 후견개시 등의 심판을 한 가정법원(항고법원이 후견개시 등의 심판을 한 경우에는 그 제1심 법원인 가정법원) 지원에서 관할합니다(「가사소송법」 제44조제1항제1호의2 단서).
청구권자 및 청구방법
가정법원은 질병, 장애, 노령, 그 밖의 사유로 인한 정신적 제약으로 사무를 처리할 능력이 지속적으로 결여된 사람 본인, 배우자, 4촌 이내의 친족, 미성년후견인, 미성년후견감독인, 한정후견인, 한정후견감독인, 특정후견인, 특정후견감독인, 검사 또는 지방자치단체의 장의 청구에 따라 성년후견개시의 심판을 합니다(「민법」 제9조제1항).
성년후견개시의 심판을 청구하려는 자는 다음의 서류를 법원에 제출해야 합니다[「성년후견제도」(대한민국법원 전자민원센터)].
기본증명서 및 가족관계증명서(사건본인) 각 1통
주민등록표등(초)본(청구인, 사건본인) 각 1통
후견등기사항전부증명서(말소 및 폐쇄사항 포함) 또는 후견등기사항부존재증명서(전부)(사건본인) 1통
청구인 및 후견인후보자와 사건본인과의 관계 소명자료(가족관계증명서, 제적등본 등)
진단서 1통
사전현황설명서 1부
사건본인의 가족들의 의견서 또는 동의서(인감증명서 첨부)
※ 성년후견개시의 심판청구 시 필요한 첨부서류 양식과 그 밖에 인지액, 송달료, 감정료 등에 관한 자세한 사항은 [「성년후견제도」(대한민국법원 전자민원센터)]에서 확인하실 수 있습니다.
심판절차
가정법원은 성년후견개시의 심판을 할 때 본인의 의사를 고려해야 합니다(「민법」 제9조제2항).
가정법원은 성년후견 개시의 심판을 하는 경우에는 피성년후견인이 될 사람의 진술을 들어야 합니다. 다만, 피성년후견인이 될 사람이 의식불명, 그 밖의 사유로 자신의 의사를 표명할 수 없는 경우에는 그렇지 않습니다(「가사소송법」 제45조의3제1항제1호).
가정법원은 성년후견 개시의 심판을 하는 경우에는 피성년후견인이 될 사람의 정신상태에 관해 의사에게 감정을 시켜야 합니다. 다만, 피성년후견인이 될 사람의 정신상태를 판단할 만한 다른 충분한 자료가 있는 경우에는 그렇지 않습니다(「가사소송법」 제45조의2제1항).
피한정후견인(한정후견을 받는 사람) 또는 피특정후견인(특정후견을 받는 사람)은 자신의 정신능력의 악화 또는 회복 정도에 따라 기존의 후견형태를 성년후견으로 바꾸어 보호받을 필요가 있을 수 있는데, 이로 인해 가정법원이 이들에 대해 성년후견개시의 심판을 할 경우에는 종전의 한정후견 또는 특정후견의 종료 심판을 합니다(「민법」 제14조의3조제1항).
※ 한정후견에 관한 자세한 사항은 이 콘텐츠 <성년후견-한정후견> 부분에서 확인하실 수 있습니다.※ 특정후견에 관한 자세한 사항은 이 콘텐츠 <성년후견-특정후견> 부분에서 확인하실 수 있습니다.
심판의 고지
가정법원은 성년후견 개시의 심판을 하는 경우 당사자, 절차에 참가한 이해관계인, 성년후견인(그 심판 및 법률에 따라 임무가 개시되거나 종료될 자 포함) 및 성년후견감독인(그 심판 및 법률에 따라 임무가 개시되거나 종료될 자 포함)에게 심판의 고지를 해야 합니다(「가사소송규칙」 제35조제1항).
즉시항고
가정법원의 성년후견 개시의 심판에 대해 불복을 하는 경우 본인, 배우자, 4촌 이내의 친족, 미성년후견인, 미성년후견감독인, 한정후견인, 한정후견감독인, 특정후견인, 특정후견감독인, 검사, 지방자치단체의 장, 임의후견인 및 임의후견감독인은 2주 이내에 즉시항고를 할 수 있습니다(「가사소송규칙」 제36조제1항제1호가목).
후견등기 촉탁
가정법원은 성년후견 개시의 심판이 확정되거나 효력을 발생한 경우에는 후견등기 사무를 처리하는 사람에게 후견등기부에 등기할 것을 촉탁해야 합니다(「가사소송법」 제9조).
※ 후견등기란 어떤 제도인가요? 성년후견제도의 시행에 따라 「후견등기에 관한 법률」이 제정되었고 그에 따라 새로운 후견등기제도가 생겼습니다. '후견등기제도'란 성년후견, 한정후견, 특정후견 및 임의후견에 관한 사항을 등기의 방법으로 공시하는 제도를 말합니다. 후견관련 사항의 증명이 필요한 사람은 전국 가정법원 또는 가정법원 지원(가정법원 및 가정법원 지원이 설치되어 있지 않은 지역은 지방법원 및 지방법원 지원)의 가족관계등록과 또는 종합민원실에서 등기사항증명서 또는 등기사항부존재증명서를 발급받을 수 있습니다.※ 등기사항증명서에는 어떤 내용이 나오고 등기사항부존재증명서는 무엇인가요? 등기사항증명서에는 피후견인, 후견개시 및 종료, 후견인 및 후견감독인에 관한 사항이 나오며 후견인의 대리권 범위를 확인할 수 있습니다. 등기사항부존재증명서는 현재 효력이 있는 성년후견, 한정후견, 특정후견, 임의후견 등의 후견등기사항이 존재하지 않음을 나타내는 증명서입니다.※ 등기사항증명서 또는 등기사항부존재증명서는 어떤 경우에 발급받나요? 등기사항증명서는 후견인 등이 피후견인을 대리하여 재산의 매매계약이나 간호서비스 제공계약을 체결할 경우 거래의 상대방에게 이를 제시하여 자신의 대리권을 증명하기 위해 발급받을 수 있습니다. 또한, 등기사항부존재증명서는 거래시점 현재 성년후견, 한정후견, 특정후견, 임의후견 등을 받고 있지 않다는 사실을 증명하기 위해 제시할 수 있습니다.※ 등기사항증명서 또는 등기사항부존재증명서는 누가 발급받을 수 있나요? 후견등기에 관한 정보는 사람의 판단능력에 대한 법원의 판단을 내용으로 하는 고도의 프라이버시에 관한 사항이므로 거래의 안전보호와 사생활보호의 조화라는 관점에서 등기사항증명서의 발급을 청구할 수 있는 자는 등기기록에 기록되어 있는 일정한 자 등으로 한정됩니다.따라서 등기사항증명서 또는 등기사항부존재증명서는 피후견인, 배우자, 4촌이내의 친족과 후견인, 후견감독인 및 각 직에서 퇴임한 자 그 밖에 법령상 규정된 사람만이 발급받을 수 있으며 거래 상대방이라는 사유만으로는 발급받을 수 없습니다(「후견등기에 관한 법률」 제15조).[성년후견제도 안내(대법원 블로그, 명쾌한 판사와 함께하는 법원이야기) 참조]
성년후견개시심판 확정 후 피성년후견인의 행위와 취소
성년후견개시의 심판이 있게 되면 피성년후견인 본인은 유효한 법률행위를 할 수 없고 그의 법률행위는 취소할 수 있습니다(「민법」 제10조제1항).
다만, 가정법원은 취소할 수 없는 피성년후견인의 법률행위의 범위를 정할 수 있으며, 본인, 배우자, 4촌 이내의 친족, 성년후견인, 성년후견감독인, 검사 또는 지방자치단체의 장의 청구에 따라 그 범위를 변경할 수도 있습니다(「민법」 제10조제2항·제3항).
성년후견개시의 심판이 있더라도 일용품의 구입 등 일상생활에 필요하고 그 대가가 과도하지 않은 법률행위는 성년후견인이 취소할 수 없습니다(「민법」 제10조제4항).
성년후견인의 선임
가정법원의 성년후견개시심판이 있는 경우에는 그 심판을 받은 사람의 성년후견인을 두어야 하는데, 성년후견인은 가정법원이 직권으로 선임합니다(「민법」 제929조 및 제936조제1항).
가정법원은 성년후견인이 사망, 결격, 그 밖의 사유로 없게 된 경우에도 직권으로 또는 피성년후견인, 친족, 이해관계인, 검사, 지방자치단체의 장의 청구에 따라 성년후견인을 선임합니다(「민법」 제936조제2항).
가정법원은 성년후견인이 선임된 경우에도 필요하다고 인정하면 직권으로 또는 피성년후견인, 친족, 이해관계인, 검사, 지방자치단체의 장이나 성년후견인의 청구에 따라 추가로 성년후견인을 선임할 수 있습니다(「민법」 제936조제3항).
가정법원이 성년후견인을 선임할 경우에는 피성년후견인의 의사를 존중해야 하며, 그 밖에 피성년후견인의 건강, 생활관계, 재산상황, 성년후견인이 될 사람의 직업과 경험, 피성년후견인과의 이해관계의 유무(법인이 성년후견인이 될 경우에는 사업의 종류와 내용, 법인이나 그 대표자와 피성년후견인 사이의 이해관계의 유무를 말함) 등의 사정도 고려해야 합니다(「민법」 제936조제4항).
성년후견인의 수와 결격사유
성년후견인은 피성년후견인의 신상과 재산에 관한 모든 사정을 고려하여 여러 명을 둘 수 있습니다(「민법」 제930조제2항).
다음의 어느 하나에 해당하는 자는 성년후견인이 될 수 없습니다(「민법」 제937조).
미성년자
피성년후견인, 피한정후견인, 피특정후견인, 피임의후견인
회생절차개시결정 또는 파산선고를 받은 자
자격정지 이상의 형의 선고를 받고 그 형기(刑期) 중에 있는 사람
법원에서 해임된 법정대리인
법원에서 해임된 성년후견인, 한정후견인, 특정후견인, 임의후견인과 그 감독인
행방이 불분명한 사람
피후견인을 상대로 소송을 하였거나 하고 있는 사람
피후견인을 상대로 소송을 하였거나 하고 있는 사람의 배우자와 직계혈족(다만, 피후견인의 직계비속은 제외)"
성년후견사무,"성년후견인은 피성년후견인의 여러 사정을 고려하여 그의 복리에 부합하는 방법으로 재산관리와 신상보호 사무를 수행합니다.성년후견인은 피성년후견인의 재산을 관리하고 그 재산에 관한 법률행위에 대해 피성년후견인을 대리합니다. 피성년후견인의 신상에 관해서는 피성년후견인이 본인 스스로 그에 관한 결정을 할 수 없는 경우에 한하여 성년후견인에게 보충적 권한이 인정됩니다.
후견사무 수행의 원칙
성년후견인은 선량한 관리자의 주의로써 후견사무를 처리해야 합니다(「민법」 제681조 및 제956조).
성년후견인은 피성년후견인(성년후견을 받는 사람을 말함. 이하 같음)의 재산관리와 신상보호를 할 때 여러 사정을 고려하여 그의 복리에 부합하는 방법으로 사무를 처리해야 합니다. 이 경우 성년후견인은 피성년후견인의 복리에 반하지 않으면 피성년후견인의 의사를 존중해야 합니다(「민법」 제947조).
피성년후견인의 신상결정
피성년후견인은 자신의 신상에 관해 그의 상태가 허락하는 범위에서 단독으로 결정합니다(「민법」 제947조의2제1항).
피성년후견인의 신상에 대한 보호
성년후견인이 피성년후견인을 치료 등의 목적으로 정신병원이나 그 밖의 다른 장소에 격리하려는 경우에는 가정법원의 허가를 받아야 합니다(「민법」 제947조의2제2항).
피성년후견인의 신체를 침해하는 의료행위에 대해 피성년후견인이 동의할 수 없는 경우에는 성년후견인이 그를 대신하여 동의할 수 있습니다(「민법」 제947조의2제3항).
위의 경우 피성년후견인이 의료행위의 직접적인 결과로 사망하거나 상당한 장애를 입을 위험이 있을 때에는 가정법원의 허가를 받아야 합니다. 다만, 허가절차로 의료행위가 지체되어 피성년후견인의 생명에 위험을 초래하거나 심신상의 중대한 장애를 초래할 때에는 사후에 허가를 청구할 수 있습니다(「민법」 제947조의2제4항).
성년후견인이 피성년후견인을 대리하여 피성년후견인이 거주하고 있는 건물 또는 그 대지에 대하여 매도, 임대, 전세권 설정, 저당권 설정, 임대차의 해지, 전세권의 소멸, 그 밖에 이에 준하는 행위를 하는 경우에는 가정법원의 허가를 받아야 합니다(「민법」 제947조의2제5항).
피성년후견인의 재산관리 및 법률행위 대리
성년후견인은 피성년후견인의 재산을 관리하고 그 재산에 관한 법률행위에 대해 피성년후견인을 대리합니다(「민법」 제949조제1항).
성년후견인은 포괄적인 법정대리권을 가지나, 가정법원은 피성년후견인의 재산이나 신상에 관한 제반사정을 고려하여 법정대리권의 범위를 정할 수 있고 사정의 변경에 따라 법정대리권의 범위가 적절하지 않게 된 경우에는 이를 변경할 수도 있습니다(「민법」 제938조).
후견감독인의 동의가 필요한 행위
성년후견인이 피성년후견인을 대리하여 다음의 어느 하나에 해당하는 행위를 할 경우에는 성년후견감독인이 있으면 그의 동의를 받아야 합니다(「민법」 제950조제1항).
영업에 관한 행위
금전을 빌리는 행위
의무만을 부담하는 행위
부동산 또는 중요한 재산에 관한 권리의 득실변경을 목적으로 하는 행위
소송행위
상속의 승인, 한정승인 또는 포기 및 상속재산의 분할에 관한 협의
성년후견감독인의 동의가 필요한 행위에 대해 성년후견감독인이 피성년후견인의 이익이 침해될 우려가 있음에도 동의를 하지 않는 경우에는 가정법원은 성년후견인의 청구에 따라 성년후견감독인의 동의를 갈음하는 허가를 할 수 있습니다(「민법」 제950조제2항).
성년후견감독인의 동의가 필요한 법률행위를 성년후견인이 성년후견감독인의 동의 없이 했을 경우에는 피성년후견인 또는 성년후견감독인이 그 행위를 취소할 수 있습니다(「민법」 제950조제3항).
성년후견인은 피성년후견인이 능력자가 된 후에 그에게 1개월 이상의 기간을 정하여 그 취소할 수 있는 행위를 추인할 것인지 여부의 확답을 촉구할 수 있습니다. 능력자로 된 사람이 그 기간 내에 확답을 발송하지 않으면 그 행위를 추인한 것으로 봅니다(「민법」 제15조제1항 및 제952조).
다만, 특별한 절차가 필요한 행위는 그 정해진 기간 내에 그 절차를 밟은 확답을 발송하지 않으면 취소한 것으로 봅니다(「민법」 제15조제3항 및 제952조).
※ '추인'이란 「민법」상 불완전한 법률행위를 사후에 이르러 보충하여 완전하게 하는 일방적인 의사표시를 말하며, 취소할 수 있는 행위의 추인, 무권대리행위의 추인, 무효행위의 추인 등이 있습니다(법제처·한국법제연구원, 『법령용어사례집』 참조).
피성년후견인의 재산에 관한 성년후견인의 권한 제한
성년후견인은 피성년후견인의 행위를 목적으로 하는 채무를 부담할 경우에는 본인의 동의를 얻어야 합니다(「민법」 제920조 단서 및 제949조제2항).
성년후견인과 피성년후견인 사이에 이해상반되는 행위를 하는 경우 성년후견인은 법원에 피성년후견인의 특별대리인 선임을 청구해야 합니다. 다만, 후견감독인이 있는 경우에는 그렇지 않습니다(「민법」 제949조의3).
※ ""이해상반행위""란 성년후견인이 하는 행위의 객관적 성질상 성년후견인과 피성년후견인 사이에 이해의 대립이 생길 우려가 있는 행위를 가리키는 것으로서 성년후견인의 의도나 그 행위의 결과 실제로 이해의 대립이 생겼는가의 여부는 묻지 않습니다(대법원 1993. 4. 13. 선고 92다54524 판결 참조).
성년후견인이 피성년후견인에 대한 제3자의 권리를 양수(讓受)하는 경우에는 피성년후견인은 이를 취소할 수 있습니다(「민법」 제951조제1항).
위에 따른 권리의 양수의 경우 성년후견감독인이 있으면 성년후견인은 성년후견감독인의 동의를 받아야 하고, 성년후견감독인의 동의가 없는 경우에는 피성년후견인 또는 성년후견감독인이 이를 취소할 수 있습니다(「민법」 제951조제2항).
성년후견인은 피성년후견인이 능력자가 된 후에 그에게 1개월 이상의 기간을 정하여 그 취소할 수 있는 행위를 추인할 것인지 여부의 확답을 촉구할 수 있습니다. 능력자로 된 사람이 그 기간 내에 확답을 발송하지 않으면 그 행위를 추인한 것으로 봅니다(「민법」 제15조제1항 및 제952조).
√ 다만, 특별한 절차가 필요한 행위는 그 정해진 기간 내에 그 절차를 밟은 확답을 발송하지 않으면 취소한 것으로 봅니다(「민법」 제15조제3항 및 제952조).
보수의 지급 및 사무비용의 처리
법원은 성년후견인의 청구에 따라 피성년후견인의 재산상태 그 밖의 사정을 참작하여 피성년후견인의 재산 중에서 상당한 보수를 성년후견인에게 지급할 수 있습니다(「민법」 제955조).
성년후견인이 후견사무를 수행하는 데 필요한 비용은 피성년후견인의 재산 중에서 지출합니다(「민법」 제955조의2).
※ 후견관련 비용의 지불능력이 없는 사람은 어떤 도움을 받을 수 있나요?  가정법원은 취약계층을 위해 후견관련 심판절차에 드는 비용을 지출할 자금능력이 없거나 그 비용을 지출하면 생활에 현저한 지장이 있는 사람에 대하여는 그 사람의 신청에 따라 또는 직권으로 절차구조(節次救助)를 할 수 있습니다. 다만, 신청인이 부당한 목적으로 심판청구를 하는 것이 명백한 경우에는 그렇지 않습니다(「가사소송법」 제37조의2제1항)."
