cate2,paragraph
후견의 의의와 종류,"후견은 친권에 의한 보호를 받지 못하는 미성년자 또는 장애·질병·노령 등으로 인해 사무처리 능력에 도움이 필요한 성인에게 폭넓은 보호와 지원을 제공하기 위한 제도입니다.후견제도에는 미성년후견제도와 성년후견제도가 있습니다.
후견의 의의
후견은 친권에 의한 보호를 받지 못하는 미성년자 또는 장애·질병·노령 등으로 인해 사무처리 능력에 도움이 필요한 성인에게 폭넓은 보호와 지원을 제공하기 위한 제도입니다.
후견사무는 후견인이 수행하며, 후견인의 권한남용을 방지하고 피후견인(후견을 받는 사람을 말함, 이하 같음) 보호에 만전을 기하기 위해 가정법원과 후견감독인은 후견인의 후견사무를 감독합니다.
미성년후견제도
미성년후견제도란 미성년자에게 친권자가 없거나 친권의 상실 또는 일시 정지, 일부 제한 선고, 대리권∙재산관리권 상실선고, 친권자의 대리권∙재산관리권 사퇴에 따라 친권의 전부 또는 일부를 행사할 수 없는 경우에 후견인을 두도록 하는 것을 말합니다(「민법」 제928조).
성년후견제도
성년후견제도란 질병, 장애, 노령, 그 밖의 사유로 인한 정신적 제약으로 후견이 필요한 성인의 권익보호와 지원을 위해 마련된 제도로서 다음과 같이 구분됩니다(「민법」 제9조, 제12조, 제14조의2 및 제959조의14 참조).
종류 내용
성년후견 질병, 장애, 노령, 그 밖의 사유로 인한 정신적 제약으로 사무를 처리할 능력이 지속적으로 결여된 사람에 대하여 법원이 일정한 자들의 청구에 따라 후견인을 선임하는 것
한정후견 질병, 장애, 노령, 그 밖의 사유로 인한 정신적 제약으로 사무를 처리할 능력이 부족한 사람에 대하여 법원이 일정한 자들의 청구에 따라 후견인을 선임하는 것
특정후견 질병, 장애, 노령, 그 밖의 사유로 인한 정신적 제약으로 일시적 후원 또는 특정한 사무에 관한 후원이 필요한 사람에 대하여 법원이 일정한 자들의 청구에 따라 후견인을 선임하는 것
임의후견 질병, 장애, 노령, 그 밖의 사유로 인한 정신적 제약으로 사무를 처리할 능력이 부족한 상황에 있거나 부족하게 될 상황에 대비하여 자신의 재산관리 및 신상보호에 관한 사무의 전부 또는 일부를 스스로 다른 자에게 위탁하고 그 위탁사무에 관하여 대리권을 수여하는 계약을 체결하도록 하는 것
미성년후견제도와 성년후견제도의 비교
미성년후견제도와 성년후견제도의 기본적인 내용을 비교해 살펴보면 다음과 같습니다.
내용 미성년후견제도 성년후견제도
피후견인 선임사유 친권자가 없거나 친권자가 법률행위의 대리권과 재산관리권을 행사할 수 없는 경우 질병, 장애, 노령, 그 밖의 사유로 인한 정신적 제약
후견인 자격 친족 또는 제3자(법인 제외) 친족 또는 제3자(법인 포함)
수 1명 여러 명도 가능
선임 유언에 의한 지정 또는 법원의 선임 법원의 선임
감독기관 법원, 후견감독인 법원, 후견감독인
후견감독인 선임 유언에 의한 지정 또는 법원의 선임 법원의 선임
공시 방법 가족관계등록부 후견등기부"
미성년후견의 개시,"미성년자에게 친권자가 없거나 친권의 상실 또는 일시 정지, 일부 제한 선고, 대리권∙재산관리권 상실선고, 친권자의 대리권∙재산관리권 사퇴에 따라 친권의 전부 또는 일부를 행사할 수 없는 경우에는 미성년후견인을 두어야 합니다. 미성년후견은 친권자의 유언에 의한 지정 또는 법원에 의한 선임으로 개시됩니다. 미성년후견인은 1명만 둘 수 있으며, 미성년자의 신분 및 재산 보호에 부적합한 사람은 미성년후견인이 될 수 없습니다.
미성년후견제도의 의의
미성년자에게 친권자가 없거나 친권의 상실 또는 일시 정지, 일부 제한 선고, 대리권∙재산관리권 상실선고, 친권자의 대리권∙재산관리권 사퇴에 따라 친권의 전부 또는 일부를 행사할 수 없는 경우에는 미성년후견인을 두어야 합니다(「민법」 제928조).
미성년후견 개시사유
미성년후견은 친권자가 사망하거나 친권의 상실 또는 일시 정지, 일부 제한 선고에 따라 친권자가 친권의 전부 또는 일부를 행사할 수 없는 경우에 개시됩니다(「민법」 제924조, 제924조의2 및 제928조).
가정법원은 미성년자의 친권자가 부적당한 관리로 인해 자녀의 재산을 위태롭게 한 경우 법률행위의 대리권과 재산관리권을 상실시킬 수 있는데, 이와 같이 친권자가 법률행위의 대리권과 재산관리권에 한정하여 친권을 행사할 수 없는 경우에도 미성년후견이 개시됩니다(「민법」 제925조 및 제928조).
법정대리인인 친권자가 법원의 허가를 얻어 그 법률행위의 대리권과 재산관리권을 사퇴하는 경우에도 미성년후견이 개시됩니다(「민법」 제927조제1항 및 제928조).
※ '친권'이란 부모가 미성년자인 자녀에 대해 가지는 신분·재산상의 권리와 의무를 말합니다. 부모는 미성년자인 자녀의 친권자가 되고, 양자(養子)의 경우에는 양부모가 친권자가 됩니다(「민법」 제909조제1항).
미성년후견 개시방법
유언에 의한 지정
미성년자에게 친권을 행사하는 부모는 유언으로 미성년후견인을 지정할 수 있습니다. 다만, 법률행위의 대리권과 재산관리권이 없는 친권자는 유언으로 미성년후견인을 지정할 수 없습니다(「민법」 제931조제1항).
가정법원은 위에 따라 부모의 유언으로 미성년후견인이 지정된 경우라도 미성년자의 복리를 위해 필요하면 생존하는 부 또는 모, 미성년자의 청구에 따라 후견을 종료하고 생존하는 부 또는 모를 친권자로 지정할 수 있습니다(「민법」 제931조제2항).
가정법원에 의한 선임
가정법원은 유언으로 지정된 미성년후견인이 없는 경우 또는 미성년후견인이 없게 된 경우에는 직권으로 또는 미성년자, 친족, 이해관계인, 검사, 지방자치단체의 장의 청구에 따라 미성년후견인을 선임합니다(「민법」 제932조제1항).
가정법원은 친권의 상실, 일시 정지, 일부 제한의 선고 또는 법률행위의 대리권이나 재산관리권 상실의 선고에 따라 미성년후견인을 선임할 필요가 있는 경우에는 직권으로 미성년후견인을 선임합니다(「민법」 제932조제2항).
친권자는 대리권 및 재산관리권을 사퇴한 경우 지체 없이 가정법원에 미성년후견인의 선임을 청구해야 합니다(「민법」 제932조제3항).
미성년후견인 선임 시 의견청취절차
√ 가정법원은 미성년후견인을 선임하는 경우 미성년후견인이 될 자의 의견을 들어야 합니다(「가사소송규칙」 제65조제1항).
√ 가정법원은 미성년후견인을 선임하는 경우 그 미성년자가 13세 이상인 때에는 그 미성년자의 의견을 들어야 합니다. 다만, 미성년자의 의견을 들을 수 없거나 미성년자의 의견을 듣는 것이 오히려 미성년자의 복지를 해할만한 특별한 사정이 있다고 인정되는 경우에는 그렇지 않습니다(「가사소송규칙」 제65조제4항).
미성년후견인의 수와 결격사유
미성년후견인의 수는 성년후견과 달리 한 명으로 제한됩니다(「민법」 제930조제1항).
다음의 어느 하나에 해당하는 자는 미성년후견인이 될 수 없습니다(「민법」 제930조제3항 및 제937조).
법인
미성년자
피성년후견인, 피한정후견인, 피특정후견인, 피임의후견인
회생절차개시결정 또는 파산선고를 받은 자
자격정지 이상의 형의 선고를 받고 그 형기(刑期) 중에 있는 사람
법원에서 해임된 법정대리인
법원에서 해임된 성년후견인, 한정후견인, 특정후견인, 임의후견인과 그 감독인
행방이 불분명한 사람
피후견인을 상대로 소송을 하였거나 하고 있는 사람
피후견인을 상대로 소송을 하였거나 하고 있는 사람의 배우자와 직계혈족(다만, 피후견인의 직계비속은 제외)
미성년후견 개시신고
미성년후견이 개시되면 미성년후견인은 취임일로부터 1개월 이내에 미성년후견 개시신고서에 다음의 서류를 첨부하여 자신의 주소지나 현재지 시·구·읍·면의 장에게 후견개시신고를 해야 합니다[「가족관계의 등록 등에 관한 법률」 제20조제1항 본문, 제80조, 제82조 및 「가족관계등록사무의 문서 양식에 관한 예규」(가족관계등록예규 제543호, 시행 2019. 12. 19. 발령, 2019. 12. 27. 시행) 양식 16].
유언으로 미성년후견인을 지정한 경우 : 지정에 관한 유언서 등본 또는 유언녹음을 기재한 서면
미성년후견인 선임의 재판이 있는 경우 : 재판서 등본
※ 다만, 외국에 거주하거나 체류하는 대한민국 국민의 경우 재외국민 가족관계등록사무소에서도 할 수 있습니다(「가족관계의 등록 등에 관한 법률」 제20조제1항 단서).
미성년후견인이 정당한 사유 없이 미성년후견개시신고를 기간 내에 하지 않은 경우에는 5만원 이하의 과태료가 부과됩니다(「가족관계의 등록 등에 관한 법률」 제122조)."
미성년후견사무,"미성년후견인은 선량한 관리자의 주의로써 후견사무를 처리해야 하며, 취임 시 재산조사 및 목록작성, 후견인과 피후견인 사이에 존재하는 채권·채무의 제시 등의 사무를 수행해야 합니다. 미성년자에게 친권자가 없는 경우 미성년후견인은 피후견인의 신분 및 재산보호를 위한 사무를 처리합니다. 다만, 미성년자에게 친권자가 있으나 그 친권자가 법률행위의 대리권과 재산관리권만을 행사할 수 없을 경우 후견인의 후견사무범위는 미성년자의 재산보호에 한정됩니다.
미성년자에게 친권자가 없는 경우
미성년후견인은 피후견인(미성년후견을 받는 미성년자를 말함. 이하 같음)의 신분 및 재산에 관한 포괄적인 사무를 처리합니다.
친권자가 있으나 그 친권자가 친권 중 일부에 한정하여 행사할 수 없는 경우
친권의 일부 제한 선고, 대리권∙재산관리권의 상실선고 및 친권자의 대리권∙재산관리권 사퇴에 따라 친권 중 일부에 한정하여 행사할 수 없는 경우에 미성년후견인의 임무는 제한된 친권의 범위에 속하는 행위에 한정됩니다(「민법」 제946조).
후견사무처리의 기본원칙
미성년후견인은 선량한 관리자의 주의로써 후견사무를 처리해야 합니다(「민법」 제681조 및 제956조).
피후견인의 보호·교양 등
미성년후견인은 피후견인의 보호·교양, 거소지정, 징계, 감화 또는 교정기관에의 위탁 등의 사항에 관해서는 친권자와 같은 권리와 의무가 있습니다. 다만, 다음의 어느 하나에 해당하는 경우에는 미성년후견감독인이 있으면 그의 동의를 받아야 합니다(「민법」 제913조부터 제915조까지 및 제945조).
친권자가 정한 교육방법, 양육방법 또는 거소를 변경하는 경우
미성년자를 감화기관이나 교정기관에 위탁하는 경우
친권자가 허락한 영업을 취소하거나 제한하는 경우
피후견인의 신분행위에 대한 대리
미성년후견인은 법정대리인으로서 다음과 같은 피후견인의 신분행위에 대한 대리권을 갖습니다.
연령위반 혼인의 취소(「민법」 제817조)
13세 미만인 피후견인이 양자가 될 경우 그를 갈음하여 입양을 승낙하는 것(「민법」 제869조제2항)
양자가 된 13세 미만인 피후견인이 파양청구를 할 경우 그를 갈음하여 파양을 청구하는 것(「민법」 제906조제1항)
13세 미만인 피후견인이 친양자가 될 경우 그를 갈음하여 입양을 승낙하는 것(「민법」 제908조의2제1항)
미성년자가 양친이 되는 입양의 취소청구(「민법」 제886조)
상속회복청구권의 행사(「민법」 제999조)
상속의 승인 및 포기(「민법」 제1019조 및 제1020조)
혼인무효소송 등 신분관계에 관한 소송(「가사소송법」 제23조, 제28조 및 제31조)
피후견인의 신분행위에 대한 동의
미성년후견인은 법정대리인으로서 약혼, 혼인과 같은 피후견인의 신분행위에 대한 동의권을 갖습니다(「민법」 제801조 및 제808조제1항).
친권의 대행
미성년후견인은 피후견인인 미성년자를 대신하여 그 미성년자의 자녀에 대한 친권을 행사합니다(「민법」 제948조제1항).
이러한 친권대행에는 미성년후견인의 임무에 관한 규정을 준용합니다. 따라서 미성년후견인은 직접 피후견인인 미성년자의 자녀에 대해 자신이 직접 후견인이 되는 것과 같은 제약을 받습니다(「민법」 제948조제2항).
※ '준용'이란 어떤 사항을 규율하기 위해 만들어진 법규를 그것과 비슷하나 성질이 다른 사항에 대해 필요한 약간의 수정을 가하여 적용시키는 것으로, 같은 종류의 규정을 되풀이하는 번잡을 피하기 위한 입법기술의 하나입니다(법제처·한국법제연구원, 『법령용어사례집』 참조).
재산조사와 목록작성
미성년후견인은 취임 후 지체 없이 피후견인의 재산을 조사하여 2개월 내에 그 목록을 작성해야 합니다. 다만, 정당한 사유가 있는 경우에는 법원의 허가를 받아 그 기간을 연장할 수 있습니다(「민법」 제941조제1항).
위에 따른 재산조사와 목록작성은 후견감독인의 참여가 없으면 효력이 없습니다(「민법」 제941조제2항).
미성년후견인은 재산조사와 목록작성을 완료하기까지는 긴급 필요한 경우가 아니면 그 재산에 관한 권한을 행사하지 못합니다. 그러나 이로써 선의의 제3자에게 대항하지는 못합니다(「민법」 제943조).
※ '긴급 필요한 경우'란 재산목록의 작성 전에 이를 하지 않으면 피후견인의 신상 또는 재산에 관하여 후일 이를 회복하기 어려운 불이익을 가져오게 할 경우를 말합니다(대법원 1997. 11. 28. 선고 97도1368 판결).※ '선의의 제3자에게 대항하지 못한다.'는 말은 법률행위의 당사자가 제3자[일정한 사실을 알지 못하는 당사자 및 그 포괄승계인(예：상속인) 이외의 모든 자를 말함]에 대해 그 법률행위의 효력을 주장하지 못한다는 것(다만, 제3자가 그 효력을 인정하는 것은 가능)을 의미합니다.예를 들어, 미성년후견인이 재산조사와 목록작성을 완료하기 전에 긴급 필요한 경우가 아닌데도 미성년자소유의 토지를 매매한 경우 그 매매계약의 당사자인 매수인으로부터 그러한 사실을 모르고 해당 토지를 다시 매수한 사람(선의의 제3자)에게는 미성년후견인의 권한 없음을 이유로 그 매매의 무효를 주장할 수 없게 됩니다.<국가법령정보센터 법령용어 참조>
미성년후견인의 취임 후에 피후견인이 포괄적 재산을 취득한 경우에도 미성년후견인은 위와 같은 재산조사와 그 목록작성을 해야 합니다(「민법」 제944조).
후견인과 피후견인 간의 채권·채무의 제시
미성년후견인과 피후견인 사이에 채권·채무의 관계가 있고 후견감독인이 있는 경우에는 미성년후견인은 재산목록의 작성을 완료하기 전에 그 내용을 후견감독인에게 제시해야 합니다(「민법」 제942조제1항).
후견인이 피후견인에 대한 채권이 있음을 알고도 위에 따른 제시를 게을리한 경우에는 그 채권을 포기한 것으로 봅니다(「민법」 제942조제2항).
미성년후견인의 취임 후에 피후견인이 포괄적 재산을 취득한 경우에도 미성년후견인은 위와 같은 채권·채무의 제시를 해야 합니다(「민법」 제944조).
피후견인의 재산관리 및 법률행위 대리
미성년후견인은 피후견인의 재산을 관리하고 그 재산에 관한 법률행위에 대해 피후견인을 대리합니다(「민법」 제949조제1항).
다만, 피후견인의 행위를 목적으로 하는 채무를 부담할 경우에는 본인의 동의를 얻어야 합니다(「민법」 제920조 단서 및 제949조제2항).
미성년후견인은 피후견인의 근로계약을 대리할 수 없습니다. 따라서 피후견인은 후견인의 동의를 받아 본인 스스로 직접 근로계약을 체결합니다(「근로기준법」 제67조제1항).
다만, 위의 근로계약이 미성년자에게 불리하다고 인정하는 경우 미성년후견인은 이를 해지할 수 있습니다(「근로기준법」 제67조제2항).
후견감독인의 동의가 필요한 행위
미성년후견인이 피후견인을 대리하여 다음의 어느 하나에 해당하는 행위를 하거나 피후견인의 다음의 어느 하나에 해당하는 행위에 동의를 할 경우에는 후견감독인이 있으면 그의 동의를 받아야 합니다(「민법」 제950조제1항).
영업에 관한 행위
금전을 빌리는 행위
의무만을 부담하는 행위
부동산 또는 중요한 재산에 관한 권리의 득실변경을 목적으로 하는 행위
소송행위
상속의 승인, 한정승인 또는 포기 및 상속재산의 분할에 관한 협의
후견감독인의 동의가 필요한 행위에 대하여 후견감독인이 피후견인의 이익이 침해될 우려가 있음에도 동의를 하지 않는 경우에는 가정법원은 미성년후견인의 청구에 따라 후견감독인의 동의를 갈음하는 허가를 할 수 있습니다(「민법」 제950조제2항).
후견감독인의 동의가 필요한 법률행위를 미성년후견인이 후견감독인의 동의 없이 했을 경우에는 피후견인 또는 후견감독인이 그 행위를 취소할 수 있습니다(「민법」 제950조제3항).
피후견인의 재산에 관한 미성년후견인의 권한 제한
제3자가 무상으로 피후견인에게 재산을 수여하면서 후견인의 관리에 반대하는 의사표시를 한 경우 후견인은 그 재산을 관리하지 못합니다(「민법」 제918조제1항 및 제956조).
위 경우에 제3자가 그 재산관리인을 지정하지 않은 때에는 법원은 재산을 수여받은 자 또는 친족(배우자, 8촌 이내의 혈족 또는 4촌 이내의 인척)의 청구에 따라 관리인을 선임합니다(「민법」 제777조, 제918조제2항 및 제956조).
후견인과 피후견인 사이에 이해상반행위를 하는 경우 후견인은 법원에 그 피후견인의 특별대리인의 선임을 청구해야 합니다(「민법」 제921조 및 제949조의3).
※ '이해상반행위'란 미성년후견인이 하는 행위의 객관적 성질상 후견인과 피후견인 사이에 이해의 대립이 생길 우려가 있는 행위를 가리키는 것으로서 후견인의 의도나 그 행위의 결과 실제로 이해의 대립이 생겼는가의 여부는 묻지 않습니다(대법원 1993. 4. 13. 선고 92다54524 판결 참조).
미성년후견인이 피후견인에 대한 제3자의 권리를 양수(讓受)하는 경우에는 피후견인은 이를 취소할 수 있습니다(「민법」 제951조제1항).
위에 따른 권리의 양수의 경우 후견감독인이 있으면 미성년후견인은 후견감독인의 동의를 받아야 하고, 후견감독인의 동의가 없는 경우에는 피후견인 또는 후견감독인이 이를 취소할 수 있습니다(「민법」 제951조제2항).
보수의 지급 및 사무비용의 처리
법원은 미성년후견인의 청구에 따라 피후견인의 재산상태 그 밖의 사정을 참작하여 피후견인의 재산 중에서 상당한 보수를 후견인에게 지급할 수 있습니다(「민법」 제955조).
미성년후견인이 후견사무를 수행하는 데 필요한 비용은 피후견인의 재산 중에서 지출합니다(「민법」 제955조의2)."
